playername,playerid,vsname,vsid,date,Play
A_Achter,1138,T Hernandez,1306,2016-09-24,Teoscar Hernandez flied out to right (Fly).
A_Achter,1138,E Gattis,1100,2016-09-24,Evan Gattis grounded out to shortstop (Grounder).
A_Achter,1138,C Correa,1416,2016-10-01,Carlos Correa struck out looking.
A_Achter,1138,C Beltran,589&,2016-09-19,Carlos Beltran grounded out to first (Grounder).
A_Achter,1138,J Smolinski,5408,2016-09-05,Jake Smolinski flied out to right (Fliner (Liner)).
A_Achter,1138,C Gomez,4881,2016-09-21,Carlos Gomez grounded out to third (Grounder).
A_Achter,1138,G Springer,1285,2016-10-01,George Springer flied out to right (Fliner (Fly)). Jake Marisnick advanced to 3B.
A_Achter,1138,J Altuve,5417,2016-09-23,Jose Altuve grounded into a double play to shortstop (Grounder). Yulieski Gurriel out at second.
A_Achter,1138,T Tulowitzki,3531,2016-09-18,Troy Tulowitzki grounded out to shortstop (Grounder).
A_Achter,1138,J Lucroy,7870,2016-09-10,Jonathan Lucroy flied out to second (Fly).
A_Achter,1138,J Smolinski,5408,2016-09-28,Jake Smolinski struck out swinging.
A_Achter,1138,R Rua,1240,2016-09-10,Ryan Rua struck out swinging.
A_Achter,1138,S Souza Jr.,5667,2016-05-06,Steven Souza Jr. was forced out.
A_Achter,1138,M Machado,1149,2016-05-20,Manny Machado flied out to left (Fliner (Fly)).
A_Achter,1138,J Upton,5222,2016-08-26,Justin Upton fouled out to first (Fly).
A_Achter,1138,M Saunders,9981,2016-08-23,Michael Saunders grounded out to first (Grounder).
A_Achter,1138,M Upton Jr.,5015,2016-08-23,Melvin Upton Jr. flied out to center (Fliner (Fly)). Russell Martin advanced to 3B.
A_Achter,1138,D Navarro,3179,2016-09-18,Dioner Navarro flied out to shortstop (Fliner (Fly)).
A_Achter,1138,E Gattis,1100,2016-06-20,Evan Gattis grounded into a double play to shortstop (Grounder). Luis Valbuena out at second.
A_Achter,1138,J Bautista,1887,2016-09-15,Jose Bautista grounded into a double play to second (Grounder). Ezequiel Carrera out at second.
A_Achter,1138,Y Alonso,2530,2016-06-25,Yonder Alonso grounded into a double play to second (Grounder). Danny Valencia out at second.
A_Achter,1138,R Rua,1240,2016-04-09,Ryan Rua struck out swinging.
A_Achter,1138,C Crisp,1572,2016-06-23,Coco Crisp flied out to left (Fliner (Fly)).
A_Achter,1138,C Correa,1416,2016-09-23,Carlos Correa flied out to center (Fly).
A_Achter,1138,M Semien,1253,2016-09-07,Marcus Semien out on a dropped third strike.
A_Achter,1138,R Flores,1116,2016-05-02,Ramon Flores grounded out to second (Grounder).
A_Achter,1138,J Lucroy,7870,2016-09-19,Jonathan Lucroy was intentionally walked.
A_Achter,1138,S Vogt,5000,2016-09-28,Stephen Vogt flied out to shortstop (Fly).
A_Achter,1138,J Smolinski,5408,2016-06-23,Jake Smolinski grounded out to pitcher (Grounder).
A_Achter,1138,K Hernandez,1047,2016-05-17,Kiké Hernandez flied out to right (Fly).
A_Achter,1138,M Trumbo,6876,2016-05-20,Mark Trumbo struck out swinging.
A_Achter,1138,S Vogt,5000,2016-09-07,Stephen Vogt grounded out to shortstop (Grounder).
A_Achter,1138,D DeShields,1137,2016-04-09,Delino DeShields flied out to center (Fly).
A_Achter,1138,M Wieters,4298,2016-05-20,Matt Wieters flied out to left (Fly).
A_Achter,1138,P Janish,7412,2016-05-20,Paul Janish lined out to third (Liner).
A_Achter,1138,B Zobrist,7435,2016-08-09,Ben Zobrist grounded out to second (Grounder).
A_Achter,1138,J Gyorko,1081,2016-05-10,Jedd Gyorko flied out to center (Fliner (Fly)).
A_Achter,1138,S Piscotty,1336,2016-05-10,Stephen Piscotty flied out to third (Fly).
A_Achter,1138,Y Grandal,1136,2016-05-18,Yasmani Grandal grounded out to second (Grounder).
A_Achter,1138,J Thole,9689,2016-08-23,Josh Thole flied out to third (Fly).
A_Achter,1138,R Grossman,5254,2016-06-13,Robbie Grossman flied out to left (Fliner (Fly)).
A_Achter,1138,Y Alonso,2530,2016-06-18,Yonder Alonso flied out to left (Fly).
A_Achter,1138,J Mauer,1857,2016-06-13,Joe Mauer grounded out to second (Grounder).
A_Achter,1138,B Dozier,9810,2016-06-13,Brian Dozier struck out swinging.
A_Achter,1138,M Kepler,1214,2016-06-13,Max Kepler flied out to left (Fly).
A_Achter,1138,S Piscotty,1336,2016-05-10,Stephen Piscotty grounded out to third (Grounder).
A_Achter,1138,J Altuve,5417,2016-06-20,Jose Altuve flied out to right (Fly).
A_Achter,1138,K Hernandez,1047,2016-05-18,Kiké Hernandez grounded out to third (Grounder).
A_Achter,1138,T Kemp,1489,2016-06-20,Tony Kemp grounded out to first (Grounder).
A_Achter,1138,B Gamel,1216,2016-09-13,Ben Gamel flied out to right (Fly).
A_Achter,1138,C Rasmus,9893,2016-06-20,Colby Rasmus struck out swinging.
A_Achter,1138,L Valbuena,4969,2016-06-20,Luis Valbuena grounded out to shortstop (Grounder).
A_Achter,1138,K Marte,1361,2016-09-13,Ketel Marte grounded out to shortstop (Grounder).
A_Achter,1138,G Heredia,1872,2016-09-13,Guillermo Heredia singled to center (Fliner (Liner)).
A_Achter,1138,T Plouffe,7462,2016-06-13,Trevor Plouffe walked.
A_Achter,1138,Y Puig,1422,2016-05-18,Yasiel Puig walked.
A_Achter,1138,J Villar,1007,2016-05-02,Jonathan Villar walked.
A_Achter,1138,C Gomez,4881,2016-06-20,Carlos Gomez singled to right (Grounder). Colby Rasmus advanced to 2B.
A_Achter,1138,R Grichuk,1024,2016-05-10,Randal Grichuk reached on error to third (Grounder). Randal Grichuk advanced to 2B. Error by Yunel Escobar.
A_Achter,1138,L Valbuena,4969,2016-06-20,Luis Valbuena singled to center (Liner). Colby Rasmus advanced to 3B. Carlos Gomez advanced to 2B.
A_Achter,1138,T Thompson,9952,2016-05-17,Trayce Thompson singled to center (Fliner (Liner)).
A_Achter,1138,J Lowrie,4418,2016-06-25,Jed Lowrie singled to center (Grounder).
A_Achter,1138,C Davis,9272,2016-05-20,Chris Davis walked.
A_Achter,1138,M Muncy,1330,2016-06-18,Max Muncy doubled to center (Fliner (Fly)).
A_Achter,1138,Y Alonso,2530,2016-09-07,Yonder Alonso singled to center (Grounder). Khris Davis advanced to 2B.
A_Achter,1138,J Altuve,5417,2016-06-20,Jose Altuve singled to left (Grounder).
A_Achter,1138,B Miller,1277,2016-05-06,Brad Miller singled to center (Grounder).
A_Achter,1138,S Souza Jr.,5667,2016-05-06,Steven Souza Jr. doubled to left (Liner).
A_Achter,1138,M Holliday,1873,2016-05-10,Matt Holliday homered (Fliner (Fly)).
A_Achter,1138,Y Gurriel,1919,2016-09-23,Yulieski Gurriel walked.
A_Achter,1138,Y Gurriel,1919,2016-10-01,Yulieski Gurriel walked.
A_Achter,1138,M Carpenter,8090,2016-05-10,Matt Carpenter homered (Fliner (Fly)).
A_Achter,1138,J Pederson,1189,2016-05-17,Joc Pederson homered (Fly).
A_Achter,1138,J Altuve,5417,2016-10-01,Jose Altuve walked. Yulieski Gurriel advanced to 2B.
A_Achter,1138,M Wieters,4298,2016-05-20,Matt Wieters singled to center (Fliner (Liner)).
A_Achter,1138,J Rickard,1327,2016-05-20,Joey Rickard singled to left (Grounder). Jonathan Schoop scored. Paul Janish advanced to 2B.
A_Achter,1138,D Valencia,6364,2016-09-05,Danny Valencia walked.
A_Achter,1138,M Semien,1253,2016-09-05,Marcus Semien doubled to right (Fly).
A_Achter,1138,A Beltre,639&,2016-09-19,Adrian Beltre singled to center (Fliner (Liner)).
A_Achter,1138,Y Gurriel,1919,2016-10-01,Yulieski Gurriel doubled to left (Fliner (Liner)).
A_Achter,1138,E Gattis,1100,2016-10-01,Evan Gattis singled to shortstop (Grounder). Yulieski Gurriel scored.
A_Achter,1138,R Odor,1228,2016-09-19,Rougned Odor doubled to right (Grounder). Adrian Beltre advanced to 3B.
