playername,playerid,vsname,vsid,date,Play
A_Bradley,1291,J Cueto,6893,2016-09-10,Johnny Cueto singled to right (Liner). Brandon Crawford scored. Hunter Pence advanced to 3B. Eduardo Nunez advanced to 2B.
A_Bradley,1291,Y Solarte,5352,2016-05-29,Yangervis Solarte doubled to center (Fliner (Liner)).
A_Bradley,1291,C Seager,1362,2016-09-15,Corey Seager singled to right (Liner). Chase Utley advanced to 2B.
A_Bradley,1291,D Espinosa,9219,2016-08-01,Danny Espinosa singled to right (Liner). Wilson Ramos scored. Clint Robinson advanced to 2B.
A_Bradley,1291,Y Solarte,5352,2016-10-01,Yangervis Solarte doubled to right (Liner). Wil Myers scored.
A_Bradley,1291,C Adames,6013,2016-06-24,Cristhian Adames doubled to left (Fliner (Liner)).
A_Bradley,1291,R Pena,8841,2016-07-10,Ramiro Pena doubled to center (Fliner (Liner)). Gregor Blanco advanced to 3B.
A_Bradley,1291,Z Eflin,1377,2016-06-29,Zach Eflin doubled to center (Fliner (Fly)).
A_Bradley,1291,Y Solarte,5352,2016-08-18,Yangervis Solarte singled to left (Grounder). Wil Myers advanced to 3B.
A_Bradley,1291,B Posey,9166,2016-07-10,Buster Posey singled to right (Liner). Denard Span scored. Angel Pagan advanced to 3B.
A_Bradley,1291,W Ramos,1433,2016-08-01,Wilson Ramos singled to right (Grounder). Bryce Harper scored. Daniel Murphy advanced to 3B.
A_Bradley,1291,N Markakis,5930,2016-08-23,Nick Markakis singled to left (Grounder). Adonis Garcia scored. Freddie Freeman advanced to 2B.
A_Bradley,1291,N Arenado,9777,2016-09-04,Nolan Arenado tripled to left (Fliner (Fly)).
A_Bradley,1291,A Dickerson,1264,2016-09-20,Alex Dickerson doubled to right (Fliner (Liner)). Ryan Schimpf advanced to 3B.
A_Bradley,1291,A Rendon,1286,2016-08-01,Anthony Rendon doubled to left (Liner). Bryce Harper scored. Daniel Murphy scored.
A_Bradley,1291,T Flowers,9134,2016-08-23,Tyler Flowers doubled to left (Grounder). Freddie Freeman scored. Nick Markakis advanced to 3B.
A_Bradley,1291,T Story,1256,2016-05-09,Trevor Story doubled to right (Fliner (Liner)). Charlie Blackmon scored.
A_Bradley,1291,C Asche,1199,2016-06-29,Cody Asche doubled to right (Grounder). Zach Eflin scored.
A_Bradley,1291,W Myers,1004,2016-08-18,Wil Myers singled to center (Fliner (Liner)). Travis Jankowski scored.
A_Bradley,1291,J Pederson,1189,2016-06-14,Joc Pederson homered (Fliner (Fly)).
A_Bradley,1291,B Goodwin,1285,2016-09-26,Brian Goodwin tripled to right (Fliner (Liner)). Stephen Drew scored.
A_Bradley,1291,E Longoria,9368,2016-06-08,Evan Longoria singled to center (Fliner (Liner)). Taylor Motter scored. Corey Dickerson advanced to 3B.
A_Bradley,1291,J Turner,5235,2016-09-15,Justin Turner doubled to right (Fliner (Liner)). Chase Utley scored.
A_Bradley,1291,O Herrera,1147,2016-06-19,Odubel Herrera reached on fielder's choice and error to shortstop (Grounder). Andres Blanco advanced to 3B. Jimmy Paredes advanced to 2B on error. Error by Nick Ahmed.
A_Bradley,1291,S Leon,5273,2016-08-13,Sandy Leon homered (Fliner (Fly)).
A_Bradley,1291,A Dickerson,1264,2016-09-20,Alex Dickerson doubled to left (Fliner (Liner)). Ryan Schimpf scored.
A_Bradley,1291,T Story,1256,2016-05-09,Trevor Story doubled to center (Fliner (Liner)). Tony Wolters scored. Tyler Chatwood scored. Trevor Story out.
A_Bradley,1291,B Posey,9166,2016-09-10,Buster Posey tripled to right (Grounder). Angel Pagan scored.
A_Bradley,1291,J Turner,5235,2016-06-14,Justin Turner homered (Fliner (Fly)).
A_Bradley,1291,D Jennings,1965,2016-06-08,Desmond Jennings homered (Fliner (Fly)).
A_Bradley,1291,Y Solarte,5352,2016-07-04,Yangervis Solarte homered (Fliner (Fly)). Matt Kemp scored.
A_Bradley,1291,A Rizzo,3473,2016-06-03,Anthony Rizzo doubled to center (Fliner (Fly)). Jason Heyward scored.
A_Bradley,1291,J Votto,4314,2016-07-22,Joey Votto homered (Fly). Billy Hamilton scored. Zack Cozart scored.
A_Bradley,1291,D Norris,6867,2016-07-04,Derek Norris homered (Fliner (Fly)). Matt Kemp scored.
