playername,playerid,vsname,vsid,date,Play
A_Simon,2155,A Presley,5305,2016-05-28,Alex Presley grounded into a double play to shortstop (Grounder). Aaron Hill out at second.
A_Simon,2155,A McCutchen,9847,2016-04-30,Andrew McCutchen reached on fielder's choice to shortstop (Grounder). John Jaso out at second.
A_Simon,2155,F Freeman,5361,2016-06-15,Freddie Freeman grounded out to second (Grounder).
A_Simon,2155,J Harrison,8202,2016-04-08,Josh Harrison reached on error to third (Grounder). Starling Marte out at home. Francisco Cervelli advanced to 2B on error. Error by Eugenio Suarez.
A_Simon,2155,C d'Arnaud,6652,2016-06-15,Chase d'Arnaud struck out swinging.
A_Simon,2155,J Jaso,5887,2016-04-08,John Jaso fouled out to first (Fly).
A_Simon,2155,J Garcia,8137,2016-06-08,Jaime Garcia grounded out to second (Grounder).
A_Simon,2155,S O'Malley,9629,2016-05-22,Shawn O'Malley reached on fielder's choice to second (Grounder). Steve Clevenger out at second.
A_Simon,2155,A Pierzynski,746&,2016-06-15,A.J. Pierzynski grounded out to shortstop (Grounder).
A_Simon,2155,J Heyward,4940,2016-04-13,Jason Heyward struck out swinging.
A_Simon,2155,F Cervelli,5275,2016-04-08,Francisco Cervelli flied out to right (Fliner (Fly)).
A_Simon,2155,K Seager,9785,2016-05-22,Kyle Seager fouled out to third (Fliner (Fly)).
A_Simon,2155,M Reynolds,7619,2016-06-02,Mark Reynolds struck out swinging.
A_Simon,2155,T Story,1256,2016-06-02,Trevor Story flied out to right (Fly).
A_Simon,2155,A McCutchen,9847,2016-04-08,Andrew McCutchen flied out to center (Fliner (Fly)).
A_Simon,2155,R Grichuk,1024,2016-06-08,Randal Grichuk struck out swinging.
A_Simon,2155,G Polanco,1290,2016-05-11,Gregory Polanco struck out swinging.
A_Simon,2155,S Marte,9241,2016-05-11,Starling Marte was caught stealing.
A_Simon,2155,K Bryant,1542,2016-04-24,Kris Bryant flied out to left (Fly).
A_Simon,2155,T Wolters,1147,2016-06-02,Tony Wolters flied out to left (Fly).
A_Simon,2155,J Mercer,6547,2016-05-11,Jordy Mercer flied out to right (Fly).
A_Simon,2155,R Cano,3269,2016-05-22,Robinson Cano reached on fielder's choice to first (Grounder). Nori Aoki out at second.
A_Simon,2155,N Arenado,9777,2016-06-02,Nolan Arenado flied out to center (Fly).
A_Simon,2155,J Garcia,8137,2016-06-08,Jaime Garcia flied out to center (Fly).
A_Simon,2155,A McCutchen,9847,2016-04-08,Andrew McCutchen struck out swinging.
A_Simon,2155,C Blackmon,7859,2016-06-02,Charlie Blackmon flied out to right (Fliner (Liner)).
A_Simon,2155,F Cervelli,5275,2016-05-11,Francisco Cervelli grounded out to shortstop (Grounder).
A_Simon,2155,G Parra,8553,2016-06-02,Gerardo Parra struck out swinging.
A_Simon,2155,M Byrd,950&,2016-05-17,Marlon Byrd struck out swinging.
A_Simon,2155,Y Molina,7007,2016-06-08,Yadier Molina grounded out to second (Grounder).
A_Simon,2155,K Broxton,9253,2016-05-28,Keon Broxton reached on fielder's choice to shortstop (Grounder). Aaron Hill out at second.
A_Simon,2155,C Walsh,1096,2016-05-05,Colin Walsh grounded into a double play to second (Grounder). Aaron Hill out at second.
A_Simon,2155,M Napoli,3057,2016-05-17,Mike Napoli flied out to center (Fly).
A_Simon,2155,J Villar,1007,2016-05-05,Jonathan Villar struck out swinging.
A_Simon,2155,L Martin,1184,2016-05-22,Leonys Martin flied out to center (Fliner (Fly)).
A_Simon,2155,M Adams,9393,2016-06-08,Matt Adams fouled out to first (Fly).
A_Simon,2155,S Piscotty,1336,2016-06-08,Stephen Piscotty grounded out to third (Grounder).
A_Simon,2155,A Lind,8027,2016-05-22,Adam Lind grounded out to second (Grounder).
A_Simon,2155,G Polanco,1290,2016-04-30,Gregory Polanco grounded out to shortstop (Grounder).
A_Simon,2155,J Jaso,5887,2016-04-30,John Jaso struck out swinging.
A_Simon,2155,J Harrison,8202,2016-04-30,Josh Harrison grounded out to shortstop (Grounder).
A_Simon,2155,G Polanco,1290,2016-05-11,Gregory Polanco grounded out to second (Grounder). Andrew McCutchen advanced to 2B.
A_Simon,2155,D Freese,9549,2016-04-08,David Freese struck out swinging.
A_Simon,2155,J Garcia,8137,2016-06-08,Jaime Garcia sacrificed to pitcher (Bunt Grounder). Randal Grichuk advanced to 2B.
A_Simon,2155,J Kang,1718,2016-05-11,Jung Ho Kang flied out to left (Fliner (Fly)).
A_Simon,2155,S Gennett,1033,2016-05-28,Scooter Gennett grounded out to pitcher (Grounder).
A_Simon,2155,K Johnson,2234,2016-09-05,Kelly Johnson grounded out to first (Grounder).
A_Simon,2155,A Presley,5305,2016-05-05,Alex Presley lined out to shortstop (Liner).
A_Simon,2155,A McCutchen,9847,2016-05-11,Andrew McCutchen flied out to center (Fly).
A_Simon,2155,S Clevenger,9542,2016-05-22,Steve Clevenger struck out swinging.
A_Simon,2155,M Szczur,1125,2016-04-24,Matt Szczur flied out to left (Fliner (Fly)).
A_Simon,2155,J Mercer,6547,2016-04-30,Jordy Mercer grounded out to third (Grounder).
A_Simon,2155,R Braun,3410,2016-05-05,Ryan Braun grounded into a double play to shortstop (Grounder). Alex Presley out at second.
A_Simon,2155,J Lucroy,7870,2016-05-28,Jonathan Lucroy grounded out to shortstop (Grounder).
A_Simon,2155,Y Gomes,9627,2016-05-17,Yan Gomes fouled out to first (Fly).
A_Simon,2155,C Carter,9911,2016-05-05,Chris Carter grounded out to third (Grounder).
A_Simon,2155,N Cruz,2434,2016-05-22,Nelson Cruz grounded out to second (Grounder). Nori Aoki scored. Robinson Cano advanced to 3B.
A_Simon,2155,J Peralta,1738,2016-06-08,Jhonny Peralta grounded out to second (Grounder).
A_Simon,2155,A Presley,5305,2016-05-05,Alex Presley reached on fielder's choice to second (Grounder). Jonathan Villar out at second.
A_Simon,2155,C Carter,9911,2016-05-05,Chris Carter flied out to center (Fly).
A_Simon,2155,C Carter,9911,2016-05-05,Chris Carter struck out looking.
A_Simon,2155,C Walsh,1096,2016-05-05,Colin Walsh struck out swinging.
A_Simon,2155,J Heyward,4940,2016-04-24,Jason Heyward was caught stealing.
A_Simon,2155,M Montero,3364,2016-04-24,Miguel Montero struck out looking.
A_Simon,2155,C Adames,6013,2016-06-02,Cristhian Adames grounded out to pitcher (Grounder).
A_Simon,2155,K Nieuwenhuis,6400,2016-05-05,Kirk Nieuwenhuis grounded out to second (Grounder). Jonathan Lucroy advanced to 2B.
A_Simon,2155,K Nieuwenhuis,6400,2016-05-05,Kirk Nieuwenhuis grounded out to first (Grounder).
A_Simon,2155,K Cowart,1149,2016-08-29,Kaleb Cowart flied out to center (Fliner (Liner)).
A_Simon,2155,D Garneau,9433,2016-06-02,Dustin Garneau struck out swinging.
A_Simon,2155,D Garneau,9433,2016-06-02,Dustin Garneau struck out swinging.
A_Simon,2155,C Walsh,1096,2016-05-05,Colin Walsh struck out looking.
A_Simon,2155,J Hammel,4538,2016-04-24,Jason Hammel struck out swinging.
A_Simon,2155,C Anderson,6895,2016-05-05,Chase Anderson grounded out to shortstop (Grounder).
A_Simon,2155,C Blackmon,7859,2016-06-02,Charlie Blackmon grounded out to first (Grounder).
A_Simon,2155,M Byrd,950&,2016-05-17,Marlon Byrd grounded out to shortstop (Grounder).
A_Simon,2155,J Ramirez,1351,2016-05-17,Jose Ramirez flied out to center (Fly).
A_Simon,2155,C Gonzalez,7287,2016-06-02,Carlos Gonzalez flied out to right (Fly).
A_Simon,2155,Y Gomes,9627,2016-05-17,Yan Gomes grounded out to second (Grounder).
A_Simon,2155,J Bandy,1250,2016-08-29,Jett Bandy fouled out to shortstop (Fly).
A_Simon,2155,A Pujols,1177,2016-08-29,Albert Pujols struck out swinging.
A_Simon,2155,K Cowart,1149,2016-08-29,Kaleb Cowart flied out to shortstop (Fly).
A_Simon,2155,J Bandy,1250,2016-08-29,Jett Bandy flied out to center (Fliner (Fly)).
A_Simon,2155,R Ortega,1032,2016-08-29,Rafael Ortega grounded out to first (Grounder). Jefry Marte advanced to 3B.
A_Simon,2155,J Hazelbaker,9399,2016-04-15,Jeremy Hazelbaker grounded out to second (Grounder).
A_Simon,2155,K Wong,1253,2016-04-15,Kolten Wong reached on error to shortstop (Grounder). Error by Zack Cozart.
A_Simon,2155,K Calhoun,1120,2016-08-29,Kole Calhoun singled to center (Fliner (Liner)).
A_Simon,2155,J Villar,1007,2016-05-05,Jonathan Villar walked.
A_Simon,2155,J Marte,5107,2016-08-29,Jefry Marte singled to center (Grounder).
A_Simon,2155,A Diaz,1593,2016-04-15,Aledmys Diaz doubled to left (Fliner (Liner)). Kolten Wong advanced to 3B.
A_Simon,2155,J Soler,1422,2016-04-13,Jorge Soler hit a sacrifice fly to left (Fliner (Fly)). Anthony Rizzo scored.
A_Simon,2155,J Marte,5107,2016-08-29,Jefry Marte doubled to left (Grounder). C.J. Cron scored.
A_Simon,2155,B Moss,4467,2016-04-15,Brandon Moss homered (Fliner (Fly)). Kolten Wong scored. Aledmys Diaz scored.
A_Simon,2155,M Reynolds,7619,2016-06-02,Mark Reynolds was hit by a pitch.
A_Simon,2155,M Szczur,1125,2016-04-24,Matt Szczur singled to pitcher (Grounder). Jorge Soler advanced to 2B.
A_Simon,2155,S Clevenger,9542,2016-05-22,Steve Clevenger singled to left (Fliner (Liner)). Nelson Cruz scored. Kyle Seager out at home. Adam Lind advanced to 2B. Steve Clevenger
A_Simon,2155,A De Aza,3371,2016-09-05,Alejandro De Aza hit a sacrifice fly to right (Fliner (Fly)). Matt Reynolds scored.
A_Simon,2155,J Lucroy,7870,2016-05-05,Jonathan Lucroy was hit by a pitch.
A_Simon,2155,Y Molina,7007,2016-06-08,Yadier Molina singled to right (Fliner (Liner)).
A_Simon,2155,T Story,1256,2016-06-02,Trevor Story homered (Fly). Mark Reynolds scored.
A_Simon,2155,J Ramirez,1351,2016-05-17,Jose Ramirez advanced on a stolen base to 3B.
A_Simon,2155,A Lind,8027,2016-05-22,Adam Lind was intentionally walked.
A_Simon,2155,C Santana,2396,2016-05-17,Carlos Santana walked.
A_Simon,2155,L Chisenhall,7571,2016-05-17,Lonnie Chisenhall singled to second (Grounder). Jose Ramirez advanced to 2B.
A_Simon,2155,F Lindor,1291,2016-05-17,Francisco Lindor singled to right (Fliner (Liner)).
A_Simon,2155,Y Rivera,1186,2016-05-05,Yadiel Rivera singled to right (Fliner (Liner)).
A_Simon,2155,A Russell,1410,2016-04-24,Addison Russell singled to center (Grounder). Jorge Soler scored. Matt Szczur advanced to 2B.
A_Simon,2155,A Hill,6104,2016-05-05,Aaron Hill singled to center (Fliner (Liner)). Jonathan Lucroy scored. Aaron Hill advanced to 2B.
A_Simon,2155,D Freese,9549,2016-04-30,Francisco Cervelli advanced on a wild pitch to 2B.
A_Simon,2155,J Heyward,4940,2016-04-24,Jason Heyward advanced on a stolen base to 2B.
A_Simon,2155,F Cervelli,5275,2016-05-11,Francisco Cervelli walked.
A_Simon,2155,M Reynolds,7619,2016-06-02,Mark Reynolds walked.
A_Simon,2155,F Cervelli,5275,2016-04-30,Francisco Cervelli walked. David Freese advanced to 2B.
A_Simon,2155,T d'Arnaud,7739,2016-09-05,Travis d'Arnaud walked.
A_Simon,2155,K Calhoun,1120,2016-08-29,Kole Calhoun homered (Fly).
A_Simon,2155,M Byrd,950&,2016-05-17,Marlon Byrd singled to left (Liner). Yan Gomes advanced to 2B.
A_Simon,2155,T La Stella,1237,2016-04-24,Tommy La Stella doubled to right (Fliner (Liner)). Jason Hammel advanced to 3B.
A_Simon,2155,A McCutchen,9847,2016-04-30,Andrew McCutchen walked.
A_Simon,2155,A Hill,6104,2016-05-28,Aaron Hill walked.
A_Simon,2155,J Kang,1718,2016-05-11,Jung Ho Kang was hit by a pitch. Francisco Cervelli advanced to 2B.
A_Simon,2155,N Aoki,1307,2016-05-22,Nori Aoki singled to center (Fliner (Liner)).
A_Simon,2155,R Grichuk,1024,2016-06-08,Randal Grichuk walked.
A_Simon,2155,Y Gomes,9627,2016-05-17,Yan Gomes singled to left (Fliner (Fly)).
A_Simon,2155,E Inciarte,4922,2016-06-15,Ender Inciarte walked.
A_Simon,2155,C Carter,9911,2016-05-28,Chris Carter reached on error to third (Grounder). Jonathan Lucroy advanced to 2B on error. Error by Joey Votto.
A_Simon,2155,D Freese,9549,2016-04-08,David Freese was hit by a pitch. John Jaso advanced to 2B.
A_Simon,2155,M Carpenter,8090,2016-06-08,Matt Carpenter walked.
A_Simon,2155,S Marte,9241,2016-05-11,Starling Marte was hit by a pitch.
A_Simon,2155,A Rizzo,3473,2016-04-24,Anthony Rizzo homered (Fly). Kris Bryant scored.
A_Simon,2155,Y Molina,7007,2016-06-08,Yadier Molina doubled to center (Fliner (Fly)).
A_Simon,2155,L Martin,1184,2016-05-22,Leonys Martin singled to pitcher (Bunt Fly).
A_Simon,2155,A Cabrera,4962,2016-09-05,Asdrubal Cabrera singled to right (Fliner (Liner)). James Loney scored. Matt Reynolds advanced to 3B.
A_Simon,2155,N Aoki,1307,2016-05-22,Robinson Cano advanced on a wild pitch to 2B.
A_Simon,2155,J Lucroy,7870,2016-05-28,Jonathan Lucroy singled to center (Fliner (Liner)). Scooter Gennett scored.
A_Simon,2155,L Martin,1184,2016-05-22,Leonys Martin singled to right (Grounder). Wade Miley advanced to 2B.
A_Simon,2155,T La Stella,1237,2016-04-24,Tommy La Stella doubled to center (Fliner (Fly)).
A_Simon,2155,R Davis,3708,2016-05-17,Rajai Davis doubled to left (Fly). Jose Ramirez scored. Lonnie Chisenhall scored.
A_Simon,2155,C d'Arnaud,6652,2016-06-15,Chase d'Arnaud singled to center (Fliner (Fly)). Jace Peterson scored. Tyler Flowers advanced to 3B. Erick Aybar advanced to 2B.
A_Simon,2155,S Gennett,1033,2016-05-28,Scooter Gennett tripled to right (Liner).
A_Simon,2155,J Heyward,4940,2016-04-24,Jason Heyward singled to center (Grounder). Tommy La Stella scored.
A_Simon,2155,S Marte,9241,2016-04-30,Starling Marte was hit by a pitch. David Freese advanced to 2B.
A_Simon,2155,A Russell,1410,2016-04-13,Addison Russell singled to right (Fliner (Liner)). Kris Bryant scored. Miguel Montero advanced to 2B.
A_Simon,2155,M Byrd,950&,2016-05-17,Carlos Santana advanced on a wild pitch to 2B. Marlon Byrd scored. Rajai Davis advanced to 3B.
A_Simon,2155,M Montero,3364,2016-04-13,Miguel Montero singled to left (Liner). Ben Zobrist scored. Anthony Rizzo advanced to 3B. Kris Bryant advanced to 2B.
A_Simon,2155,A Garcia,1377,2016-06-15,Adonis Garcia singled to left (Fliner (Liner)).
A_Simon,2155,J Heyward,4940,2016-04-24,Jason Heyward singled to right (Liner). Jason Hammel scored. Tommy La Stella scored.
A_Simon,2155,F Liriano,3201,2016-04-08,Francisco Liriano doubled to right (Grounder). Jordy Mercer scored.
A_Simon,2155,D Freese,9549,2016-05-11,David Freese homered (Fly).
A_Simon,2155,F Cervelli,5275,2016-04-30,Francisco Cervelli singled to center (Fliner (Liner)). David Freese scored. Starling Marte advanced to 2B.
A_Simon,2155,R Davis,3708,2016-05-17,Rajai Davis singled to right (Fliner (Liner)). Yan Gomes scored. Marlon Byrd advanced to 3B. Rajai Davis advanced to 2B.
A_Simon,2155,J Kang,1718,2016-05-11,Jung Ho Kang homered (Fly).
A_Simon,2155,N Markakis,5930,2016-06-15,Nick Markakis singled to second (Grounder). Adonis Garcia advanced to 2B.
A_Simon,2155,K Seager,9785,2016-05-22,Kyle Seager singled to center (Liner). Nori Aoki scored. Nelson Cruz advanced to 3B on error. Kyle Seager advanced to 2B on error. Error by Billy Hamilton.
A_Simon,2155,B Moss,4467,2016-06-08,Brandon Moss homered (Fly). Jhonny Peralta scored.
