playername,playerid,vsname,vsid,date,Play
C_Gearrin,7947,Y Tomas,1717,2016-09-09,Yasmany Tomas grounded out to second (Grounder).
C_Gearrin,7947,W Castillo,3256,2016-09-09,Welington Castillo struck out looking.
C_Gearrin,7947,J Pederson,1189,2016-06-11,Joc Pederson flied out to center (Fliner (Fly)).
C_Gearrin,7947,C Asche,1199,2016-06-26,Cody Asche grounded out to second (Grounder).
C_Gearrin,7947,A Ellis,5677,2016-06-11,A.J. Ellis grounded into a double play to shortstop (Grounder). Howie Kendrick out at second.
C_Gearrin,7947,M Reynolds,7619,2016-05-06,Mark Reynolds struck out swinging.
C_Gearrin,7947,W Castillo,3256,2016-05-12,Welington Castillo struck out swinging.
C_Gearrin,7947,R Grichuk,1024,2016-06-05,Randal Grichuk grounded into a double play to shortstop (Grounder). Greg Garcia out at second.
C_Gearrin,7947,J Segura,5933,2016-05-14,Jean Segura grounded out to catcher (Grounder). Yasmany Tomas advanced to 2B.
C_Gearrin,7947,R Martin,4616,2016-05-11,Russell Martin hit a sacrifice fly to right (Fliner (Liner)). Josh Donaldson scored. Edwin Encarnacion advanced to 3B.
C_Gearrin,7947,A Diaz,1593,2016-06-03,Aledmys Diaz struck out swinging.
C_Gearrin,7947,K Bryant,1542,2016-05-22,Kris Bryant lined out to shortstop (Liner).
C_Gearrin,7947,S Van Slyke,4365,2016-04-08,Scott Van Slyke flied out to center (Fly).
C_Gearrin,7947,B Drury,1161,2016-07-03,Brandon Drury flied out to center (Fly).
C_Gearrin,7947,N Ahmed,1214,2016-05-14,Nick Ahmed grounded out to third (Grounder).
C_Gearrin,7947,M Holliday,1873,2016-06-03,Matt Holliday grounded out to shortstop (Grounder).
C_Gearrin,7947,D Norris,6867,2016-09-24,Derek Norris struck out swinging.
C_Gearrin,7947,M Bourn,6387,2016-07-03,Michael Bourn grounded out to first (Grounder).
C_Gearrin,7947,Y Grandal,1136,2016-06-11,Yasmani Grandal struck out swinging.
C_Gearrin,7947,H Conger,2505,2016-06-19,Hank Conger reached on fielder's choice to pitcher (Grounder). Corey Dickerson out at third. Desmond Jennings advanced to 2B.
C_Gearrin,7947,A Ellis,5677,2016-04-08,A.J. Ellis grounded out to pitcher (Grounder).
C_Gearrin,7947,Y Tomas,1717,2016-04-21,Yasmany Tomas flied out to left (Fliner (Liner)).
C_Gearrin,7947,Y Tomas,1717,2016-07-03,Yasmany Tomas grounded out to first (Grounder).
C_Gearrin,7947,M Kemp,5631,2016-05-24,Matt Kemp doubled to right (Fliner (Fly)). Matt Kemp out.
C_Gearrin,7947,D Pedroia,8370,2016-06-08,Dustin Pedroia flied out to center (Fliner (Fly)).
C_Gearrin,7947,Y Cespedes,1311,2016-05-01,Yoenis Cespedes grounded into a double play to shortstop (Grounder). David Wright out at second.
C_Gearrin,7947,W Myers,1004,2016-04-25,Wil Myers grounded out to second (Grounder).
C_Gearrin,7947,S Marte,9241,2016-06-22,Starling Marte grounded out to first (Grounder).
C_Gearrin,7947,R Raburn,2218,2016-05-28,Ryan Raburn grounded out to third (Grounder).
C_Gearrin,7947,J Decker,7945,2016-06-19,Jaff Decker struck out swinging.
C_Gearrin,7947,K Plawecki,1380,2016-05-01,Kevin Plawecki flied out to center (Fliner (Fly)).
C_Gearrin,7947,X Bogaerts,1216,2016-06-08,Xander Bogaerts struck out swinging.
C_Gearrin,7947,D Garneau,9433,2016-05-28,Dustin Garneau struck out swinging.
C_Gearrin,7947,A Russell,1410,2016-05-21,Addison Russell grounded out to second (Grounder). Javier Baez advanced to 2B.
C_Gearrin,7947,C d'Arnaud,6652,2016-05-31,Chase d'Arnaud struck out swinging.
C_Gearrin,7947,D Santana,1034,2016-04-04,Domingo Santana fouled out to first (Fly).
C_Gearrin,7947,D LeMahieu,9874,2016-04-13,DJ LeMahieu struck out swinging.
C_Gearrin,7947,K Pillar,1243,2016-05-11,Kevin Pillar flied out to center (Fliner (Fly)).
C_Gearrin,7947,M Holliday,1873,2016-06-05,Matt Holliday grounded out to second (Grounder).
C_Gearrin,7947,N Hundley,3376,2016-04-13,Nick Hundley grounded out to first (Grounder).
C_Gearrin,7947,A Diaz,1593,2016-09-18,Aledmys Diaz struck out swinging.
C_Gearrin,7947,K Hernandez,1047,2016-04-15,Kiké Hernandez grounded into a double play to shortstop (Grounder). Charlie Culberson advanced to 3B. Clayton Kershaw out at second.
C_Gearrin,7947,J Lester,4930,2016-09-02,Jon Lester grounded out to shortstop (Grounder).
C_Gearrin,7947,L Forsythe,7185,2016-06-19,Logan Forsythe struck out swinging.
C_Gearrin,7947,M Bourn,6387,2016-08-30,Michael Bourn grounded out to first (Grounder).
C_Gearrin,7947,A Garcia,1377,2016-05-31,Adonis Garcia lined out to second (Liner).
C_Gearrin,7947,M Upton Jr.,5015,2016-05-24,Melvin Upton Jr. grounded out to second (Grounder).
C_Gearrin,7947,J Villar,1007,2016-04-04,Jonathan Villar grounded out to second (Grounder).
C_Gearrin,7947,C Johnson,1191,2016-04-23,Chris Johnson grounded into a double play to second (Grounder). Justin Bour out at second.
C_Gearrin,7947,E Encarnacion,2151,2016-05-09,Edwin Encarnacion grounded out to shortstop (Grounder).
C_Gearrin,7947,T Story,1256,2016-07-05,Trevor Story flied out to right (Fliner (Fly)).
C_Gearrin,7947,D Fowler,4062,2016-09-02,Dexter Fowler flied out to center (Fly).
C_Gearrin,7947,J Gyorko,1081,2016-09-18,Jedd Gyorko struck out swinging.
C_Gearrin,7947,A Diaz,1593,2016-09-16,Aledmys Diaz flied out to left (Fly).
C_Gearrin,7947,D Norris,6867,2016-04-27,Derek Norris flied out to left (Fliner (Fly)).
C_Gearrin,7947,R Grichuk,1024,2016-09-18,Randal Grichuk struck out swinging.
C_Gearrin,7947,K Pillar,1243,2016-05-09,Kevin Pillar flied out to right (Fliner (Fly)).
C_Gearrin,7947,M Upton Jr.,5015,2016-04-27,Melvin Upton Jr. struck out swinging.
C_Gearrin,7947,J Bautista,1887,2016-05-09,Jose Bautista grounded out to third (Grounder). Josh Donaldson advanced to 2B.
C_Gearrin,7947,A Ramirez,5133,2016-04-27,Alexei Ramirez flied out to left (Fliner (Fly)).
C_Gearrin,7947,A Cabrera,4962,2016-08-20,Asdrubal Cabrera grounded out to second (Grounder).
C_Gearrin,7947,M Kemp,5631,2016-04-27,Matt Kemp struck out swinging.
C_Gearrin,7947,J Peterson,1232,2016-08-26,Jace Peterson struck out swinging.
C_Gearrin,7947,D Swanson,1831,2016-08-26,Dansby Swanson grounded out to shortstop (Grounder).
C_Gearrin,7947,D Fowler,4062,2016-05-20,Dexter Fowler struck out looking.
C_Gearrin,7947,N Markakis,5930,2016-08-28,Nick Markakis grounded out to shortstop (Grounder).
C_Gearrin,7947,D LeMahieu,9874,2016-05-05,DJ LeMahieu grounded out to pitcher (Grounder).
C_Gearrin,7947,G Beckham,9015,2016-08-28,Gordon Beckham homered (Fly).
C_Gearrin,7947,C d'Arnaud,6652,2016-08-28,Chase d'Arnaud grounded out to third (Grounder).
C_Gearrin,7947,K Bryant,1542,2016-05-20,Kris Bryant singled to center (Liner). David Ross scored.
C_Gearrin,7947,B Wallace,8434,2016-04-27,Brett Wallace walked.
C_Gearrin,7947,C Herrmann,9284,2016-04-21,Chris Herrmann walked.
C_Gearrin,7947,M Carpenter,8090,2016-06-05,Matt Carpenter advanced on a wild pitch to 2B.
C_Gearrin,7947,L Forsythe,7185,2016-06-18,Logan Forsythe homered (Fliner (Fly)).
C_Gearrin,7947,G Garcia,1095,2016-06-05,Greg Garcia reached on fielder's choice to second (Grounder). Stephen Piscotty scored. Matt Adams advanced to 3B. Yadier Molina out at second.
C_Gearrin,7947,C Adames,6013,2016-07-05,Cristhian Adames walked.
C_Gearrin,7947,N Walker,7539,2016-05-01,Neil Walker singled to center (Grounder).
C_Gearrin,7947,B Paulsen,9741,2016-04-13,Ben Paulsen singled to right (Grounder).
C_Gearrin,7947,C Owings,1003,2016-04-21,Chris Owings singled to right (Liner).
C_Gearrin,7947,W Flores,5827,2016-08-20,Wilmer Flores singled to right (Grounder). Neil Walker scored. Wilmer Flores advanced to 2B.
C_Gearrin,7947,J Segura,5933,2016-04-18,Jean Segura singled to center (Grounder).
C_Gearrin,7947,A Hill,6104,2016-04-06,Aaron Hill walked.
C_Gearrin,7947,P Gosselin,1095,2016-07-03,Phil Gosselin walked.
C_Gearrin,7947,W Flores,5827,2016-05-01,Wilmer Flores singled to right (Grounder). Neil Walker advanced to 2B.
C_Gearrin,7947,C Utley,1679,2016-08-23,Chase Utley singled to right (Fliner (Fly)).
C_Gearrin,7947,C Owings,1003,2016-04-21,Chris Herrmann advanced on double steal to 2B.
C_Gearrin,7947,K Davis,9112,2016-06-28,Khris Davis walked.
C_Gearrin,7947,C Carter,9911,2016-04-06,Chris Carter hit a sacrifice fly to center (Fliner (Fly)). Scooter Gennett scored.
C_Gearrin,7947,D Jennings,1965,2016-06-19,Desmond Jennings singled to left (Liner). Corey Dickerson advanced to 2B.
C_Gearrin,7947,M Franco,1217,2016-06-26,Maikel Franco singled to left (Grounder). Peter Bourjos advanced to 2B.
C_Gearrin,7947,R Weeks Jr.,1849,2016-04-21,Rickie Weeks Jr. reached on fielder's choice to third (Grounder). Chris Owings scored. Chris Herrmann advanced to 3B. Rickie Weeks Jr. advanced to 2B on error. Error by Trevor Brown.
C_Gearrin,7947,P Goldschmidt,9218,2016-07-03,Paul Goldschmidt reached on error to first (Grounder). Error by Buster Posey.
C_Gearrin,7947,E Encarnacion,2151,2016-05-11,Edwin Encarnacion singled to center (Fliner (Liner)). Josh Donaldson advanced to 3B.
C_Gearrin,7947,Y Tomas,1717,2016-05-14,Yasmany Tomas singled to left (Fliner (Liner)).
C_Gearrin,7947,N Arenado,9777,2016-05-06,Nolan Arenado singled to second (Grounder). Trevor Story advanced to 2B.
C_Gearrin,7947,S Vogt,5000,2016-06-28,Stephen Vogt walked. Khris Davis advanced to 2B.
C_Gearrin,7947,S Gennett,1033,2016-04-06,Ryan Braun advanced on a passed ball to 2B. Passed ball by Buster Posey.
C_Gearrin,7947,Y Molina,7007,2016-06-05,Yadier Molina reached on fielder's choice and error to shortstop (Grounder). Matt Holliday scored on error. Stephen Piscotty advanced to 3B. Matt Adams advanced to 2B on error. Error by Brandon Crawford.
C_Gearrin,7947,A Toles,1341,2016-08-23,Andrew Toles doubled to center (Fliner (Liner)). Chase Utley scored.
C_Gearrin,7947,P Bourjos,2578,2016-06-24,Peter Bourjos walked. Cameron Rupp scored. Tyler Goeddel advanced to 3B. Freddy Galvis advanced to 2B.
C_Gearrin,7947,M Margot,1471,2016-09-25,Manuel Margot tripled to center (Fliner (Fly)).
C_Gearrin,7947,T Thompson,9952,2016-06-11,Trayce Thompson walked. Chase Utley scored. Corey Seager advanced to 3B. Adrian Gonzalez advanced to 2B.
C_Gearrin,7947,J Lamb,1332,2016-07-03,Jake Lamb homered (Fliner (Fly)). Paul Goldschmidt scored.
C_Gearrin,7947,N Arenado,9777,2016-07-05,Nolan Arenado homered (Fliner (Fly)). Nick Hundley scored. DJ LeMahieu scored.
