playername,playerid,vsname,vsid,date,Play
D_Keuchel,9434,C Dickerson,1076,2016-08-27,Corey Dickerson grounded into a double play to second (Grounder). Steven Souza Jr. out at second.
D_Keuchel,9434,B Hamilton,1019,2016-06-18,Billy Hamilton grounded into a double play to second (Grounder). Eugenio Suarez out at second.
D_Keuchel,9434,J Nelson,1054,2016-04-10,Jimmy Nelson grounded into a double play to catcher (Bunt Grounder). Martin Maldonado out at third. Yadiel Rivera advanced to 2B.
D_Keuchel,9434,A Beltre,639&,2016-06-07,Adrian Beltre grounded into a double play to shortstop (Grounder). Ian Desmond out at second.
D_Keuchel,9434,J Lamb,1332,2016-06-02,Jake Lamb grounded into a double play to second (Grounder). Welington Castillo out at second.
D_Keuchel,9434,K Marte,1361,2016-05-07,Ketel Marte flied out to second (Fly).
D_Keuchel,9434,J Lowrie,4418,2016-07-19,Jed Lowrie grounded into a double play to second (Grounder). Coco Crisp out at second.
D_Keuchel,9434,I Kinsler,6195,2016-04-15,Ian Kinsler struck out swinging.
D_Keuchel,9434,J Ellsbury,4727,2016-07-25,Jacoby Ellsbury flied out to second (Fly).
D_Keuchel,9434,D Gregorius,6012,2016-07-25,Didi Gregorius out on a dropped third strike.
D_Keuchel,9434,J Nelson,1054,2016-04-10,Jimmy Nelson struck out looking.
D_Keuchel,9434,A Hicks,5297,2016-07-25,Aaron Hicks grounded into a double play to third (Grounder). Austin Romine out at second.
D_Keuchel,9434,R Odor,1228,2016-08-05,Rougned Odor grounded out to first (Grounder).
D_Keuchel,9434,N Castellanos,1173,2016-07-31,Nick Castellanos struck out looking.
D_Keuchel,9434,R Cano,3269,2016-05-07,Robinson Cano grounded out to second (Grounder).
D_Keuchel,9434,K Davis,9112,2016-07-10,Khris Davis flied out to right (Fly).
D_Keuchel,9434,J Villar,1007,2016-04-10,Jonathan Villar grounded out to first (Grounder).
D_Keuchel,9434,N Cruz,2434,2016-05-07,Nelson Cruz grounded into a double play to shortstop (Grounder). Robinson Cano out at second.
D_Keuchel,9434,J Segura,5933,2016-06-02,Jean Segura reached on fielder's choice to third (Grounder). Brandon Drury out at third.
D_Keuchel,9434,C Carter,9911,2016-04-10,Chris Carter grounded out to third (Grounder).
D_Keuchel,9434,N Mazara,1455,2016-06-07,Nomar Mazara struck out looking.
D_Keuchel,9434,C Cron,1254,2016-06-29,C.J. Cron struck out swinging.
D_Keuchel,9434,K Seager,9785,2016-07-05,Kyle Seager fouled out to third (Fly).
D_Keuchel,9434,J Saltalamacchia,5557,2016-04-15,Jarrod Saltalamacchia grounded out to second (Grounder).
D_Keuchel,9434,N Mazara,1455,2016-06-07,Nomar Mazara flied out to center (Fly).
D_Keuchel,9434,V Martinez,393&,2016-04-15,Victor Martinez grounded out to third (Grounder).
D_Keuchel,9434,N Aoki,1307,2016-04-26,Nori Aoki struck out swinging.
D_Keuchel,9434,J Bandy,1250,2016-06-29,Jett Bandy flied out to first (Fly).
D_Keuchel,9434,H Alberto,1190,2016-05-22,Hanser Alberto struck out swinging.
D_Keuchel,9434,C Davis,9272,2016-08-21,Chris Davis struck out swinging.
D_Keuchel,9434,R Odor,1228,2016-06-07,Rougned Odor grounded out to shortstop (Grounder).
D_Keuchel,9434,G Garcia,1095,2016-08-16,Greg Garcia grounded out to second (Grounder). Randal Grichuk advanced to 3B.
D_Keuchel,9434,A Duvall,1095,2016-06-18,Adam Duvall grounded out to second (Grounder).
D_Keuchel,9434,R Odor,1228,2016-06-07,Rougned Odor struck out swinging.
D_Keuchel,9434,M Bourn,6387,2016-06-02,Michael Bourn grounded out to second (Grounder).
D_Keuchel,9434,I Kinsler,6195,2016-04-15,Ian Kinsler grounded out to shortstop (Grounder).
D_Keuchel,9434,S Pearce,9957,2016-08-21,Steve Pearce flied out to left (Fly).
D_Keuchel,9434,A Duvall,1095,2016-06-18,Adam Duvall struck out swinging.
D_Keuchel,9434,E Escobar,6153,2016-05-02,Eduardo Escobar struck out looking.
D_Keuchel,9434,A Duvall,1095,2016-06-18,Adam Duvall grounded out to third (Grounder).
D_Keuchel,9434,R Rua,1240,2016-06-07,Ryan Rua grounded out to third (Grounder).
D_Keuchel,9434,J Bandy,1250,2016-06-29,Jett Bandy struck out swinging.
D_Keuchel,9434,A Rodriguez,1274,2016-04-05,Alex Rodriguez lined out to shortstop (Liner).
D_Keuchel,9434,J Votto,4314,2016-06-18,Joey Votto flied out to left (Fliner (Fly)).
D_Keuchel,9434,D Stubbs,9328,2016-05-22,Drew Stubbs struck out looking.
D_Keuchel,9434,J Upton,5222,2016-04-15,Justin Upton struck out looking.
D_Keuchel,9434,A Hill,6104,2016-04-10,Aaron Hill struck out swinging.
D_Keuchel,9434,J Saltalamacchia,5557,2016-04-15,Jarrod Saltalamacchia grounded out to second (Grounder).
D_Keuchel,9434,A Jones,6368,2016-08-21,Adam Jones flied out to center (Fliner (Fly)).
D_Keuchel,9434,M Maldonado,6887,2016-04-10,Martin Maldonado grounded out to pitcher (Grounder).
D_Keuchel,9434,M Cabrera,4022,2016-05-17,Melky Cabrera reached on fielder's choice to third (Grounder). Avisail Garcia out at second.
D_Keuchel,9434,K Marte,1361,2016-07-05,Ketel Marte out on a dropped third strike. Daniel Robertson advanced to 3B.
D_Keuchel,9434,C Headley,4720,2016-04-05,Chase Headley struck out swinging.
D_Keuchel,9434,A Romine,5491,2016-07-25,Austin Romine flied out to second (Fly).
D_Keuchel,9434,D Robertson,6266,2016-07-05,Daniel Robertson grounded out to first (Grounder).
D_Keuchel,9434,L Martin,1184,2016-07-05,Leonys Martin struck out looking.
D_Keuchel,9434,P Fielder,4613,2016-06-07,Prince Fielder struck out swinging.
D_Keuchel,9434,J Lamb,1332,2016-06-02,Jake Lamb struck out looking.
D_Keuchel,9434,S Robinson,4249,2016-06-29,Shane Robinson flied out to left (Fliner (Fly)).
D_Keuchel,9434,S Robinson,4249,2016-05-28,Shane Robinson grounded out to pitcher (Grounder).
D_Keuchel,9434,G Petit,3812,2016-05-28,Gregorio Petit struck out swinging.
D_Keuchel,9434,C Headley,4720,2016-04-05,Chase Headley flied out to second (Fly).
D_Keuchel,9434,V Martinez,393&,2016-04-15,Victor Martinez grounded out to first (Grounder).
D_Keuchel,9434,B Moss,4467,2016-08-16,Brandon Moss grounded out to second (Grounder).
D_Keuchel,9434,J Gyorko,1081,2016-08-16,Jedd Gyorko struck out swinging.
D_Keuchel,9434,E Suarez,1255,2016-06-18,Eugenio Suarez struck out looking.
D_Keuchel,9434,A Jackson,9848,2016-05-17,Austin Jackson struck out swinging.
D_Keuchel,9434,E Longoria,9368,2016-08-27,Evan Longoria struck out swinging.
D_Keuchel,9434,J Hardy,3797,2016-08-21,J.J. Hardy grounded out to third (Grounder).
D_Keuchel,9434,K Kiermaier,1103,2016-08-27,Kevin Kiermaier grounded out to second (Grounder).
D_Keuchel,9434,R Cano,3269,2016-07-05,Robinson Cano grounded out to first (Grounder).
D_Keuchel,9434,M McBride,9373,2016-07-19,Matt McBride lined out to shortstop (Liner).
D_Keuchel,9434,J Marte,5107,2016-06-29,Jefry Marte grounded out to third (Grounder).
D_Keuchel,9434,M Mahtook,1313,2016-06-12,Mikie Mahtook grounded out to third (Grounder).
D_Keuchel,9434,M Cabrera,1744,2016-04-15,Miguel Cabrera reached on fielder's choice to second (Grounder). Justin Upton out at second.
D_Keuchel,9434,J Iglesias,1023,2016-04-15,Jose Iglesias lined out to second (Liner).
D_Keuchel,9434,C Headley,4720,2016-07-25,Chase Headley flied out to first (Fly).
D_Keuchel,9434,F Gutierrez,3255,2016-04-26,Franklin Gutierrez struck out swinging.
D_Keuchel,9434,B Hamilton,1019,2016-06-18,Billy Hamilton grounded out to shortstop (Grounder). Eugenio Suarez scored.
D_Keuchel,9434,M Semien,1253,2016-07-19,Marcus Semien flied out to right (Fly).
D_Keuchel,9434,E Andrus,8709,2016-06-07,Elvis Andrus flied out to left (Fly).
D_Keuchel,9434,Y Alonso,2530,2016-07-10,Yonder Alonso flied out to left (Fly).
D_Keuchel,9434,T Pham,2967,2016-08-16,Tommy Pham struck out looking.
D_Keuchel,9434,M Mahtook,1313,2016-08-27,Mikie Mahtook flied out to right (Fly).
D_Keuchel,9434,M Machado,1149,2016-08-21,Manny Machado grounded out to third (Grounder).
D_Keuchel,9434,T Beckham,7949,2016-06-12,Tim Beckham struck out swinging.
D_Keuchel,9434,M Teixeira,1281,2016-04-05,Mark Teixeira grounded out to pitcher (Grounder).
D_Keuchel,9434,I De Jesus,9886,2016-06-18,Ivan De Jesus grounded out to third (Grounder).
D_Keuchel,9434,C Cron,1254,2016-05-28,C.J. Cron grounded out to third (Grounder).
D_Keuchel,9434,S Castro,4579,2016-07-25,Starlin Castro struck out swinging.
D_Keuchel,9434,A Gose,5097,2016-04-15,Anthony Gose grounded out to pitcher (Grounder).
D_Keuchel,9434,D Lee,1872,2016-05-07,Dae-Ho Lee grounded out to pitcher (Grounder).
D_Keuchel,9434,J Segura,5933,2016-06-02,Jean Segura struck out swinging.
D_Keuchel,9434,J Ellsbury,4727,2016-07-25,Jacoby Ellsbury grounded out to second (Grounder).
D_Keuchel,9434,E Longoria,9368,2016-08-27,Evan Longoria grounded out to pitcher (Grounder).
D_Keuchel,9434,M Teixeira,1281,2016-04-05,Mark Teixeira flied out to left (Fly).
D_Keuchel,9434,A Beltre,639&,2016-05-22,Adrian Beltre grounded out to third (Grounder).
D_Keuchel,9434,K Davis,9112,2016-07-10,Khris Davis grounded out to second (Grounder).
D_Keuchel,9434,J Gyorko,1081,2016-08-16,Jedd Gyorko grounded out to third (Grounder).
D_Keuchel,9434,J Mauer,1857,2016-05-02,Joe Mauer grounded out to first (Grounder). Brian Dozier advanced to 2B.
D_Keuchel,9434,D Robertson,6266,2016-07-05,Daniel Robertson reached on fielder's choice to second (Grounder). Chris Iannetta out at second. Daniel Robertson advanced to 2B on error. Error by Carlos Correa.
D_Keuchel,9434,Y Escobar,4191,2016-05-28,Yunel Escobar grounded out to second (Grounder).
D_Keuchel,9434,N Cruz,2434,2016-04-26,Nelson Cruz grounded out to shortstop (Grounder).
D_Keuchel,9434,A Simmons,1084,2016-06-29,Andrelton Simmons flied out to left (Fly).
D_Keuchel,9434,M Trumbo,6876,2016-08-21,Mark Trumbo grounded out to third (Grounder).
D_Keuchel,9434,F Gutierrez,3255,2016-07-05,Franklin Gutierrez struck out swinging.
D_Keuchel,9434,J Profar,1081,2016-06-07,Jurickson Profar flied out to first (Fly).
D_Keuchel,9434,A Jones,6368,2016-08-21,Adam Jones flied out to right (Fly).
D_Keuchel,9434,L Forsythe,7185,2016-08-27,Logan Forsythe grounded out to shortstop (Grounder).
D_Keuchel,9434,K Calhoun,1120,2016-05-28,Kole Calhoun grounded out to second (Grounder).
D_Keuchel,9434,C Crisp,1572,2016-07-10,Coco Crisp sacrificed to catcher (Bunt Grounder). Matt McBride advanced to 2B.
D_Keuchel,9434,A Gose,5097,2016-04-15,Anthony Gose grounded out to pitcher (Grounder).
D_Keuchel,9434,M Teixeira,1281,2016-07-25,Mark Teixeira grounded out to second (Grounder).
D_Keuchel,9434,N Cruz,2434,2016-05-07,Nelson Cruz reached on fielder's choice to third (Grounder). Robinson Cano out at second.
D_Keuchel,9434,D Valencia,6364,2016-07-10,Danny Valencia struck out swinging.
D_Keuchel,9434,K Broxton,9253,2016-04-10,Keon Broxton struck out looking.
D_Keuchel,9434,D Santana,1032,2016-05-02,Danny Santana struck out swinging.
D_Keuchel,9434,D Stubbs,9328,2016-05-22,Drew Stubbs grounded out to shortstop (Grounder).
D_Keuchel,9434,Z Cozart,2616,2016-06-18,Zack Cozart grounded out to third (Grounder).
D_Keuchel,9434,C Crisp,1572,2016-07-10,Coco Crisp grounded out to pitcher (Grounder).
D_Keuchel,9434,M Trumbo,6876,2016-08-21,Mark Trumbo grounded out to third (Grounder).
D_Keuchel,9434,D Gregorius,6012,2016-04-05,Didi Gregorius grounded out to second (Grounder).
D_Keuchel,9434,N Aoki,1307,2016-05-07,Nori Aoki struck out swinging.
D_Keuchel,9434,R Braun,3410,2016-04-10,Ryan Braun flied out to center (Fly).
D_Keuchel,9434,C Owings,1003,2016-06-02,Chris Owings grounded out to shortstop (Grounder).
D_Keuchel,9434,L Martin,1184,2016-05-07,Leonys Martin grounded out to second (Grounder).
D_Keuchel,9434,T Shaw,1198,2016-05-12,Travis Shaw grounded out to shortstop (Grounder).
D_Keuchel,9434,C Perez,1064,2016-05-28,Carlos Perez flied out to right (Fly).
D_Keuchel,9434,K Broxton,9253,2016-04-10,Keon Broxton flied out to right (Fliner (Liner)).
D_Keuchel,9434,J Rollins,971&,2016-05-17,Jimmy Rollins struck out swinging.
D_Keuchel,9434,S Souza Jr.,5667,2016-08-27,Steven Souza Jr. flied out to center (Fliner (Liner)).
D_Keuchel,9434,R Refsnyder,1377,2016-07-25,Rob Refsnyder grounded out to third (Grounder).
D_Keuchel,9434,B Hamilton,1019,2016-06-18,Billy Hamilton struck out swinging.
D_Keuchel,9434,D Navarro,3179,2016-05-17,Dioner Navarro struck out swinging.
D_Keuchel,9434,R Weeks Jr.,1849,2016-06-02,Rickie Weeks Jr. struck out looking.
D_Keuchel,9434,E Longoria,9368,2016-06-12,Evan Longoria struck out swinging.
D_Keuchel,9434,I Kinsler,6195,2016-04-15,Ian Kinsler flied out to center (Fly).
D_Keuchel,9434,F Pena,8298,2016-08-21,Francisco Pena flied out to shortstop (Fly).
D_Keuchel,9434,M Cabrera,4022,2016-05-17,Melky Cabrera grounded out to shortstop (Grounder).
D_Keuchel,9434,H Alberto,1190,2016-05-22,Hanser Alberto grounded into a double play to second (Grounder). Bobby Wilson out at second.
D_Keuchel,9434,C Beltran,589&,2016-04-05,Carlos Beltran flied out to center (Fliner (Fly)).
D_Keuchel,9434,L Martin,1184,2016-07-05,Leonys Martin struck out swinging.
D_Keuchel,9434,S Choo,3174,2016-08-05,Shin-Soo Choo struck out swinging.
D_Keuchel,9434,C Young,3882,2016-05-12,Chris Young struck out looking.
D_Keuchel,9434,J Smolinski,5408,2016-07-10,Jake Smolinski struck out swinging.
D_Keuchel,9434,N Mazara,1455,2016-04-21,Nomar Mazara grounded out to pitcher (Grounder).
D_Keuchel,9434,F Pena,8298,2016-08-21,Francisco Pena out on a dropped third strike.
D_Keuchel,9434,L Martin,1184,2016-05-07,Leonys Martin struck out swinging.
D_Keuchel,9434,J Bruce,9892,2016-06-18,Jay Bruce grounded out to pitcher (Grounder).
D_Keuchel,9434,C Beltran,589&,2016-08-05,Carlos Beltran grounded out to third (Grounder).
D_Keuchel,9434,T Barnhart,1020,2016-06-18,Tucker Barnhart grounded out to second (Grounder).
D_Keuchel,9434,R Rua,1240,2016-08-05,Ryan Rua grounded out to pitcher (Grounder).
D_Keuchel,9434,N Mazara,1455,2016-05-22,Nomar Mazara struck out looking.
D_Keuchel,9434,E Andrus,8709,2016-08-05,Elvis Andrus flied out to right (Fliner (Fly)).
D_Keuchel,9434,J Lowrie,4418,2016-07-19,Jed Lowrie grounded out to shortstop (Grounder).
D_Keuchel,9434,D Lee,1872,2016-07-05,Dae-Ho Lee flied out to right (Fliner (Liner)).
D_Keuchel,9434,J Ellsbury,4727,2016-04-05,Jacoby Ellsbury flied out to third (Fly).
D_Keuchel,9434,S Robinson,4249,2016-06-29,Shane Robinson flied out to center (Fliner (Fly)).
D_Keuchel,9434,D Jennings,1965,2016-06-12,Desmond Jennings reached on fielder's choice to shortstop (Grounder). Logan Morrison scored. Steven Souza Jr. out at second.
D_Keuchel,9434,K Calhoun,1120,2016-05-28,Kole Calhoun flied out to third (Fliner (Fly)).
D_Keuchel,9434,J Rollins,971&,2016-05-17,Jimmy Rollins flied out to center (Fliner (Fly)).
D_Keuchel,9434,J Bradley Jr.,1298,2016-05-12,Jackie Bradley Jr. grounded out to second (Grounder).
D_Keuchel,9434,K Marte,1361,2016-05-07,Ketel Marte struck out looking.
D_Keuchel,9434,M Bourn,6387,2016-06-02,Michael Bourn grounded out to pitcher (Grounder).
D_Keuchel,9434,F Gutierrez,3255,2016-07-05,Franklin Gutierrez struck out swinging.
D_Keuchel,9434,R Refsnyder,1377,2016-07-25,Rob Refsnyder grounded out to second (Grounder).
D_Keuchel,9434,K Marte,1361,2016-05-07,Ketel Marte flied out to second (Fly).
D_Keuchel,9434,K Marte,1361,2016-04-26,Ketel Marte struck out swinging.
D_Keuchel,9434,D Santana,1034,2016-04-10,Domingo Santana flied out to right (Fliner (Liner)).
D_Keuchel,9434,J Iglesias,1023,2016-04-15,Jose Iglesias grounded out to first (Grounder).
D_Keuchel,9434,K Kiermaier,1103,2016-08-27,Kevin Kiermaier flied out to right (Fly).
D_Keuchel,9434,B Drury,1161,2016-06-02,Brandon Drury struck out swinging.
D_Keuchel,9434,S Piscotty,1336,2016-08-16,Stephen Piscotty struck out looking.
D_Keuchel,9434,D DeShields,1137,2016-08-05,Delino DeShields struck out swinging.
D_Keuchel,9434,A Beltre,639&,2016-08-05,Adrian Beltre grounded out to shortstop (Grounder).
D_Keuchel,9434,M Trout,1015,2016-05-28,Mike Trout struck out swinging.
D_Keuchel,9434,K Calhoun,1120,2016-05-28,Kole Calhoun lined out to third (Liner).
D_Keuchel,9434,C Davis,9272,2016-08-21,Chris Davis flied out to left (Fliner (Fly)).
D_Keuchel,9434,S Pearce,9957,2016-06-12,Steve Pearce struck out swinging.
D_Keuchel,9434,C Beltran,589&,2016-07-25,Carlos Beltran grounded out to third (Grounder).
D_Keuchel,9434,T Saladino,1080,2016-05-17,Tyler Saladino grounded out to shortstop (Grounder).
D_Keuchel,9434,D Lee,1872,2016-04-26,Dae-Ho Lee grounded out to second (Grounder). Chris Iannetta advanced to 3B.
D_Keuchel,9434,A Beltre,639&,2016-04-21,Adrian Beltre grounded out to third (Grounder).
D_Keuchel,9434,D Ortiz,745&,2016-05-12,David Ortiz struck out swinging.
D_Keuchel,9434,L Forsythe,7185,2016-06-12,Logan Forsythe struck out swinging.
D_Keuchel,9434,D Santana,1032,2016-05-02,Danny Santana struck out looking.
D_Keuchel,9434,C Crisp,1572,2016-07-10,Coco Crisp grounded out to pitcher (Grounder).
D_Keuchel,9434,M Carpenter,8090,2016-08-16,Matt Carpenter grounded out to pitcher (Grounder).
D_Keuchel,9434,J Hardy,3797,2016-08-21,J.J. Hardy grounded out to pitcher (Grounder).
D_Keuchel,9434,B Wilson,6564,2016-05-22,Bobby Wilson struck out swinging.
D_Keuchel,9434,K Seager,9785,2016-07-05,Kyle Seager struck out swinging.
D_Keuchel,9434,D Gregorius,6012,2016-07-25,Didi Gregorius flied out to left (Fliner (Fly)).
D_Keuchel,9434,C Owings,1003,2016-06-02,Chris Owings grounded out to shortstop (Grounder).
D_Keuchel,9434,R Chirinos,3142,2016-08-05,Robinson Chirinos out on a dropped third strike.
D_Keuchel,9434,K Seager,9785,2016-04-26,Kyle Seager flied out to left (Fly).
D_Keuchel,9434,A Beltre,639&,2016-08-05,Adrian Beltre grounded out to shortstop (Grounder).
D_Keuchel,9434,E Andrus,8709,2016-08-05,Elvis Andrus grounded out to third (Grounder).
D_Keuchel,9434,J Villar,1007,2016-04-10,Jonathan Villar struck out swinging.
D_Keuchel,9434,B Phillips,791&,2016-06-18,Brandon Phillips grounded out to third (Grounder).
D_Keuchel,9434,C Beltran,589&,2016-07-25,Carlos Beltran grounded out to third (Grounder).
D_Keuchel,9434,D Valencia,6364,2016-07-19,Danny Valencia struck out looking.
D_Keuchel,9434,I Desmond,6885,2016-08-05,Ian Desmond flied out to right (Fliner (Liner)).
D_Keuchel,9434,M Trout,1015,2016-05-28,Mike Trout flied out to first (Fly).
D_Keuchel,9434,J Giavotella,6740,2016-06-29,Johnny Giavotella grounded out to shortstop (Grounder).
D_Keuchel,9434,P Fielder,4613,2016-04-21,Prince Fielder flied out to left (Fly).
D_Keuchel,9434,C Cron,1254,2016-05-28,C.J. Cron grounded out to second (Grounder).
D_Keuchel,9434,H Alberto,1190,2016-04-21,Hanser Alberto struck out swinging.
D_Keuchel,9434,N Cruz,2434,2016-05-07,Nelson Cruz struck out swinging.
D_Keuchel,9434,E Andrus,8709,2016-04-21,Elvis Andrus struck out swinging.
D_Keuchel,9434,M Betts,1361,2016-05-12,Mookie Betts grounded out to third (Grounder).
D_Keuchel,9434,E Andrus,8709,2016-04-21,Elvis Andrus flied out to right (Fliner (Fly)).
D_Keuchel,9434,D Ortiz,745&,2016-05-12,David Ortiz grounded out to second (Grounder).
D_Keuchel,9434,R Chirinos,3142,2016-08-05,Robinson Chirinos grounded out to shortstop (Grounder).
D_Keuchel,9434,D DeShields,1137,2016-04-21,Delino DeShields flied out to center (Fly).
D_Keuchel,9434,L Morrison,9205,2016-06-12,Logan Morrison grounded out to second (Grounder).
D_Keuchel,9434,C Beltran,589&,2016-08-05,Carlos Beltran struck out swinging.
D_Keuchel,9434,T Shaw,1198,2016-05-12,Travis Shaw grounded out to second (Grounder).
D_Keuchel,9434,I Desmond,6885,2016-05-22,Ian Desmond grounded out to first (Grounder).
D_Keuchel,9434,T Shaw,1198,2016-05-12,Travis Shaw grounded out to first (Grounder). Chris Young advanced to 3B.
D_Keuchel,9434,L Cain,9077,2016-06-24,Lorenzo Cain grounded out to shortstop (Grounder).
D_Keuchel,9434,P Fielder,4613,2016-04-21,Prince Fielder reached on fielder's choice to second (Grounder). Nomar Mazara scored. Adrian Beltre out at second.
D_Keuchel,9434,N Mazara,1455,2016-05-22,Nomar Mazara grounded out to first (Grounder).
D_Keuchel,9434,V Martinez,393&,2016-07-31,Victor Martinez flied out to right (Fliner (Fly)).
D_Keuchel,9434,J Iglesias,1023,2016-07-31,Jose Iglesias reached on fielder's choice to shortstop (Grounder). James McCann out at second.
D_Keuchel,9434,I Kinsler,6195,2016-07-31,Ian Kinsler grounded out to second (Grounder).
D_Keuchel,9434,D Stubbs,9328,2016-05-22,Drew Stubbs grounded out to shortstop (Grounder).
D_Keuchel,9434,N Castellanos,1173,2016-07-31,Nick Castellanos flied out to right (Fly).
D_Keuchel,9434,E Hosmer,3516,2016-06-24,Eric Hosmer grounded out to second (Grounder).
D_Keuchel,9434,J Iglesias,1023,2016-07-31,Jose Iglesias grounded out to shortstop (Grounder).
D_Keuchel,9434,C Maybin,5223,2016-07-31,Cameron Maybin grounded out to first (Grounder).
D_Keuchel,9434,K Morales,8610,2016-06-24,Kendrys Morales flied out to right (Fliner (Liner)).
D_Keuchel,9434,K Morales,8610,2016-06-24,Kendrys Morales grounded out to third (Grounder).
D_Keuchel,9434,W Merrifield,1128,2016-06-24,Whit Merrifield grounded out to shortstop (Grounder).
D_Keuchel,9434,H Alberto,1190,2016-04-21,Hanser Alberto sacrificed to pitcher (Bunt Grounder). Ryan Rua advanced to 3B. Bryan Holaday advanced to 2B.
D_Keuchel,9434,L Cain,9077,2016-06-24,Lorenzo Cain flied out to left (Fliner (Fly)).
D_Keuchel,9434,L Cain,9077,2016-06-24,Lorenzo Cain flied out to right (Fly).
D_Keuchel,9434,N Castellanos,1173,2016-07-31,Nick Castellanos struck out looking.
D_Keuchel,9434,C Iannetta,8267,2016-04-26,Chris Iannetta grounded out to shortstop (Grounder).
D_Keuchel,9434,S Perez,7304,2016-06-24,Salvador Perez flied out to shortstop (Fliner (Fly)).
D_Keuchel,9434,D Pedroia,8370,2016-05-12,Dustin Pedroia grounded out to pitcher (Grounder).
D_Keuchel,9434,B Eibner,1136,2016-06-24,Brett Eibner flied out to center (Fly).
D_Keuchel,9434,V Martinez,393&,2016-07-31,Victor Martinez singled to right (Fliner (Liner)).
D_Keuchel,9434,C Iannetta,8267,2016-07-05,Chris Iannetta grounded out to shortstop (Grounder). Dae-Ho Lee scored.
D_Keuchel,9434,P Orlando,8628,2016-06-24,Paulo Orlando reached on error to third (Grounder). Error by Danny Worth.
D_Keuchel,9434,E Hosmer,3516,2016-06-24,Eric Hosmer singled to right (Grounder).
D_Keuchel,9434,C Cuthbert,1047,2016-06-24,Cheslor Cuthbert homered (Fliner (Fly)).
D_Keuchel,9434,I Desmond,6885,2016-05-22,Ian Desmond advanced on a passed ball to 3B. Passed ball by Jason Castro.
D_Keuchel,9434,E Rosario,1215,2016-05-02,Eddie Rosario hit a sacrifice fly to left (Fliner (Fly)). Miguel Sano scored.
D_Keuchel,9434,E Andrus,8709,2016-05-22,Elvis Andrus singled to center (Liner).
D_Keuchel,9434,R Cano,3269,2016-07-05,Robinson Cano advanced on a wild pitch to 3B.
D_Keuchel,9434,C Vazquez,9774,2016-05-12,Christian Vazquez singled to right (Grounder).
D_Keuchel,9434,B Eibner,1136,2016-06-24,Brett Eibner doubled to right (Fliner (Liner)). Paulo Orlando advanced to 3B.
D_Keuchel,9434,H Ramirez,8001,2016-05-12,Hanley Ramirez singled to left (Fliner (Liner)).
D_Keuchel,9434,R Rua,1240,2016-04-21,Ryan Rua singled to right (Grounder).
D_Keuchel,9434,N Mazara,1455,2016-06-07,Nomar Mazara singled to right (Grounder).
D_Keuchel,9434,A Rodriguez,1274,2016-04-05,Alex Rodriguez advanced on a stolen base to 2B.
D_Keuchel,9434,W Merrifield,1128,2016-06-24,Whit Merrifield singled to right (Grounder).
D_Keuchel,9434,P Fielder,4613,2016-05-22,Prince Fielder walked.
D_Keuchel,9434,F Gutierrez,3255,2016-05-07,Franklin Gutierrez singled to right (Fliner (Fly)).
D_Keuchel,9434,M Trout,1015,2016-06-29,Mike Trout walked.
D_Keuchel,9434,C Young,3882,2016-05-12,Chris Young advanced on a wild pitch to 2B.
D_Keuchel,9434,R Rua,1240,2016-05-22,Ryan Rua singled to center (Grounder). Elvis Andrus advanced to 3B.
D_Keuchel,9434,J Segura,5933,2016-06-02,Jean Segura advanced on a wild pitch to 2B.
D_Keuchel,9434,R Cano,3269,2016-05-07,Robinson Cano singled to center (Liner).
D_Keuchel,9434,J Lowrie,4418,2016-07-10,Jed Lowrie singled to right (Liner).
D_Keuchel,9434,I Desmond,6885,2016-04-21,Ian Desmond doubled to center (Fliner (Liner)).
D_Keuchel,9434,A Beltre,639&,2016-04-21,Adrian Beltre singled to center (Grounder).
D_Keuchel,9434,B Wilson,6564,2016-05-22,Bobby Wilson singled to center (Liner). Ryan Rua scored.
D_Keuchel,9434,R Rua,1240,2016-05-22,Ryan Rua advanced on a stolen base to 3B.
D_Keuchel,9434,C Vazquez,9774,2016-05-12,Christian Vazquez advanced on a wild pitch to 2B.
D_Keuchel,9434,D Valencia,6364,2016-07-10,Danny Valencia walked.
D_Keuchel,9434,R Odor,1228,2016-08-05,Rougned Odor reached on dropped third strike (wp).
D_Keuchel,9434,A Garcia,5760,2016-05-17,Avisail Garcia singled to right (Fliner (Liner)).
D_Keuchel,9434,M Bourn,6387,2016-06-02,Michael Bourn singled to right (Grounder).
D_Keuchel,9434,K Seager,9785,2016-05-07,Kyle Seager reached on error to shortstop (Liner). Error by Carlos Correa.
D_Keuchel,9434,L Forsythe,7185,2016-08-27,Logan Forsythe tripled to left (Fly).
D_Keuchel,9434,M Aviles,5986,2016-07-31,Mike Aviles walked. Victor Martinez advanced to 3B. Justin Upton advanced to 2B.
D_Keuchel,9434,M Trumbo,6876,2016-08-21,Mark Trumbo walked.
D_Keuchel,9434,L Martin,1184,2016-05-07,Leonys Martin advanced on a wild pitch to 2B.
D_Keuchel,9434,R Rua,1240,2016-06-07,Ryan Rua singled to center (Liner).
D_Keuchel,9434,Y Molina,7007,2016-08-16,Yadier Molina grounded out to second (Grounder). Matt Carpenter scored. Brandon Moss advanced to 2B.
D_Keuchel,9434,C Vazquez,9774,2016-05-12,Christian Vazquez walked.
D_Keuchel,9434,C Iannetta,8267,2016-04-26,Chris Iannetta walked.
D_Keuchel,9434,C Iannetta,8267,2016-05-07,Chris Iannetta walked.
D_Keuchel,9434,J Nelson,1054,2016-04-10,Jimmy Nelson singled to third (Grounder).
D_Keuchel,9434,M Maldonado,6887,2016-04-10,Martin Maldonado reached on error to shortstop (Grounder). Error by Tyler White.
D_Keuchel,9434,D Pedroia,8370,2016-05-12,Dustin Pedroia singled to shortstop (Grounder).
D_Keuchel,9434,R Rua,1240,2016-04-21,Ryan Rua singled to right (Liner).
D_Keuchel,9434,A Beltre,639&,2016-04-21,Adrian Beltre singled to left (Grounder). Nomar Mazara advanced to 3B.
D_Keuchel,9434,L Morrison,9205,2016-06-12,Logan Morrison singled to right (Liner).
D_Keuchel,9434,L Martin,1184,2016-05-07,Leonys Martin singled to shortstop (Grounder).
