playername,playerid,vsname,vsid,date,Play
J_Biagini,1319,D Santana,1032,2016-05-19,Danny Santana was caught stealing.
J_Biagini,1319,C Correa,1416,2016-08-03,Carlos Correa struck out looking.
J_Biagini,1319,K Cowart,1149,2016-09-16,Kaleb Cowart flied out to center (Fliner (Fly)).
J_Biagini,1319,J Ramirez,1351,2016-07-01,Jose Ramirez flied out to center (Fliner (Liner)).
J_Biagini,1319,H Ramirez,8001,2016-05-27,Hanley Ramirez grounded into a double play to shortstop (Grounder). Travis Shaw out at second.
J_Biagini,1319,B Holt,9345,2016-10-02,Brock Holt struck out swinging.
J_Biagini,1319,B Holt,9345,2016-09-30,Brock Holt grounded out to shortstop (Grounder).
J_Biagini,1319,T Beckham,7949,2016-08-08,Tim Beckham reached on fielder's choice to second (Grounder). Steven Souza Jr. out at third.
J_Biagini,1319,G Sanchez,1144,2016-09-26,Gary Sanchez flied out to right (Fliner (Liner)).
J_Biagini,1319,H Kim,1871,2016-06-09,Hyun Soo Kim flied out to left (Fly).
J_Biagini,1319,M Napoli,3057,2016-07-02,Mike Napoli struck out swinging.
J_Biagini,1319,B Swihart,1317,2016-05-29,Blake Swihart flied out to left (Fliner (Fly)).
J_Biagini,1319,M Machado,1149,2016-08-30,Manny Machado flied out to right (Fly).
J_Biagini,1319,N Reimold,3441,2016-08-29,Nolan Reimold struck out swinging.
J_Biagini,1319,J Ellsbury,4727,2016-08-15,Jacoby Ellsbury reached on fielder's choice to pitcher (Grounder). Brian McCann out at home. Aaron Judge advanced to 3B. Aaron Hicks advanced to 2B.
J_Biagini,1319,C Headley,4720,2016-08-15,Chase Headley struck out swinging.
J_Biagini,1319,A Jones,6368,2016-06-09,Adam Jones flied out to center (Fly). Jonathan Schoop advanced to 3B.
J_Biagini,1319,J Altuve,5417,2016-08-01,Jose Altuve fouled out to first (Fly).
J_Biagini,1319,J Rutledge,1116,2016-05-29,Josh Rutledge struck out swinging.
J_Biagini,1319,T Naquin,1335,2016-08-20,Tyler Naquin struck out swinging.
J_Biagini,1319,J Schoop,1126,2016-08-29,Jonathan Schoop flied out to second (Fliner (Fly)).
J_Biagini,1319,E Gattis,1100,2016-08-01,Evan Gattis struck out swinging.
J_Biagini,1319,S Leon,5273,2016-09-30,Sandy Leon struck out swinging.
J_Biagini,1319,N Franklin,1016,2016-08-08,Nick Franklin flied out to center (Fliner (Liner)).
J_Biagini,1319,B Dozier,9810,2016-05-19,Brian Dozier out on a dropped third strike.
J_Biagini,1319,P Alvarez,2495,2016-04-20,Pedro Alvarez struck out swinging.
J_Biagini,1319,R Odor,1228,2016-05-03,Rougned Odor grounded out to second (Grounder).
J_Biagini,1319,C Cron,1254,2016-08-25,C.J. Cron grounded into a double play to second (Grounder). Mike Trout scored. Albert Pujols out at second.
J_Biagini,1319,H Kim,1871,2016-08-29,Hyun Soo Kim grounded out to shortstop (Grounder).
J_Biagini,1319,T Shaw,1198,2016-06-03,Travis Shaw struck out swinging.
J_Biagini,1319,M Napoli,3057,2016-08-20,Mike Napoli fouled out to first (Fliner (Fly)).
J_Biagini,1319,E Rosario,1215,2016-08-26,Eddie Rosario hit a sacrifice fly to center (Fliner (Liner)). Jorge Polanco scored.
J_Biagini,1319,Y Solarte,5352,2016-07-26,Yangervis Solarte flied out to shortstop (Fly).
J_Biagini,1319,C Santana,2396,2016-08-20,Carlos Santana grounded out to second (Grounder).
J_Biagini,1319,T White,1556,2016-08-01,Tyler White lined out to pitcher (Liner).
J_Biagini,1319,B Nicholas,1119,2016-05-03,Brett Nicholas grounded out to second (Grounder).
J_Biagini,1319,E Andrus,8709,2016-05-03,Elvis Andrus struck out looking.
J_Biagini,1319,G Petit,3812,2016-08-25,Gregorio Petit fouled out to right (Fliner (Fly)).
J_Biagini,1319,M Betts,1361,2016-09-11,Mookie Betts flied out to right (Fly).
J_Biagini,1319,M Trout,1015,2016-08-23,Mike Trout was caught stealing.
J_Biagini,1319,A Pujols,1177,2016-08-23,Albert Pujols grounded out to third (Grounder).
J_Biagini,1319,C Dickerson,1076,2016-09-13,Corey Dickerson out on a dropped third strike.
J_Biagini,1319,J Kipnis,9776,2016-08-20,Jason Kipnis grounded out to second (Grounder).
J_Biagini,1319,A Lind,8027,2016-07-22,Adam Lind grounded out to shortstop (Grounder).
J_Biagini,1319,T Shaw,1198,2016-09-11,Travis Shaw struck out swinging.
J_Biagini,1319,M Trumbo,6876,2016-06-19,Mark Trumbo flied out to left (Fly).
J_Biagini,1319,C Hernandez,1055,2016-06-13,Cesar Hernandez struck out swinging.
J_Biagini,1319,J Upton,5222,2016-07-09,Justin Upton struck out swinging.
J_Biagini,1319,L Martin,1184,2016-07-22,Leonys Martin grounded out to second (Grounder).
J_Biagini,1319,X Bogaerts,1216,2016-04-08,Xander Bogaerts grounded out to third (Grounder).
J_Biagini,1319,L Forsythe,7185,2016-09-13,Logan Forsythe reached on fielder's choice to shortstop (Grounder). Bobby Wilson out at second.
J_Biagini,1319,S Castro,4579,2016-09-07,Starlin Castro flied out to second (Fly).
J_Biagini,1319,J Hardy,3797,2016-09-27,J.J. Hardy grounded out to shortstop (Grounder).
J_Biagini,1319,T Story,1256,2016-06-28,Trevor Story grounded out to second (Grounder). Carlos Gonzalez advanced to 2B.
J_Biagini,1319,C Headley,4720,2016-09-07,Chase Headley struck out swinging.
J_Biagini,1319,D Ortiz,745&,2016-04-08,David Ortiz struck out swinging.
J_Biagini,1319,M Reynolds,7619,2016-06-28,Mark Reynolds grounded out to second (Grounder). Carlos Gonzalez advanced to 3B.
J_Biagini,1319,J Bradley Jr.,1298,2016-05-29,Jackie Bradley Jr. struck out swinging.
J_Biagini,1319,M Machado,1149,2016-09-27,Manny Machado flied out to center (Fly).
J_Biagini,1319,A Beltre,639&,2016-05-14,Adrian Beltre fouled out to first (Fly).
J_Biagini,1319,C Adames,6013,2016-06-28,Cristhian Adames grounded out to shortstop (Grounder).
J_Biagini,1319,H Ramirez,8001,2016-04-08,Hanley Ramirez grounded out to shortstop (Grounder).
J_Biagini,1319,B Guyer,2636,2016-05-18,Brandon Guyer lined out to shortstop (Liner).
J_Biagini,1319,T Shaw,1198,2016-04-09,Travis Shaw struck out swinging.
J_Biagini,1319,B Wilson,6564,2016-09-03,Bobby Wilson grounded out to third (Grounder).
J_Biagini,1319,D Descalso,8392,2016-06-28,Daniel Descalso struck out swinging.
J_Biagini,1319,P Alvarez,2495,2016-09-27,Pedro Alvarez out on a dropped third strike.
J_Biagini,1319,T Motter,1239,2016-05-18,Taylor Motter fouled out to third (Fly).
J_Biagini,1319,A Romine,5491,2016-09-07,Austin Romine grounded out to shortstop (Grounder).
J_Biagini,1319,J Graterol,5398,2016-09-18,Juan Graterol flied out to shortstop (Fliner (Fly)).
J_Biagini,1319,S Souza Jr.,5667,2016-08-10,Steven Souza Jr. flied out to right (Fliner (Fly)).
J_Biagini,1319,B Eibner,1136,2016-07-05,Brett Eibner flied out to right (Fly).
J_Biagini,1319,E Longoria,9368,2016-05-18,Evan Longoria grounded out to pitcher (Grounder).
J_Biagini,1319,A Rosales,9682,2016-07-27,Adam Rosales flied out to left (Fliner (Liner)).
J_Biagini,1319,L Maile,1335,2016-08-10,Luke Maile struck out swinging.
J_Biagini,1319,E Andrus,8709,2016-05-14,Elvis Andrus flied out to shortstop (Fly).
J_Biagini,1319,A Gordon,5209,2016-07-05,Alex Gordon struck out swinging.
J_Biagini,1319,S Perez,7304,2016-07-05,Salvador Perez struck out swinging.
J_Biagini,1319,J Schoop,1126,2016-09-27,Jonathan Schoop flied out to center (Fliner (Liner)).
J_Biagini,1319,J Rollins,971&,2016-04-26,Jimmy Rollins struck out swinging.
J_Biagini,1319,T Frazier,785&,2016-06-26,Todd Frazier flied out to shortstop (Fly).
J_Biagini,1319,A Eaton,1120,2016-06-26,Adam Eaton grounded out to pitcher (Grounder).
J_Biagini,1319,T Frazier,785&,2016-04-26,Todd Frazier flied out to shortstop (Fly).
J_Biagini,1319,T Anderson,1517,2016-06-26,Tim Anderson struck out swinging.
J_Biagini,1319,M Cabrera,4022,2016-04-26,Melky Cabrera grounded out to shortstop (Grounder).
J_Biagini,1319,C Colon,1114,2016-07-05,Christian Colon flied out to right (Fliner (Fly)).
J_Biagini,1319,A Escobar,6310,2016-07-05,Alcides Escobar grounded out to pitcher (Grounder).
J_Biagini,1319,N Ahmed,1214,2016-07-20,Nick Ahmed struck out swinging.
J_Biagini,1319,B Lawrie,5247,2016-04-26,Brett Lawrie grounded out to shortstop (Grounder).
J_Biagini,1319,A Garcia,5760,2016-04-26,Avisail Garcia grounded out to third (Grounder).
J_Biagini,1319,J Martinez,6184,2016-06-06,J.D. Martinez reached on fielder's choice to third (Grounder). Miguel Cabrera out at third. Victor Martinez advanced to 2B.
J_Biagini,1319,K Kiermaier,1103,2016-05-16,Kevin Kiermaier grounded out to first (Grounder).
J_Biagini,1319,R Weeks Jr.,1849,2016-07-20,Rickie Weeks Jr. grounded out to shortstop (Grounder).
J_Biagini,1319,R Mondesi,1376,2016-08-07,Raul Mondesi flied out to right (Fly).
J_Biagini,1319,S Pearce,9957,2016-05-16,Steve Pearce flied out to second (Fly).
J_Biagini,1319,C Rupp,1114,2016-06-16,Cameron Rupp grounded out to shortstop (Grounder).
J_Biagini,1319,C Iannetta,8267,2016-07-23,Chris Iannetta grounded out to third (Grounder).
J_Biagini,1319,J Paredes,5481,2016-06-16,Jimmy Paredes flied out to center (Fly).
J_Biagini,1319,N Aoki,1307,2016-07-23,Nori Aoki singled to right (Grounder).
J_Biagini,1319,D Navarro,3179,2016-04-26,Dioner Navarro walked.
J_Biagini,1319,M Betts,1361,2016-04-09,Mookie Betts advanced on a stolen base to 2B.
J_Biagini,1319,M Cabrera,4022,2016-06-26,Melky Cabrera reached on dropped third strike (wp).
J_Biagini,1319,A Jackson,9848,2016-04-26,Austin Jackson singled to right (Fliner (Fly)).
J_Biagini,1319,R Shaffer,1327,2016-08-10,Richie Shaffer hit a ground rule double (Liner).
J_Biagini,1319,M Moreland,3086,2016-05-14,Mitch Moreland singled to left (Grounder).
J_Biagini,1319,B Holt,9345,2016-04-15,Brock Holt walked.
J_Biagini,1319,N Reimold,3441,2016-07-30,Nolan Reimold singled to center (Fliner (Liner)). J.J. Hardy advanced to 2B.
J_Biagini,1319,A Simmons,1084,2016-09-18,Andrelton Simmons walked. Albert Pujols advanced to 2B.
J_Biagini,1319,B Swihart,1317,2016-04-09,Blake Swihart singled to right (Liner).
J_Biagini,1319,D Ortiz,745&,2016-04-15,David Ortiz advanced on a stolen base to 2B.
J_Biagini,1319,M Trout,1015,2016-08-23,Mike Trout advanced on a stolen base to 2B.
J_Biagini,1319,M Betts,1361,2016-04-09,Mookie Betts walked. Blake Swihart advanced to 2B.
J_Biagini,1319,C Asche,1199,2016-06-13,Cody Asche advanced on a stolen base to 2B.
J_Biagini,1319,H Kim,1871,2016-06-19,Hyun Soo Kim singled to right (Grounder). Adam Jones advanced to 2B.
J_Biagini,1319,J Pederson,1189,2016-05-07,Joc Pederson reached on fielder's choice and error to second (Grounder). Howie Kendrick advanced to 3B on error. Error by Darwin Barney.
J_Biagini,1319,J Schoop,1126,2016-06-19,Jonathan Schoop singled to left (Liner). Matt Wieters advanced to 2B.
J_Biagini,1319,J Rickard,1327,2016-06-11,Joey Rickard singled to left (Liner).
J_Biagini,1319,C Cron,1254,2016-09-18,C.J. Cron hit a sacrifice fly to right (Fliner (Liner)). Mike Trout scored.
J_Biagini,1319,K Kiermaier,1103,2016-09-03,Kevin Kiermaier homered (Fliner (Liner)). Logan Forsythe scored.
J_Biagini,1319,A Jones,6368,2016-09-27,Adam Jones singled to third (Grounder).
J_Biagini,1319,S Leon,5273,2016-09-11,Sandy Leon was hit by a pitch.
J_Biagini,1319,I Kinsler,6195,2016-07-09,"Ian Kinsler advanced on a stolen base to 2B, advanced to 3B on error. Error by Joseph Biagini."
J_Biagini,1319,J Ellsbury,4727,2016-09-07,Jacoby Ellsbury doubled to right (Grounder).
J_Biagini,1319,M Machado,1149,2016-04-20,Manny Machado walked.
J_Biagini,1319,M Trout,1015,2016-08-23,Mike Trout singled to right (Liner).
J_Biagini,1319,J Ellsbury,4727,2016-05-24,Jacoby Ellsbury singled to shortstop (Grounder). Didi Gregorius scored. Austin Romine advanced to 3B.
J_Biagini,1319,A Pujols,1177,2016-09-18,Albert Pujols singled to right (Grounder). Mike Trout advanced to 3B.
J_Biagini,1319,J Rickard,1327,2016-04-20,Joey Rickard singled to shortstop (Grounder). Caleb Joseph advanced to 3B.
J_Biagini,1319,A Judge,1564,2016-08-15,Aaron Judge walked. Brian McCann advanced to 2B.
J_Biagini,1319,R Flaherty,7888,2016-06-09,Ryan Flaherty walked.
J_Biagini,1319,M Machado,1149,2016-06-11,Manny Machado singled to left (Fliner (Fly)). Joey Rickard advanced to 3B on error. Manny Machado advanced to 2B on error. Error by Michael Saunders.
J_Biagini,1319,D Pedroia,8370,2016-04-15,Dustin Pedroia singled to pitcher (Grounder). Christian Vazquez scored.
J_Biagini,1319,S Pearce,9957,2016-08-30,Steve Pearce was hit by a pitch.
J_Biagini,1319,D Gregorius,6012,2016-05-31,Didi Gregorius singled to right (Grounder).
J_Biagini,1319,P Fielder,4613,2016-05-03,Prince Fielder doubled to left (Fliner (Liner)).
J_Biagini,1319,M Napoli,3057,2016-07-01,Mike Napoli singled to center (Grounder). Jason Kipnis advanced to 2B.
J_Biagini,1319,J Kipnis,9776,2016-07-02,Jason Kipnis reached on dropped third strike (wp).
J_Biagini,1319,E Escobar,6153,2016-08-26,Eduardo Escobar singled to right (Liner). Jorge Polanco advanced to 2B.
J_Biagini,1319,C Vazquez,9774,2016-05-29,Christian Vazquez singled to second (Grounder).
J_Biagini,1319,I Kinsler,6195,2016-06-07,Ian Kinsler singled to left (Grounder). Justin Upton scored. Jarrod Saltalamacchia advanced to 3B. Jose Iglesias advanced to 2B.
J_Biagini,1319,J Schoop,1126,2016-06-09,Jonathan Schoop doubled to left (Fliner (Liner)).
J_Biagini,1319,C Joseph,7087,2016-04-20,Caleb Joseph doubled to right (Fliner (Liner)).
J_Biagini,1319,J Castro,8722,2016-08-01,Jason Castro singled to right (Grounder).
J_Biagini,1319,P Bourjos,2578,2016-06-13,Peter Bourjos hit a ground rule double (Fly). Cody Asche scored.
J_Biagini,1319,D Ortiz,745&,2016-06-03,David Ortiz doubled to left (Fliner (Fly)). Xander Bogaerts advanced to 3B.
J_Biagini,1319,K Suzuki,8259,2016-08-26,Kurt Suzuki was hit by a pitch. Jorge Polanco advanced to 3B. Eduardo Escobar advanced to 2B.
J_Biagini,1319,X Bogaerts,1216,2016-09-30,Xander Bogaerts tripled to right (Fliner (Liner)).
J_Biagini,1319,D Santana,1032,2016-05-19,Danny Santana singled to center (Grounder).
J_Biagini,1319,J Saltalamacchia,5557,2016-06-07,Jarrod Saltalamacchia walked. Justin Upton advanced to 2B.
J_Biagini,1319,H Ramirez,8001,2016-09-11,Hanley Ramirez homered (Fliner (Fly)).
J_Biagini,1319,J Uribe,454&,2016-07-02,Juan Uribe was hit by a pitch. Jason Kipnis scored. Jose Ramirez advanced to 3B. Carlos Santana advanced to 2B.
J_Biagini,1319,A Simmons,1084,2016-09-16,Andrelton Simmons walked. C.J. Cron advanced to 3B. Jefry Marte advanced to 2B.
J_Biagini,1319,T Shaw,1198,2016-05-27,Travis Shaw singled to right (Grounder). Dustin Pedroia scored.
J_Biagini,1319,D Pedroia,8370,2016-09-30,Dustin Pedroia singled to catcher (Grounder). Andrew Benintendi scored on error. Dustin Pedroia advanced to 2B. Error by Russell Martin.
