playername,playerid,vsname,vsid,date,Play
J_Martinez,7996,C Edwards Jr.,1360,2016-09-25,Jose Martinez walked.
J_Martinez,7996,D Straily,9460,2016-09-29,Jose Martinez walked. Aledmys Diaz advanced to 2B.
J_Martinez,7996,C Rusin,9895,2016-09-21,Jose Martinez singled to left (Fliner (Fly)).
J_Martinez,7996,R Zastryzny,1509,2016-09-24,Jose Martinez doubled to left (Liner).
J_Martinez,7996,W Peralta,1429,2016-09-26,Jose Martinez singled to center (Grounder).
J_Martinez,7996,G Kontos,9486,2016-09-16,Jose Martinez grounded out to shortstop (Grounder).
J_Martinez,7996,D Straily,9460,2016-09-29,Jose Martinez flied out to right (Fly). Aledmys Diaz advanced to 3B.
J_Martinez,7996,D Straily,9460,2016-09-29,Jose Martinez flied out to center (Fliner (Fly)).
J_Martinez,7996,F Rivero,1207,2016-09-06,Jose Martinez grounded out to third (Grounder).
