playername,playerid,vsname,vsid,date,Play
J_Teheran,6797,C Blackmon,7859,2016-07-17,Charlie Blackmon advanced on a wild pitch to 2B.
J_Teheran,6797,A Amarista,9063,2016-06-08,Alexi Amarista singled to center (Liner).
J_Teheran,6797,C Hernandez,1055,2016-07-30,Cesar Hernandez walked.
J_Teheran,6797,J Iglesias,1023,2016-10-02,Jose Iglesias singled to shortstop (Grounder).
J_Teheran,6797,R Quinn,1354,2016-09-27,Roman Quinn doubled to left (Fliner (Liner)).
J_Teheran,6797,B Harper,1157,2016-08-19,Bryce Harper grounded out to second (Grounder). Trea Turner scored.
J_Teheran,6797,W Ramos,1433,2016-08-19,Wilson Ramos doubled to center (Fliner (Liner)).
J_Teheran,6797,B Drury,1161,2016-08-24,Brandon Drury doubled to center (Fly).
J_Teheran,6797,M Cabrera,1744,2016-10-02,Miguel Cabrera singled to right (Liner).
J_Teheran,6797,J Realmuto,1173,2016-07-01,J.T. Realmuto singled to shortstop (Grounder).
J_Teheran,6797,M Upton Jr.,5015,2016-06-08,Melvin Upton Jr. advanced on a stolen base to 2B.
J_Teheran,6797,G Polanco,1290,2016-05-18,Gregory Polanco doubled to right (Liner).
J_Teheran,6797,A Eaton,1120,2016-07-09,Adam Eaton walked.
J_Teheran,6797,W Ramos,1433,2016-04-14,Wilson Ramos doubled to center (Liner). Daniel Murphy scored.
J_Teheran,6797,C Robinson,6908,2016-08-19,Clint Robinson walked.
J_Teheran,6797,O Arcia,1030,2016-08-30,Oswaldo Arcia doubled to left (Fliner (Liner)).
J_Teheran,6797,C Heisey,3978,2016-04-14,Chris Heisey singled to left (Liner). Stephen Strasburg advanced to 2B.
J_Teheran,6797,E Hosmer,3516,2016-05-13,Eric Hosmer singled to left (Grounder).
J_Teheran,6797,J Hazelbaker,9399,2016-04-09,Jeremy Hazelbaker walked.
J_Teheran,6797,A Cabrera,4962,2016-06-25,Asdrubal Cabrera singled to third (Bunt Grounder).
J_Teheran,6797,T Story,1256,2016-07-22,Trevor Story walked. Carlos Gonzalez advanced to 2B.
J_Teheran,6797,W Ramos,1433,2016-04-04,Wilson Ramos singled to left (Fliner (Liner)).
J_Teheran,6797,M Betts,1361,2016-04-25,Mookie Betts doubled to right (Fliner (Fly)).
J_Teheran,6797,C Granderson,4747,2016-06-25,Curtis Granderson singled to left (Fliner (Liner)).
J_Teheran,6797,D Espinosa,9219,2016-08-19,Danny Espinosa walked.
J_Teheran,6797,D Dietrich,1054,2016-05-29,Derek Dietrich walked.
J_Teheran,6797,X Bogaerts,1216,2016-04-25,Xander Bogaerts advanced on a stolen base to 2B.
J_Teheran,6797,C Granderson,4747,2016-06-25,Curtis Granderson advanced on a stolen base to 2B.
J_Teheran,6797,T Wolters,1147,2016-07-17,Tony Wolters singled to right (Fliner (Liner)).
J_Teheran,6797,K Morales,8610,2016-05-13,Kendrys Morales walked. Eric Hosmer advanced to 2B.
J_Teheran,6797,K Wong,1253,2016-04-09,Kolten Wong advanced on a wild pitch to 3B.
J_Teheran,6797,A Rizzo,3473,2016-05-01,Anthony Rizzo singled to right (Grounder).
J_Teheran,6797,T Shaw,1198,2016-04-25,Travis Shaw walked.
J_Teheran,6797,J Shuck,6677,2016-07-09,J.B. Shuck singled to center (Liner).
J_Teheran,6797,C Granderson,4747,2016-09-09,Curtis Granderson walked.
J_Teheran,6797,M Ozuna,1032,2016-07-01,Marcell Ozuna singled to right (Liner).
J_Teheran,6797,C Blackmon,7859,2016-07-22,Charlie Blackmon singled to center (Fliner (Fly)).
J_Teheran,6797,D Gordon,8203,2016-09-14,Dee Gordon singled to left (Fliner (Liner)).
J_Teheran,6797,O Herrera,1147,2016-09-27,Odubel Herrera singled to center (Fliner (Liner)). Roman Quinn advanced to 2B.
J_Teheran,6797,J Turner,5235,2016-04-20,Justin Turner singled to second (Grounder).
J_Teheran,6797,C Yelich,1147,2016-07-01,Christian Yelich doubled to left (Liner).
J_Teheran,6797,X Bogaerts,1216,2016-04-25,Xander Bogaerts singled to right (Fliner (Liner)).
J_Teheran,6797,A Rendon,1286,2016-04-14,Anthony Rendon singled to center (Grounder). Stephen Strasburg advanced to 3B. Chris Heisey advanced to 2B.
J_Teheran,6797,J Loney,4556,2016-06-25,James Loney singled to left (Fliner (Liner)).
J_Teheran,6797,J Loney,4556,2016-09-20,James Loney singled to center (Liner). T.J. Rivera advanced to 2B.
J_Teheran,6797,J Harrison,8202,2016-05-18,Josh Harrison singled to center (Grounder).
J_Teheran,6797,J Martinez,6184,2016-10-02,J.D. Martinez singled to center (Grounder).
J_Teheran,6797,J Lamb,1332,2016-05-07,Jake Lamb doubled to left (Fliner (Fly)).
J_Teheran,6797,J Mathis,3448,2016-05-29,Jeff Mathis reached on error to shortstop (Grounder). Error by Chase d'Arnaud.
J_Teheran,6797,M Cabrera,4022,2016-07-09,Melky Cabrera singled to right (Fliner (Liner)).
J_Teheran,6797,J Segura,5933,2016-05-07,Jean Segura singled to right (Liner). Shelby Miller advanced to 2B.
J_Teheran,6797,Y Solarte,5352,2016-08-30,Yangervis Solarte tripled to right (Fliner (Fly)).
J_Teheran,6797,M Ozuna,1032,2016-05-29,Marcell Ozuna singled to center (Fliner (Liner)).
J_Teheran,6797,C Rupp,1114,2016-09-04,Cameron Rupp singled to right (Grounder).
J_Teheran,6797,J Shuck,6677,2016-07-09,J.B. Shuck balked to 3B. Tim Anderson advanced to 2B.
J_Teheran,6797,C Vazquez,9774,2016-04-25,Christian Vazquez doubled to left (Liner).
J_Teheran,6797,T Anderson,1517,2016-07-09,Tim Anderson singled to left (Fliner (Liner)). J.B. Shuck advanced to 2B.
J_Teheran,6797,M Franco,1217,2016-09-04,Maikel Franco singled to left (Liner).
J_Teheran,6797,J Mercer,6547,2016-05-18,Jordy Mercer singled to center (Grounder).
J_Teheran,6797,C Rupp,1114,2016-07-30,Cameron Rupp singled to left (Liner).
J_Teheran,6797,C Bethancourt,1002,2016-06-08,Christian Bethancourt singled to center (Fliner (Fly)).
J_Teheran,6797,J Pederson,1189,2016-04-20,Joc Pederson singled to center (Grounder). Howie Kendrick scored.
J_Teheran,6797,F Galvis,6609,2016-09-04,Freddy Galvis singled to center (Grounder).
J_Teheran,6797,M Prado,3312,2016-09-14,Martin Prado singled to second (Grounder). Dee Gordon scored.
J_Teheran,6797,P Goldschmidt,9218,2016-08-24,Paul Goldschmidt singled to right (Fliner (Fly)). Michael Bourn advanced to 3B.
J_Teheran,6797,T Turner,1625,2016-08-19,Trea Turner doubled to left (Fliner (Liner)).
J_Teheran,6797,J Bour,9744,2016-07-01,Justin Bour singled to left (Fliner (Liner)).
J_Teheran,6797,D Ruf,9929,2016-09-04,Darin Ruf singled to shortstop (Grounder). Cameron Rupp advanced to 2B.
J_Teheran,6797,J Bour,9744,2016-05-29,Justin Bour doubled to right (Liner).
J_Teheran,6797,M Bourn,6387,2016-08-24,Michael Bourn tripled to center (Fliner (Liner)).
J_Teheran,6797,M Upton Jr.,5015,2016-06-08,Melvin Upton Jr. singled to right (Liner).
J_Teheran,6797,B Drury,1161,2016-05-07,Brandon Drury doubled to left (Liner).
J_Teheran,6797,D Freese,9549,2016-05-18,David Freese singled to left (Grounder). Jordy Mercer advanced to 2B.
J_Teheran,6797,C Asche,1199,2016-07-30,Cody Asche singled to right (Grounder). Cameron Rupp advanced to 2B.
J_Teheran,6797,M Prado,3312,2016-09-14,Martin Prado was hit by a pitch. Derek Dietrich advanced to 2B.
J_Teheran,6797,W Myers,1004,2016-06-08,Wil Myers homered (Fliner (Fly)).
J_Teheran,6797,C Rupp,1114,2016-07-30,Cameron Rupp singled to center (Grounder). Ryan Howard scored.
J_Teheran,6797,B Harper,1157,2016-08-19,Bryce Harper singled to third (Fly). Trea Turner scored. Ben Revere advanced to 3B.
J_Teheran,6797,M Carpenter,8090,2016-04-09,Matt Carpenter doubled to right (Fliner (Liner)). Carlos Martinez scored.
J_Teheran,6797,A Escobar,6310,2016-05-13,Alcides Escobar singled to right (Grounder). Cheslor Cuthbert scored. Paulo Orlando advanced to 3B.
J_Teheran,6797,D Dietrich,1054,2016-07-01,Derek Dietrich homered (Fly).
J_Teheran,6797,B Harper,1157,2016-04-04,Bryce Harper homered (Fly).
J_Teheran,6797,B Revere,4712,2016-08-19,Ben Revere singled to right (Fliner (Liner)). Danny Espinosa scored. Trea Turner advanced to 2B.
J_Teheran,6797,C Seager,1362,2016-06-03,Corey Seager homered (Fliner (Fly)).
J_Teheran,6797,R Braun,3410,2016-05-24,Ryan Braun homered (Fliner (Fly)).
J_Teheran,6797,P Bourjos,2578,2016-09-04,Peter Bourjos doubled to left (Fliner (Fly)). Freddy Galvis advanced to 3B.
J_Teheran,6797,T Thompson,9952,2016-06-03,Trayce Thompson homered (Fliner (Fly)).
J_Teheran,6797,C Seager,1362,2016-06-03,Corey Seager homered (Fly).
J_Teheran,6797,J Bruce,9892,2016-06-14,Jay Bruce homered (Fliner (Fly)). Joey Votto scored. Brandon Phillips scored.
J_Teheran,6797,J Lamb,1332,2016-05-07,Jake Lamb doubled to right (Fliner (Liner)). Shelby Miller scored. Jean Segura scored on error. Jake Lamb advanced to 3B. Error by Erick Aybar.
J_Teheran,6797,D Dietrich,1054,2016-05-29,Derek Dietrich homered (Fly). Justin Bour scored.
J_Teheran,6797,M Ozuna,1032,2016-09-14,Marcell Ozuna homered (Fliner (Fly)). Derek Dietrich scored. Martin Prado scored.
