playername,playerid,vsname,vsid,date,Play
J_Teheran,6797,W Flores,5827,2016-09-09,Wilmer Flores grounded into a double play to shortstop (Grounder). Curtis Granderson out at second.
J_Teheran,6797,J Thompson,1437,2016-09-04,Jake Thompson struck out swinging.
J_Teheran,6797,A Ramirez,5133,2016-06-08,Alexei Ramirez lined out to third (Liner). Christian Bethancourt out at second.
J_Teheran,6797,A Hechavarria,1045,2016-07-01,Adeiny Hechavarria flied out to shortstop (Fliner (Fly)). J.T. Realmuto out at second.
J_Teheran,6797,F Galvis,6609,2016-09-04,Freddy Galvis flied out to center (Fly).
J_Teheran,6797,A Cabrera,4962,2016-06-25,Asdrubal Cabrera struck out swinging.
J_Teheran,6797,X Bogaerts,1216,2016-04-25,Xander Bogaerts flied out to center (Fliner (Liner)).
J_Teheran,6797,D Peralta,2136,2016-05-07,David Peralta struck out swinging.
J_Teheran,6797,J Segura,5933,2016-05-07,Jean Segura grounded out to second (Grounder).
J_Teheran,6797,B Revere,4712,2016-08-19,Ben Revere flied out to left (Fliner (Fly)). Trea Turner out at second.
J_Teheran,6797,J Mathis,3448,2016-05-29,Jeff Mathis struck out looking.
J_Teheran,6797,D Navarro,3179,2016-07-09,Dioner Navarro grounded into a double play to second (Grounder). Brett Lawrie out at second.
J_Teheran,6797,W Ramos,1433,2016-04-04,Wilson Ramos flied out to right (Fly).
J_Teheran,6797,A Ramirez,5133,2016-06-08,Alexei Ramirez flied out to left (Fliner (Fly)).
J_Teheran,6797,B Zobrist,7435,2016-05-01,Ben Zobrist struck out looking.
J_Teheran,6797,P Goldschmidt,9218,2016-08-24,Paul Goldschmidt struck out swinging.
J_Teheran,6797,B Holt,9345,2016-04-25,Brock Holt struck out swinging.
J_Teheran,6797,M Rojas,7802,2016-05-29,Miguel Rojas grounded into a double play to shortstop (Grounder). Derek Dietrich out at second.
J_Teheran,6797,T Shaw,1198,2016-04-25,Travis Shaw flied out to left (Fly).
J_Teheran,6797,T Shaw,1198,2016-04-25,Travis Shaw was caught stealing.
J_Teheran,6797,D LeMahieu,9874,2016-07-17,DJ LeMahieu grounded out to second (Grounder).
J_Teheran,6797,J deGrom,1095,2016-06-25,Jacob deGrom grounded out to pitcher (Grounder).
J_Teheran,6797,A Altherr,1127,2016-09-04,Aaron Altherr struck out swinging.
J_Teheran,6797,J McCann,1285,2016-10-02,James McCann struck out swinging.
J_Teheran,6797,C Yelich,1147,2016-09-14,Christian Yelich flied out to left (Fly). Derek Dietrich advanced to 3B.
J_Teheran,6797,T d'Arnaud,7739,2016-06-25,Travis d'Arnaud grounded out to pitcher (Grounder).
J_Teheran,6797,M Betts,1361,2016-04-25,Mookie Betts struck out swinging.
J_Teheran,6797,B Drury,1161,2016-08-24,Brandon Drury grounded into a double play to shortstop (Grounder). Mitch Haniger out at second.
J_Teheran,6797,M Franco,1217,2016-07-30,Maikel Franco struck out swinging.
J_Teheran,6797,C Yelich,1147,2016-09-14,Christian Yelich grounded into a double play to first (Grounder). Martin Prado out at second.
J_Teheran,6797,A Diaz,1593,2016-04-09,Aledmys Diaz struck out looking.
J_Teheran,6797,C Gillespie,5888,2016-07-01,Cole Gillespie struck out swinging.
J_Teheran,6797,J Mercer,6547,2016-05-18,Jordy Mercer struck out looking.
J_Teheran,6797,N Walker,7539,2016-06-25,Neil Walker flied out to left (Fly).
J_Teheran,6797,D Dietrich,1054,2016-09-14,Derek Dietrich grounded out to pitcher (Grounder).
J_Teheran,6797,J Harrison,8202,2016-05-18,Josh Harrison flied out to center (Fliner (Fly)).
J_Teheran,6797,B Wallace,8434,2016-06-08,Brett Wallace struck out looking.
J_Teheran,6797,A Rendon,1286,2016-04-04,Anthony Rendon was caught stealing.
J_Teheran,6797,C Granderson,4747,2016-09-20,Curtis Granderson flied out to third (Fly).
J_Teheran,6797,C Carter,9911,2016-05-24,Chris Carter struck out swinging.
J_Teheran,6797,N Arenado,9777,2016-07-17,Nolan Arenado grounded out to third (Grounder).
J_Teheran,6797,Y Cespedes,1311,2016-09-20,Yoenis Cespedes flied out to shortstop (Fly).
J_Teheran,6797,C Rupp,1114,2016-09-04,Cameron Rupp flied out to center (Fly).
J_Teheran,6797,J Martinez,6184,2016-10-02,J.D. Martinez struck out swinging.
J_Teheran,6797,A Cabrera,4962,2016-06-25,Asdrubal Cabrera flied out to left (Fliner (Fly)).
J_Teheran,6797,J Kang,1718,2016-05-18,Jung Ho Kang flied out to center (Fly).
J_Teheran,6797,J Upton,5222,2016-10-02,Justin Upton struck out swinging.
J_Teheran,6797,C Seager,1362,2016-04-20,Corey Seager struck out looking.
J_Teheran,6797,C Blackmon,7859,2016-07-17,Charlie Blackmon struck out swinging.
J_Teheran,6797,W Flores,5827,2016-09-09,Wilmer Flores flied out to left (Fly).
J_Teheran,6797,L Cain,9077,2016-05-13,Lorenzo Cain struck out swinging.
J_Teheran,6797,J Lucroy,7870,2016-05-24,Jonathan Lucroy struck out swinging.
J_Teheran,6797,W Flores,5827,2016-06-25,Wilmer Flores struck out swinging.
J_Teheran,6797,F Liriano,3201,2016-05-18,Francisco Liriano flied out to center (Fliner (Liner)).
J_Teheran,6797,S Strasburg,1013,2016-04-14,Stephen Strasburg reached on fielder's choice to pitcher (Bunt Grounder). Matt den Dekker out at second.
J_Teheran,6797,J deGrom,1095,2016-06-25,Jacob deGrom grounded out to first (Grounder).
J_Teheran,6797,M Cabrera,4022,2016-07-09,Melky Cabrera non-force gdp to first (Grounder). Adam Eaton out at second.
J_Teheran,6797,H Kendrick,4229,2016-04-20,Howie Kendrick struck out swinging.
J_Teheran,6797,P Goldschmidt,9218,2016-05-07,Paul Goldschmidt struck out swinging.
J_Teheran,6797,D Pedroia,8370,2016-04-25,Dustin Pedroia flied out to right (Fliner (Fly)).
J_Teheran,6797,A Cabrera,4962,2016-06-25,Asdrubal Cabrera struck out swinging.
J_Teheran,6797,K Bryant,1542,2016-05-01,Kris Bryant struck out swinging.
J_Teheran,6797,J Jaso,5887,2016-05-18,John Jaso flied out to center (Fliner (Fly)).
J_Teheran,6797,J Verlander,8700,2016-10-02,Justin Verlander struck out looking.
J_Teheran,6797,J deGrom,1095,2016-06-19,Jacob deGrom flied out to left (Fly).
J_Teheran,6797,G Stanton,4949,2016-07-01,Giancarlo Stanton struck out swinging.
J_Teheran,6797,N Castellanos,1173,2016-10-02,Nick Castellanos struck out swinging.
J_Teheran,6797,D Peralta,2136,2016-05-07,David Peralta grounded out to first (Grounder).
J_Teheran,6797,C Seager,1362,2016-04-20,Corey Seager grounded out to first (Grounder).
J_Teheran,6797,C Cuthbert,1047,2016-05-13,Cheslor Cuthbert struck out swinging.
J_Teheran,6797,D Dietrich,1054,2016-07-01,Derek Dietrich struck out swinging.
J_Teheran,6797,D Ruf,9929,2016-09-04,Darin Ruf flied out to center (Fly).
J_Teheran,6797,J Loney,4556,2016-06-19,James Loney struck out swinging.
J_Teheran,6797,J Bradley Jr.,1298,2016-04-25,Jackie Bradley Jr. flied out to center (Fly).
J_Teheran,6797,I Suzuki,1101,2016-05-29,Ichiro Suzuki flied out to left (Fliner (Fly)).
J_Teheran,6797,D Descalso,8392,2016-07-17,Daniel Descalso flied out to center (Fliner (Fly)).
J_Teheran,6797,T Roark,8753,2016-08-19,Tanner Roark struck out swinging.
J_Teheran,6797,J Turner,5235,2016-06-03,Justin Turner flied out to center (Fliner (Liner)).
J_Teheran,6797,C Martinez,1168,2016-04-09,Carlos Martinez grounded out to first (Liner).
J_Teheran,6797,J Werth,1327,2016-08-19,Jayson Werth struck out swinging.
J_Teheran,6797,J Lamb,1332,2016-08-24,Jake Lamb struck out swinging.
J_Teheran,6797,M Franco,1217,2016-07-30,Maikel Franco flied out to left (Fliner (Fly)).
J_Teheran,6797,M Cabrera,1744,2016-10-02,Miguel Cabrera flied out to center (Fly).
J_Teheran,6797,K Nieuwenhuis,6400,2016-05-24,Kirk Nieuwenhuis grounded out to second (Grounder).
J_Teheran,6797,C Gonzalez,7287,2016-07-17,Carlos Gonzalez grounded out to shortstop (Grounder).
J_Teheran,6797,W Myers,1004,2016-08-30,Wil Myers struck out swinging.
J_Teheran,6797,C Utley,1679,2016-04-20,Chase Utley grounded out to shortstop (Grounder).
J_Teheran,6797,Y Cespedes,1311,2016-06-25,Yoenis Cespedes struck out swinging.
J_Teheran,6797,X Bogaerts,1216,2016-04-25,Xander Bogaerts struck out swinging.
J_Teheran,6797,D LeMahieu,9874,2016-07-17,DJ LeMahieu struck out swinging.
J_Teheran,6797,T Story,1256,2016-07-22,Trevor Story struck out swinging.
J_Teheran,6797,T Rivera,1249,2016-09-20,T.J. Rivera flied out to center (Fliner (Fly)).
J_Teheran,6797,K Bryant,1542,2016-05-01,Kris Bryant struck out looking.
J_Teheran,6797,B Lawrie,5247,2016-07-09,Brett Lawrie grounded out to pitcher (Grounder).
J_Teheran,6797,D Fowler,4062,2016-05-01,Dexter Fowler flied out to center (Fliner (Fly)).
J_Teheran,6797,R Gsellman,1369,2016-09-09,Robert Gsellman grounded out to pitcher (Bunt Grounder).
J_Teheran,6797,J Jay,5227,2016-06-08,Jon Jay flied out to center (Fliner (Fly)).
J_Teheran,6797,D Espinosa,9219,2016-08-19,Danny Espinosa struck out swinging.
J_Teheran,6797,M Holliday,1873,2016-04-09,Matt Holliday struck out swinging.
J_Teheran,6797,A Ramirez,5133,2016-06-08,Alexei Ramirez struck out swinging.
J_Teheran,6797,R Zimmerman,4220,2016-04-04,Ryan Zimmerman reached on fielder's choice to shortstop (Grounder). Bryce Harper out at second.
J_Teheran,6797,C Crawford,1201,2016-06-03,Carl Crawford grounded out to pitcher (Grounder).
J_Teheran,6797,B Revere,4712,2016-04-04,Ben Revere grounded out to third (Grounder).
J_Teheran,6797,C Vazquez,9774,2016-04-25,Christian Vazquez struck out swinging.
J_Teheran,6797,B Barnes,629&,2016-07-17,Brandon Barnes grounded out to shortstop (Grounder).
J_Teheran,6797,C Rupp,1114,2016-09-04,Cameron Rupp flied out to center (Fly).
J_Teheran,6797,J Jay,5227,2016-06-08,Jon Jay flied out to right (Fly).
J_Teheran,6797,K Plawecki,1380,2016-06-19,Kevin Plawecki flied out to shortstop (Fly).
J_Teheran,6797,K Morales,8610,2016-05-13,Kendrys Morales flied out to right (Fly).
J_Teheran,6797,T Barnhart,1020,2016-06-14,Tucker Barnhart flied out to center (Fliner (Fly)).
J_Teheran,6797,Y Cespedes,1311,2016-06-25,Yoenis Cespedes struck out swinging.
J_Teheran,6797,T Federowicz,8609,2016-05-01,Tim Federowicz flied out to center (Fly).
J_Teheran,6797,A Russell,1410,2016-05-01,Addison Russell struck out swinging.
J_Teheran,6797,A Hill,6104,2016-05-24,Aaron Hill grounded out to shortstop (Grounder).
J_Teheran,6797,A Gonzalez,1908,2016-06-03,Adrian Gonzalez flied out to left (Fliner (Fly)).
J_Teheran,6797,W Ramos,1433,2016-04-04,Wilson Ramos grounded out to third (Grounder).
J_Teheran,6797,T Shaw,1198,2016-04-25,Travis Shaw struck out swinging.
J_Teheran,6797,J Bour,9744,2016-05-29,Justin Bour struck out swinging.
J_Teheran,6797,A Dickerson,1264,2016-08-30,Alex Dickerson grounded out to shortstop (Grounder).
J_Teheran,6797,R Zimmerman,4220,2016-04-14,Ryan Zimmerman flied out to right (Fliner (Fly)).
J_Teheran,6797,T La Stella,1237,2016-05-01,Tommy La Stella flied out to center (Fliner (Fly)).
J_Teheran,6797,M Joyce,3353,2016-05-18,Matt Joyce flied out to right (Fliner (Fly)).
J_Teheran,6797,J Werth,1327,2016-04-04,Jayson Werth flied out to center (Fly).
J_Teheran,6797,A Hechavarria,1045,2016-07-01,Adeiny Hechavarria grounded out to third (Grounder).
J_Teheran,6797,Y Grandal,1136,2016-04-20,Yasmani Grandal grounded out to second (Grounder).
J_Teheran,6797,J Bour,9744,2016-09-14,Justin Bour grounded out to second (Grounder).
J_Teheran,6797,N Walker,7539,2016-06-19,Neil Walker flied out to center (Fly).
J_Teheran,6797,A McCutchen,9847,2016-05-18,Andrew McCutchen struck out swinging.
J_Teheran,6797,T d'Arnaud,7739,2016-09-09,Travis d'Arnaud grounded out to shortstop (Grounder).
J_Teheran,6797,J Realmuto,1173,2016-07-01,J.T. Realmuto flied out to second (Fly).
J_Teheran,6797,M Ozuna,1032,2016-05-29,Marcell Ozuna grounded out to shortstop (Grounder).
J_Teheran,6797,D Pomeranz,1142,2016-06-08,Drew Pomeranz sacrificed to catcher (Bunt Grounder). Alexi Amarista advanced to 2B.
J_Teheran,6797,D Dietrich,1054,2016-09-14,Derek Dietrich struck out swinging.
J_Teheran,6797,M Carpenter,8090,2016-04-09,Matt Carpenter grounded out to first (Grounder).
J_Teheran,6797,M Betts,1361,2016-04-25,Mookie Betts grounded out to shortstop (Grounder).
J_Teheran,6797,J Villar,1007,2016-05-24,Jonathan Villar grounded out to first (Grounder).
J_Teheran,6797,Z Cozart,2616,2016-06-14,Zack Cozart flied out to right (Fliner (Fly)).
J_Teheran,6797,C Blackmon,7859,2016-07-17,Charlie Blackmon struck out swinging.
J_Teheran,6797,T Jankowski,1376,2016-08-30,Travis Jankowski struck out looking.
J_Teheran,6797,C Hernandez,1055,2016-09-27,Cesar Hernandez struck out looking.
J_Teheran,6797,J Gray,1491,2016-07-22,Jon Gray grounded out to shortstop (Grounder).
J_Teheran,6797,C Hernandez,1055,2016-09-04,Cesar Hernandez struck out swinging.
J_Teheran,6797,J Segura,5933,2016-08-24,Jean Segura grounded out to second (Grounder).
J_Teheran,6797,M Taylor,1148,2016-04-04,Michael Taylor flied out to left (Fly).
J_Teheran,6797,P Goldschmidt,9218,2016-05-07,Paul Goldschmidt struck out looking.
J_Teheran,6797,J deGrom,1095,2016-06-25,Jacob deGrom grounded out to second (Grounder).
J_Teheran,6797,C Granderson,4747,2016-06-19,Curtis Granderson flied out to second (Fly).
J_Teheran,6797,T Frazier,785&,2016-07-09,Todd Frazier struck out swinging.
J_Teheran,6797,T Roark,8753,2016-08-19,Tanner Roark flied out to right (Fliner (Fly)).
J_Teheran,6797,J Abreu,1567,2016-07-09,Jose Abreu flied out to left (Fly).
J_Teheran,6797,J Fernandez,1153,2016-09-14,Jose Fernandez struck out swinging.
J_Teheran,6797,M Ozuna,1032,2016-09-14,Marcell Ozuna struck out swinging.
J_Teheran,6797,J Nicolino,1175,2016-07-01,Justin Nicolino struck out swinging.
J_Teheran,6797,J McCann,1285,2016-10-02,James McCann struck out swinging.
J_Teheran,6797,J Gray,1491,2016-07-17,Jon Gray sacrificed to pitcher (Bunt Grounder). Tony Wolters advanced to 2B.
J_Teheran,6797,S Perez,7304,2016-05-13,Salvador Perez flied out to center (Fly).
J_Teheran,6797,W Flores,5827,2016-06-19,Wilmer Flores grounded out to shortstop (Grounder).
J_Teheran,6797,R Raburn,2218,2016-07-22,Ryan Raburn grounded out to third (Grounder).
J_Teheran,6797,O Infante,1609,2016-05-13,Omar Infante flied out to center (Fliner (Liner)).
J_Teheran,6797,A De Aza,3371,2016-06-25,Alejandro De Aza struck out swinging.
J_Teheran,6797,A Gonzalez,1908,2016-04-20,Adrian Gonzalez fouled out to third (Fly).
J_Teheran,6797,J Martinez,6184,2016-10-02,J.D. Martinez struck out swinging.
J_Teheran,6797,J Bruce,9892,2016-09-20,Jay Bruce grounded out to first (Grounder).
J_Teheran,6797,W Flores,5827,2016-06-25,Wilmer Flores flied out to center (Fliner (Fly)).
J_Teheran,6797,J Thompson,1437,2016-09-04,Jake Thompson struck out swinging.
J_Teheran,6797,Y Cespedes,1311,2016-06-19,Yoenis Cespedes grounded out to first (Grounder).
J_Teheran,6797,J Reyes,1736,2016-09-09,Jose Reyes flied out to left (Fliner (Fly)).
J_Teheran,6797,D Fowler,4062,2016-05-01,Dexter Fowler struck out swinging.
J_Teheran,6797,R Stripling,1327,2016-04-20,Ross Stripling flied out to second (Fly).
J_Teheran,6797,J Villar,1007,2016-05-24,Jonathan Villar struck out looking.
J_Teheran,6797,B Moss,4467,2016-04-09,Brandon Moss struck out swinging.
J_Teheran,6797,T Barnhart,1020,2016-06-14,Tucker Barnhart grounded out to first (Grounder).
J_Teheran,6797,B Zobrist,7435,2016-05-01,Ben Zobrist flied out to center (Fly).
J_Teheran,6797,R Flores,1116,2016-05-24,Ramon Flores grounded out to second (Grounder).
J_Teheran,6797,B Drury,1161,2016-05-07,Brandon Drury grounded out to third (Grounder).
J_Teheran,6797,J Votto,4314,2016-06-14,Joey Votto flied out to left (Fly).
J_Teheran,6797,A Russell,1410,2016-05-01,Addison Russell struck out swinging.
J_Teheran,6797,Y Puig,1422,2016-04-20,Yasiel Puig grounded out to shortstop (Grounder).
J_Teheran,6797,C Carter,9911,2016-05-24,Chris Carter struck out swinging.
J_Teheran,6797,R Schimpf,9953,2016-08-30,Ryan Schimpf grounded out to pitcher (Grounder).
J_Teheran,6797,C Carter,9911,2016-05-24,Chris Carter struck out swinging.
J_Teheran,6797,J Werth,1327,2016-08-19,Jayson Werth struck out swinging.
J_Teheran,6797,J Reyes,1736,2016-09-09,Jose Reyes flied out to third (Fly).
J_Teheran,6797,S Perez,7304,2016-05-13,Salvador Perez grounded out to shortstop (Grounder).
J_Teheran,6797,M Bourn,6387,2016-08-24,Michael Bourn struck out swinging.
J_Teheran,6797,C Owings,1003,2016-05-07,Chris Owings sacrificed to third (Bunt Grounder). Brandon Drury advanced to 3B.
J_Teheran,6797,J Loney,4556,2016-06-19,James Loney out on a dropped third strike.
J_Teheran,6797,B Lawrie,5247,2016-07-09,Brett Lawrie grounded out to shortstop (Grounder).
J_Teheran,6797,C Seager,1362,2016-06-03,Corey Seager grounded out to third (Grounder).
J_Teheran,6797,A Rendon,1286,2016-04-14,Anthony Rendon flied out to left (Fly).
J_Teheran,6797,C Seager,1362,2016-04-20,Corey Seager grounded out to shortstop (Grounder).
J_Teheran,6797,S Gennett,1033,2016-05-24,Scooter Gennett fouled out to third (Fly).
J_Teheran,6797,D LeMahieu,9874,2016-07-17,DJ LeMahieu flied out to center (Fly).
J_Teheran,6797,W Myers,1004,2016-08-30,Wil Myers grounded out to pitcher (Grounder).
J_Teheran,6797,C Hernandez,1055,2016-07-30,Cesar Hernandez grounded out to first (Grounder).
J_Teheran,6797,M Franco,1217,2016-09-04,Maikel Franco flied out to center (Fly).
J_Teheran,6797,E Suarez,1255,2016-06-14,Eugenio Suarez struck out swinging.
J_Teheran,6797,M Haniger,1427,2016-08-24,Mitch Haniger flied out to left (Fliner (Fly)).
J_Teheran,6797,W Myers,1004,2016-06-08,Wil Myers grounded out to shortstop (Grounder).
J_Teheran,6797,P Orlando,8628,2016-05-13,Paulo Orlando struck out looking.
J_Teheran,6797,R Gsellman,1369,2016-09-09,Robert Gsellman struck out looking.
J_Teheran,6797,J Bour,9744,2016-09-14,Justin Bour grounded out to second (Grounder).
J_Teheran,6797,D Peralta,2136,2016-05-07,David Peralta flied out to center (Fly).
J_Teheran,6797,C Granderson,4747,2016-06-25,Curtis Granderson flied out to center (Fly).
J_Teheran,6797,M Prado,3312,2016-09-14,Martin Prado lined out to second (Liner).
J_Teheran,6797,J Reyes,1736,2016-09-20,Jose Reyes flied out to left (Fly).
J_Teheran,6797,J Fernandez,1153,2016-09-14,Jose Fernandez grounded out to shortstop (Grounder).
J_Teheran,6797,G Polanco,1290,2016-05-18,Gregory Polanco struck out swinging.
J_Teheran,6797,Y Solarte,5352,2016-06-08,Yangervis Solarte fouled out to catcher (Fly).
J_Teheran,6797,J Turner,5235,2016-06-03,Justin Turner flied out to center (Fly).
J_Teheran,6797,T Barnhart,1020,2016-06-14,Tucker Barnhart grounded out to catcher (Grounder).
J_Teheran,6797,Y Molina,7007,2016-04-09,Yadier Molina struck out swinging.
J_Teheran,6797,Y Puig,1422,2016-04-20,Yasiel Puig flied out to right (Fliner (Fly)).
J_Teheran,6797,J Upton,5222,2016-10-02,Justin Upton grounded out to pitcher (Grounder).
J_Teheran,6797,A De Aza,3371,2016-06-25,Alejandro De Aza flied out to second (Fly).
J_Teheran,6797,W Flores,5827,2016-09-09,Wilmer Flores grounded out to shortstop (Grounder).
J_Teheran,6797,M Conforto,1637,2016-06-19,Michael Conforto flied out to center (Fly).
J_Teheran,6797,C Hernandez,1055,2016-09-04,Cesar Hernandez grounded out to pitcher (Grounder).
J_Teheran,6797,A McCutchen,9847,2016-05-18,Andrew McCutchen fouled out to first (Fly).
J_Teheran,6797,J Heyward,4940,2016-05-01,Jason Heyward grounded out to first (Grounder).
J_Teheran,6797,A Cabrera,4962,2016-09-09,Asdrubal Cabrera flied out to right (Fly).
J_Teheran,6797,S Gennett,1033,2016-05-24,Scooter Gennett struck out swinging.
J_Teheran,6797,N Walker,7539,2016-06-19,Neil Walker struck out swinging.
J_Teheran,6797,C Cuthbert,1047,2016-05-13,Cheslor Cuthbert grounded out to first (Grounder).
J_Teheran,6797,A Escobar,6310,2016-05-13,Alcides Escobar grounded out to second (Grounder).
J_Teheran,6797,D Navarro,3179,2016-07-09,Dioner Navarro flied out to left (Fly).
J_Teheran,6797,K Nieuwenhuis,6400,2016-05-24,Kirk Nieuwenhuis struck out swinging.
J_Teheran,6797,A Rendon,1286,2016-08-19,Anthony Rendon fouled out to first (Fly).
J_Teheran,6797,M Scherzer,3137,2016-04-04,Max Scherzer struck out swinging.
J_Teheran,6797,T d'Arnaud,7739,2016-09-09,Travis d'Arnaud flied out to right (Fliner (Fly)).
J_Teheran,6797,C Utley,1679,2016-06-03,Chase Utley struck out swinging.
J_Teheran,6797,J Mercer,6547,2016-05-18,Jordy Mercer flied out to left (Fly).
J_Teheran,6797,D Murphy,4316,2016-04-14,Daniel Murphy grounded out to second (Grounder).
J_Teheran,6797,B Harper,1157,2016-04-14,Bryce Harper grounded out to second (Grounder).
J_Teheran,6797,B Harper,1157,2016-08-19,Bryce Harper flied out to center (Fly).
J_Teheran,6797,T Joseph,1034,2016-09-04,Tommy Joseph flied out to right (Fliner (Liner)).
J_Teheran,6797,J Turner,5235,2016-04-20,Justin Turner struck out swinging.
J_Teheran,6797,R Braun,3410,2016-05-24,Ryan Braun flied out to center (Fly).
J_Teheran,6797,M Franco,1217,2016-07-30,Maikel Franco flied out to shortstop (Fly).
J_Teheran,6797,M Cabrera,1744,2016-10-02,Miguel Cabrera struck out looking.
J_Teheran,6797,A Cabrera,4962,2016-09-09,Asdrubal Cabrera struck out swinging.
J_Teheran,6797,J Realmuto,1173,2016-09-14,J.T. Realmuto fouled out to third (Fly).
J_Teheran,6797,T d'Arnaud,7739,2016-09-20,Travis d'Arnaud flied out to left (Fly).
J_Teheran,6797,E Suarez,1255,2016-06-14,Eugenio Suarez struck out swinging.
J_Teheran,6797,M Kemp,5631,2016-06-08,Matt Kemp grounded out to shortstop (Grounder).
J_Teheran,6797,B Phillips,791&,2016-06-14,Brandon Phillips flied out to right (Fliner (Liner)).
J_Teheran,6797,A Hechavarria,1045,2016-07-01,Adeiny Hechavarria grounded out to third (Grounder). J.T. Realmuto advanced to 2B.
J_Teheran,6797,T d'Arnaud,7739,2016-09-20,Travis d'Arnaud flied out to left (Fly).
J_Teheran,6797,A Cabrera,4962,2016-06-19,Asdrubal Cabrera flied out to shortstop (Fly).
J_Teheran,6797,C Bethancourt,1002,2016-08-30,Christian Bethancourt grounded out to third (Grounder).
J_Teheran,6797,D Gordon,8203,2016-09-14,Dee Gordon flied out to shortstop (Fly).
J_Teheran,6797,J Bruce,9892,2016-06-14,Jay Bruce flied out to left (Fliner (Fly)).
J_Teheran,6797,A Gordon,5209,2016-05-13,Alex Gordon grounded out to second (Grounder).
J_Teheran,6797,L Cain,9077,2016-05-13,Lorenzo Cain fouled out to first (Fly).
J_Teheran,6797,C Rupp,1114,2016-09-27,Cameron Rupp grounded out to pitcher (Grounder).
J_Teheran,6797,J Bour,9744,2016-07-01,Justin Bour flied out to second (Fly).
J_Teheran,6797,B Wallace,8434,2016-08-30,Brett Wallace struck out swinging.
J_Teheran,6797,A Dickerson,1264,2016-08-30,Alex Dickerson grounded out to pitcher (Grounder).
J_Teheran,6797,F Galvis,6609,2016-09-27,Freddy Galvis grounded out to shortstop (Grounder).
J_Teheran,6797,S Strasburg,1013,2016-04-14,Stephen Strasburg struck out looking.
J_Teheran,6797,D Norris,6867,2016-08-30,Derek Norris struck out swinging.
J_Teheran,6797,M den Dekker,1138,2016-04-14,Matt den Dekker struck out swinging.
J_Teheran,6797,B Harper,1157,2016-04-14,Bryce Harper flied out to center (Fly).
J_Teheran,6797,C Heisey,3978,2016-04-14,Chris Heisey struck out swinging.
J_Teheran,6797,M Franco,1217,2016-09-27,Maikel Franco grounded out to second (Grounder).
J_Teheran,6797,C Owings,1003,2016-08-24,Chris Owings flied out to center (Fly).
J_Teheran,6797,R Schimpf,9953,2016-08-30,Ryan Schimpf flied out to left (Fly).
J_Teheran,6797,J Eickhoff,1266,2016-09-27,Jerad Eickhoff flied out to center (Fliner (Liner)).
J_Teheran,6797,R Howard,2154,2016-09-27,Ryan Howard struck out swinging.
J_Teheran,6797,W Flores,5827,2016-06-19,Wilmer Flores fouled out to third (Fly).
J_Teheran,6797,D Espinosa,9219,2016-04-14,Danny Espinosa flied out to left (Fly).
J_Teheran,6797,S Strasburg,1013,2016-04-14,Stephen Strasburg struck out swinging.
J_Teheran,6797,T Kelly,7740,2016-06-19,Ty Kelly grounded out to shortstop (Grounder).
J_Teheran,6797,M Rojas,7802,2016-05-29,Miguel Rojas reached on fielder's choice to first (Grounder). Marcell Ozuna scored. Justin Bour advanced to 3B. Derek Dietrich out at second.
J_Teheran,6797,D Murphy,4316,2016-04-14,Daniel Murphy advanced on a wild pitch to 3B.
J_Teheran,6797,F Galvis,6609,2016-09-27,Freddy Galvis advanced on a stolen base to 3B.
J_Teheran,6797,M Franco,1217,2016-09-27,Maikel Franco singled to right (Fliner (Liner)).
J_Teheran,6797,A Altherr,1127,2016-09-27,Aaron Altherr was intentionally walked.
J_Teheran,6797,D Murphy,4316,2016-04-14,Daniel Murphy doubled to right (Fliner (Liner)).
J_Teheran,6797,R Howard,2154,2016-09-27,Ryan Howard singled to right (Liner). Maikel Franco advanced to 2B.
J_Teheran,6797,T Jankowski,1376,2016-08-30,Travis Jankowski advanced on a stolen base to 2B.
J_Teheran,6797,P Gosselin,1095,2016-08-24,Phil Gosselin singled to left (Fliner (Liner)).
J_Teheran,6797,P Orlando,8628,2016-05-13,Paulo Orlando was hit by a pitch.
J_Teheran,6797,J Hazelbaker,9399,2016-04-09,Jeremy Hazelbaker advanced on a stolen base to 2B.
J_Teheran,6797,B Moss,4467,2016-04-09,Brandon Moss walked.
J_Teheran,6797,W Ramos,1433,2016-08-19,Wilson Ramos walked. Bryce Harper advanced to 2B.
J_Teheran,6797,F Galvis,6609,2016-09-04,Freddy Galvis advanced on a stolen base to 2B.
J_Teheran,6797,F Galvis,6609,2016-09-27,Freddy Galvis doubled to left (Fliner (Fly)).
J_Teheran,6797,C Utley,1679,2016-04-20,Chase Utley advanced on error to 2B. Error by Julio Teheran.
J_Teheran,6797,N Ahmed,1214,2016-05-07,Nick Ahmed advanced on a wild pitch to 2B.
J_Teheran,6797,C Yelich,1147,2016-09-14,Christian Yelich walked.
J_Teheran,6797,C Yelich,1147,2016-05-29,Christian Yelich singled to center (Grounder).
J_Teheran,6797,C Blackmon,7859,2016-07-22,Charlie Blackmon advanced on a stolen base to 2B.
J_Teheran,6797,K Nieuwenhuis,6400,2016-05-24,Kirk Nieuwenhuis reached on dropped third strike (wp).
J_Teheran,6797,M Ozuna,1032,2016-07-01,Marcell Ozuna singled to left (Fliner (Liner)).
J_Teheran,6797,B Harper,1157,2016-04-04,Bryce Harper walked.
J_Teheran,6797,T Jankowski,1376,2016-08-30,Travis Jankowski singled to center (Grounder).
J_Teheran,6797,T La Stella,1237,2016-05-01,Tommy La Stella was hit by a pitch.
J_Teheran,6797,C Martinez,1168,2016-04-09,Carlos Martinez advanced on a wild pitch to 2B.
J_Teheran,6797,D Fowler,4062,2016-05-01,Anthony Rizzo advanced on double steal to 2B.
J_Teheran,6797,C Gonzalez,7287,2016-07-22,Carlos Gonzalez walked.
J_Teheran,6797,R Porcello,2717,2016-04-25,Rick Porcello reached on error to third (Grounder). Error by Adonis Garcia.
