playername,playerid,vsname,vsid,date,Play
J_Verlander,8700,N Cruz,2434,2016-08-10,Nelson Cruz grounded into a double play to shortstop (Grounder). Seth Smith out at second.
J_Verlander,8700,P Tucker,1363,2016-07-30,Preston Tucker flied out to center (Fly).
J_Verlander,8700,C Gomez,4881,2016-04-16,Carlos Gomez grounded into a double play to third (Grounder). Preston Tucker out at second.
J_Verlander,8700,M Cabrera,4022,2016-09-05,Melky Cabrera struck out swinging.
J_Verlander,8700,T Naquin,1335,2016-09-17,Tyler Naquin struck out swinging.
J_Verlander,8700,T Shaw,1198,2016-07-25,Travis Shaw struck out swinging.
J_Verlander,8700,R Odor,1228,2016-05-08,Rougned Odor struck out swinging.
J_Verlander,8700,R Martin,4616,2016-07-07,Russell Martin struck out swinging.
J_Verlander,8700,J Smoak,9054,2016-07-07,Justin Smoak struck out swinging.
J_Verlander,8700,L Martin,1184,2016-06-21,Leonys Martin struck out swinging.
J_Verlander,8700,D DeShields,1137,2016-05-08,Delino DeShields struck out swinging.
J_Verlander,8700,J Ramirez,1351,2016-06-26,Jose Ramirez flied out to right (Fliner (Liner)).
J_Verlander,8700,C Coghlan,6878,2016-04-27,Chris Coghlan struck out swinging.
J_Verlander,8700,R Martin,4616,2016-07-07,Russell Martin struck out swinging.
J_Verlander,8700,J Reddick,3892,2016-04-27,Josh Reddick flied out to center (Fly).
J_Verlander,8700,K Johnson,2234,2016-08-05,Kelly Johnson struck out swinging.
J_Verlander,8700,J Abreu,1567,2016-06-05,Jose Abreu struck out swinging.
J_Verlander,8700,C Rasmus,9893,2016-07-30,Colby Rasmus flied out to right (Fliner (Liner)).
J_Verlander,8700,N Mazara,1455,2016-05-08,Nomar Mazara flied out to right (Fliner (Fly)).
J_Verlander,8700,C Hernandez,1055,2016-05-24,Cesar Hernandez non-force gdp to first (Grounder). Ryan Howard out at second.
J_Verlander,8700,K Marte,1361,2016-08-10,Ketel Marte flied out to center (Fly).
J_Verlander,8700,S Souza Jr.,5667,2016-07-02,Steven Souza Jr. struck out swinging.
J_Verlander,8700,H Ramirez,8001,2016-07-25,Hanley Ramirez reached on fielder's choice to shortstop (Grounder). Xander Bogaerts out at second.
J_Verlander,8700,J Mauer,1857,2016-07-20,Joe Mauer grounded out to second (Grounder).
J_Verlander,8700,M Sano,1216,2016-05-18,Miguel Sano struck out swinging.
J_Verlander,8700,B Nimmo,1292,2016-08-05,Brandon Nimmo struck out swinging.
J_Verlander,8700,A Eaton,1120,2016-09-05,Adam Eaton struck out looking.
J_Verlander,8700,S Souza Jr.,5667,2016-07-02,Steven Souza Jr. grounded out to third (Grounder).
J_Verlander,8700,K Suzuki,8259,2016-07-20,Kurt Suzuki flied out to center (Fly).
J_Verlander,8700,N Aoki,1307,2016-08-10,Nori Aoki flied out to left (Fly).
J_Verlander,8700,J Schoop,1126,2016-05-13,Jonathan Schoop grounded into a double play to pitcher (Liner). Matt Wieters out at second.
J_Verlander,8700,J Rickard,1327,2016-05-13,Joey Rickard was caught stealing.
J_Verlander,8700,J Polanco,1315,2016-09-22,Jorge Polanco struck out swinging.
J_Verlander,8700,A Avila,7476,2016-09-05,Alex Avila struck out swinging.
J_Verlander,8700,M Kemp,5631,2016-10-02,Matt Kemp grounded into a double play to shortstop (Grounder). Adonis Garcia out at second.
J_Verlander,8700,M Brantley,4106,2016-05-03,Michael Brantley flied out to center (Fliner (Liner)).
J_Verlander,8700,M Napoli,3057,2016-09-17,Mike Napoli struck out swinging.
J_Verlander,8700,M Trumbo,6876,2016-05-13,Mark Trumbo grounded out to pitcher (Grounder).
J_Verlander,8700,B Eibner,1136,2016-06-16,Brett Eibner flied out to left (Fliner (Liner)).
J_Verlander,8700,S Smith,7331,2016-06-21,Seth Smith struck out looking.
J_Verlander,8700,B Guyer,2636,2016-07-02,Brandon Guyer struck out swinging.
J_Verlander,8700,J Dyson,4866,2016-07-15,Jarrod Dyson struck out swinging.
J_Verlander,8700,X Bogaerts,1216,2016-07-25,Xander Bogaerts flied out to center (Fliner (Fly)).
J_Verlander,8700,D Ortiz,745&,2016-07-25,David Ortiz flied out to right (Fly).
J_Verlander,8700,T Anderson,1517,2016-09-05,Tim Anderson grounded out to pitcher (Grounder).
J_Verlander,8700,K Morales,8610,2016-06-16,Kendrys Morales struck out swinging.
J_Verlander,8700,D Santana,1032,2016-05-18,Danny Santana struck out swinging.
J_Verlander,8700,T White,1556,2016-04-16,Tyler White flied out to right (Fliner (Fly)).
J_Verlander,8700,C Cuthbert,1047,2016-06-16,Cheslor Cuthbert struck out looking.
J_Verlander,8700,C Crisp,1572,2016-09-17,Coco Crisp flied out to right (Fliner (Fly)).
J_Verlander,8700,B Eibner,1136,2016-07-15,Brett Eibner fouled out to first (Fly).
J_Verlander,8700,K Seager,9785,2016-08-10,Kyle Seager flied out to shortstop (Fliner (Fly)).
J_Verlander,8700,C Cuthbert,1047,2016-07-15,Cheslor Cuthbert fouled out to second (Fly).
J_Verlander,8700,A Lind,8027,2016-08-10,Adam Lind fouled out to catcher (Fly).
J_Verlander,8700,N Aoki,1307,2016-06-21,Nori Aoki flied out to center (Fly).
J_Verlander,8700,R Flaherty,7888,2016-05-13,Ryan Flaherty flied out to center (Fly).
J_Verlander,8700,W Merrifield,1128,2016-06-16,Whit Merrifield grounded into a double play to pitcher (Grounder). Brett Eibner out at second.
J_Verlander,8700,P Bourjos,2578,2016-05-24,Peter Bourjos grounded out to shortstop (Grounder).
J_Verlander,8700,C Ruiz,2579,2016-05-24,Carlos Ruiz flied out to left (Fliner (Liner)).
J_Verlander,8700,A Eaton,1120,2016-08-31,Adam Eaton flied out to second (Fly).
J_Verlander,8700,J Loney,4556,2016-08-05,James Loney flied out to center (Fliner (Fly)).
J_Verlander,8700,C Davis,9272,2016-09-11,Chris Davis struck out swinging.
J_Verlander,8700,A Lind,8027,2016-08-10,Adam Lind grounded out to first (Grounder).
J_Verlander,8700,B Buxton,1416,2016-07-20,Byron Buxton struck out swinging.
J_Verlander,8700,P Orlando,8628,2016-06-16,Paulo Orlando flied out to right (Fly).
J_Verlander,8700,A Garcia,5760,2016-09-05,Avisail Garcia flied out to center (Fliner (Fly)).
J_Verlander,8700,C Cron,1254,2016-08-26,C.J. Cron flied out to center (Fly).
J_Verlander,8700,E Nunez,6848,2016-07-20,Eduardo Nunez lined out to second (Liner).
J_Verlander,8700,M Machado,1149,2016-05-13,Manny Machado struck out swinging.
J_Verlander,8700,M Machado,1149,2016-09-11,Manny Machado picked off.
J_Verlander,8700,L Forsythe,7185,2016-07-02,Logan Forsythe flied out to right (Fly).
J_Verlander,8700,C Dickerson,1076,2016-07-02,Corey Dickerson grounded out to second (Grounder).
J_Verlander,8700,J Mauer,1857,2016-05-18,Joe Mauer flied out to center (Fly).
J_Verlander,8700,W Merrifield,1128,2016-07-15,Whit Merrifield struck out swinging.
J_Verlander,8700,K Seager,9785,2016-08-10,Kyle Seager struck out swinging.
J_Verlander,8700,C Ruiz,2579,2016-05-24,Carlos Ruiz struck out swinging.
J_Verlander,8700,J Rickard,1327,2016-05-13,Joey Rickard flied out to left (Fly).
J_Verlander,8700,N Cruz,2434,2016-06-21,Nelson Cruz flied out to center (Fliner (Fly)).
J_Verlander,8700,T Frazier,785&,2016-09-05,Todd Frazier struck out swinging.
J_Verlander,8700,N Mazara,1455,2016-05-08,Nomar Mazara struck out swinging.
J_Verlander,8700,K Morales,8610,2016-06-16,Kendrys Morales flied out to left (Fly).
J_Verlander,8700,M Betts,1361,2016-07-25,Mookie Betts flied out to left (Fly).
J_Verlander,8700,K Pillar,1243,2016-07-07,Kevin Pillar grounded out to shortstop (Grounder).
J_Verlander,8700,S Leon,5273,2016-07-25,Sandy Leon struck out looking.
J_Verlander,8700,C Iannetta,8267,2016-06-21,Chris Iannetta flied out to right (Fly).
J_Verlander,8700,A Bregman,1767,2016-07-30,Alex Bregman grounded out to third (Grounder).
J_Verlander,8700,J Beresford,4626,2016-09-22,James Beresford grounded out to second (Grounder).
J_Verlander,8700,R Howard,2154,2016-05-24,Ryan Howard struck out swinging.
J_Verlander,8700,E Inciarte,4922,2016-10-02,Ender Inciarte struck out swinging.
J_Verlander,8700,J Aguilar,1134,2016-09-27,Jesus Aguilar struck out swinging.
J_Verlander,8700,E Andrus,8709,2016-05-08,Elvis Andrus flied out to second (Fly).
J_Verlander,8700,M Franco,1217,2016-05-24,Maikel Franco flied out to center (Fliner (Fly)).
J_Verlander,8700,N Walker,7539,2016-08-05,Neil Walker struck out looking.
J_Verlander,8700,M Prado,3312,2016-04-05,Martin Prado flied out to left (Fly).
J_Verlander,8700,C Pennington,3395,2016-08-26,Cliff Pennington struck out swinging.
J_Verlander,8700,C Cuthbert,1047,2016-06-16,Cheslor Cuthbert struck out swinging.
J_Verlander,8700,M Betts,1361,2016-07-25,Mookie Betts lined out to shortstop (Liner).
J_Verlander,8700,E Rosario,1215,2016-05-18,Eddie Rosario struck out swinging.
J_Verlander,8700,M Sano,1216,2016-05-18,Miguel Sano struck out looking.
J_Verlander,8700,P Alvarez,2495,2016-05-13,Pedro Alvarez flied out to left (Fly).
J_Verlander,8700,A Jones,6368,2016-05-13,Adam Jones lined out to shortstop (Liner).
J_Verlander,8700,T Frazier,785&,2016-06-05,Todd Frazier lined out to first (Liner).
J_Verlander,8700,J Altuve,5417,2016-07-30,Jose Altuve grounded out to pitcher (Bunt Grounder).
J_Verlander,8700,D Gregorius,6012,2016-06-11,Didi Gregorius grounded out to first (Grounder).
J_Verlander,8700,A Rodriguez,1274,2016-06-11,Alex Rodriguez struck out swinging.
J_Verlander,8700,B Gardner,9927,2016-06-11,Brett Gardner struck out swinging.
J_Verlander,8700,C Dickerson,1076,2016-07-02,Corey Dickerson grounded out to third (Grounder).
J_Verlander,8700,A Beltre,639&,2016-05-08,Adrian Beltre grounded out to second (Grounder).
J_Verlander,8700,L Martin,1184,2016-06-21,Leonys Martin flied out to right (Fly).
J_Verlander,8700,T Goeddel,1318,2016-05-24,Tyler Goeddel flied out to center (Fly).
J_Verlander,8700,M Reynolds,1378,2016-08-05,Matt Reynolds struck out looking.
J_Verlander,8700,K Calhoun,1120,2016-05-30,Kole Calhoun flied out to center (Fly).
J_Verlander,8700,A McCutchen,9847,2016-04-11,Andrew McCutchen flied out to third (Fly).
J_Verlander,8700,D Gregorius,6012,2016-06-11,Didi Gregorius struck out swinging.
J_Verlander,8700,M Moreland,3086,2016-05-08,Mitch Moreland flied out to third (Fly).
J_Verlander,8700,A Garcia,1377,2016-10-02,Adonis Garcia flied out to center (Fly).
J_Verlander,8700,R Flaherty,7888,2016-05-13,Ryan Flaherty grounded out to first (Grounder).
J_Verlander,8700,J Marisnick,1133,2016-07-30,Jake Marisnick grounded out to shortstop (Grounder).
J_Verlander,8700,T Shaw,1198,2016-08-21,Travis Shaw flied out to center (Fly).
J_Verlander,8700,J Hardy,3797,2016-09-11,J.J. Hardy flied out to center (Fliner (Fly)).
J_Verlander,8700,A Rodriguez,1274,2016-06-11,Alex Rodriguez grounded out to third (Grounder).
J_Verlander,8700,M Napoli,3057,2016-04-22,Mike Napoli struck out swinging.
J_Verlander,8700,C Iannetta,8267,2016-06-21,Chris Iannetta struck out swinging.
J_Verlander,8700,L Cain,9077,2016-08-16,Lorenzo Cain struck out looking.
J_Verlander,8700,S Souza Jr.,5667,2016-07-02,Steven Souza Jr. picked off.
J_Verlander,8700,R Mondesi,1376,2016-08-16,Raul Mondesi struck out swinging.
J_Verlander,8700,A Eaton,1120,2016-08-31,Adam Eaton flied out to center (Fly).
J_Verlander,8700,L Morrison,9205,2016-07-02,Logan Morrison struck out swinging.
J_Verlander,8700,J Mauer,1857,2016-07-20,Joe Mauer grounded out to second (Grounder).
J_Verlander,8700,S Perez,7304,2016-06-16,Salvador Perez flied out to center (Fly).
J_Verlander,8700,S Perez,7304,2016-07-15,Salvador Perez flied out to left (Fly).
J_Verlander,8700,J Ellsbury,4727,2016-06-11,Jacoby Ellsbury grounded out to pitcher (Grounder).
J_Verlander,8700,T Saladino,1080,2016-09-05,Tyler Saladino flied out to second (Fly).
J_Verlander,8700,J Uribe,454&,2016-04-22,Juan Uribe struck out swinging.
J_Verlander,8700,J Bandy,1250,2016-08-26,Jett Bandy grounded out to shortstop (Grounder).
J_Verlander,8700,D Ortiz,745&,2016-07-25,David Ortiz struck out swinging.
J_Verlander,8700,Y Gomes,9627,2016-06-26,Yan Gomes struck out swinging.
J_Verlander,8700,A Garcia,5760,2016-06-05,Avisail Garcia flied out to left (Fliner (Fly)).
J_Verlander,8700,N Buss,6835,2016-08-26,Nick Buss flied out to second (Fly).
J_Verlander,8700,M Wieters,4298,2016-05-13,Matt Wieters grounded out to second (Grounder).
J_Verlander,8700,P Fielder,4613,2016-05-08,Prince Fielder struck out swinging.
J_Verlander,8700,M Napoli,3057,2016-06-26,Mike Napoli flied out to left (Fliner (Liner)).
J_Verlander,8700,A Bregman,1767,2016-07-30,Alex Bregman flied out to right (Fly).
J_Verlander,8700,H Ramirez,8001,2016-08-21,Hanley Ramirez flied out to second (Fly).
J_Verlander,8700,M Trumbo,6876,2016-09-11,Mark Trumbo grounded out to shortstop (Grounder).
J_Verlander,8700,A Eaton,1120,2016-09-05,Adam Eaton struck out swinging.
J_Verlander,8700,L Cain,9077,2016-06-16,Lorenzo Cain reached on fielder's choice to shortstop (Grounder). Eric Hosmer out at second.
J_Verlander,8700,C Santana,2396,2016-09-27,Carlos Santana flied out to right (Fly).
J_Verlander,8700,D Gordon,8203,2016-04-05,Dee Gordon flied out to left (Fliner (Fly)).
J_Verlander,8700,R Cano,3269,2016-08-10,Robinson Cano flied out to right (Fly). Nori Aoki advanced to 3B.
J_Verlander,8700,M Napoli,3057,2016-04-22,Mike Napoli struck out swinging.
J_Verlander,8700,A Pujols,1177,2016-08-26,Albert Pujols struck out swinging.
J_Verlander,8700,M Moreland,3086,2016-05-08,Mitch Moreland struck out looking.
J_Verlander,8700,L Valbuena,4969,2016-04-16,Luis Valbuena struck out swinging.
J_Verlander,8700,S Leon,5273,2016-07-25,Sandy Leon lined out to shortstop (Liner).
J_Verlander,8700,C Yelich,1147,2016-04-05,Christian Yelich struck out swinging.
J_Verlander,8700,M Betts,1361,2016-07-25,Mookie Betts grounded out to third (Grounder).
J_Verlander,8700,C Hernandez,1055,2016-05-24,Cesar Hernandez struck out swinging.
J_Verlander,8700,E Inciarte,4922,2016-10-02,Ender Inciarte struck out swinging.
J_Verlander,8700,B Park,1849,2016-05-18,Byung-ho Park fouled out to first (Fly).
J_Verlander,8700,J Rickard,1327,2016-05-13,Joey Rickard grounded out to third (Grounder).
J_Verlander,8700,B Dozier,9810,2016-09-22,Brian Dozier struck out swinging.
J_Verlander,8700,C Crisp,1572,2016-04-27,Coco Crisp grounded out to first (Grounder).
J_Verlander,8700,O Herrera,1147,2016-05-24,Odubel Herrera struck out swinging.
J_Verlander,8700,L Martin,1184,2016-06-21,Leonys Martin flied out to left (Fly).
J_Verlander,8700,W Merrifield,1128,2016-07-15,Whit Merrifield struck out swinging.
J_Verlander,8700,G Springer,1285,2016-07-30,George Springer struck out swinging.
J_Verlander,8700,P Orlando,8628,2016-08-16,Paulo Orlando struck out looking.
J_Verlander,8700,K Calhoun,1120,2016-08-26,Kole Calhoun grounded out to pitcher (Liner).
J_Verlander,8700,A Jones,6368,2016-09-11,Adam Jones grounded out to shortstop (Grounder).
J_Verlander,8700,C Santana,2396,2016-05-03,Carlos Santana flied out to left (Fly).
J_Verlander,8700,W Merrifield,1128,2016-06-16,Whit Merrifield struck out looking.
J_Verlander,8700,T Naquin,1335,2016-04-22,Tyler Naquin struck out swinging.
J_Verlander,8700,C Rasmus,9893,2016-04-16,Colby Rasmus struck out swinging.
J_Verlander,8700,R Perez,2900,2016-09-17,Roberto Perez flied out to center (Fly).
J_Verlander,8700,T White,1556,2016-07-30,Tyler White flied out to right (Fly).
J_Verlander,8700,D Barney,2430,2016-07-07,Darwin Barney grounded out to third (Grounder).
J_Verlander,8700,J Bour,9744,2016-04-05,Justin Bour flied out to right (Fly).
J_Verlander,8700,J Morneau,1737,2016-09-05,Justin Morneau flied out to right (Fliner (Fly)).
J_Verlander,8700,J Peterson,1232,2016-10-02,Jace Peterson struck out swinging.
J_Verlander,8700,A Almonte,5486,2016-09-17,Abraham Almonte flied out to second (Fly).
J_Verlander,8700,M Byrd,950&,2016-04-22,Marlon Byrd grounded out to third (Grounder).
J_Verlander,8700,N Buss,6835,2016-08-26,Nick Buss flied out to center (Fliner (Fly)).
J_Verlander,8700,E Nunez,6848,2016-07-20,Eduardo Nunez grounded out to third (Grounder). Kurt Suzuki advanced to 2B.
J_Verlander,8700,J Altuve,5417,2016-04-16,Jose Altuve grounded out to third (Grounder).
J_Verlander,8700,T Saladino,1080,2016-06-05,Tyler Saladino struck out swinging.
J_Verlander,8700,Y Gomes,9627,2016-04-22,Yan Gomes struck out swinging.
J_Verlander,8700,D Swanson,1831,2016-10-02,Dansby Swanson grounded out to pitcher (Grounder).
J_Verlander,8700,T Joseph,1034,2016-05-24,Tommy Joseph flied out to left (Fliner (Liner)).
J_Verlander,8700,J Kipnis,9776,2016-04-22,Jason Kipnis flied out to third (Fly).
J_Verlander,8700,N Aoki,1307,2016-08-10,Nori Aoki fouled out to first (Fly).
J_Verlander,8700,C Crisp,1572,2016-09-17,Coco Crisp grounded out to second (Grounder).
J_Verlander,8700,B Wilson,6564,2016-05-08,Bobby Wilson struck out swinging.
J_Verlander,8700,C Cron,1254,2016-05-30,C.J. Cron flied out to center (Fly).
J_Verlander,8700,B Dozier,9810,2016-07-20,Brian Dozier struck out swinging.
J_Verlander,8700,J Morneau,1737,2016-08-31,Justin Morneau lined out to first (Liner).
J_Verlander,8700,J Beresford,4626,2016-09-22,James Beresford struck out looking.
J_Verlander,8700,J Peterson,1232,2016-10-02,Jace Peterson flied out to center (Fliner (Fly)).
J_Verlander,8700,O Arcia,1030,2016-07-02,Oswaldo Arcia flied out to right (Fliner (Fly)).
J_Verlander,8700,L Martin,1184,2016-08-10,Leonys Martin struck out swinging.
J_Verlander,8700,M Trout,1015,2016-05-30,Mike Trout flied out to second (Fly).
J_Verlander,8700,P Bourjos,2578,2016-05-24,Peter Bourjos flied out to center (Fliner (Fly)).
J_Verlander,8700,J Uribe,454&,2016-04-22,Juan Uribe struck out swinging.
J_Verlander,8700,J Dyson,4866,2016-07-15,Jarrod Dyson flied out to left (Fliner (Fly)).
J_Verlander,8700,E Encarnacion,2151,2016-07-07,Edwin Encarnacion grounded out to third (Grounder). Josh Donaldson advanced to 2B.
J_Verlander,8700,M Napoli,3057,2016-04-22,Mike Napoli struck out looking.
J_Verlander,8700,M Trout,1015,2016-08-26,Mike Trout flied out to center (Fly).
J_Verlander,8700,O Herrera,1147,2016-05-24,Odubel Herrera struck out swinging.
J_Verlander,8700,T Naquin,1335,2016-06-26,Tyler Naquin struck out swinging.
J_Verlander,8700,A Escobar,6310,2016-08-16,Alcides Escobar flied out to center (Fly).
J_Verlander,8700,J Shuck,6677,2016-08-31,J.B. Shuck struck out swinging.
J_Verlander,8700,A Garcia,5760,2016-08-31,Avisail Garcia flied out to center (Fly).
J_Verlander,8700,B McCann,4810,2016-06-11,Brian McCann grounded out to pitcher (Grounder).
J_Verlander,8700,K Cowart,1149,2016-08-26,Kaleb Cowart struck out looking.
J_Verlander,8700,F Galvis,6609,2016-05-24,Freddy Galvis struck out swinging.
J_Verlander,8700,R Grossman,5254,2016-09-22,Robbie Grossman grounded out to pitcher (Liner).
J_Verlander,8700,K Suzuki,8259,2016-05-18,Kurt Suzuki flied out to second (Fliner (Fly)).
J_Verlander,8700,L Cain,9077,2016-06-16,Lorenzo Cain was caught stealing.
J_Verlander,8700,P Tucker,1363,2016-07-30,Preston Tucker grounded out to first (Grounder).
J_Verlander,8700,C Perez,1064,2016-05-30,Carlos Perez struck out swinging.
J_Verlander,8700,E Hosmer,3516,2016-06-16,Eric Hosmer out on a dropped third strike.
J_Verlander,8700,C Coghlan,6878,2016-04-27,Chris Coghlan struck out swinging.
J_Verlander,8700,J Coats,1428,2016-06-05,Jason Coats flied out to center (Fly).
J_Verlander,8700,L Cain,9077,2016-08-16,Lorenzo Cain lined out to second (Fliner (Liner)).
J_Verlander,8700,J Lowrie,4418,2016-04-27,Jed Lowrie struck out swinging.
J_Verlander,8700,A Lind,8027,2016-06-21,Adam Lind struck out swinging.
J_Verlander,8700,K Vargas,1210,2016-07-20,Kennys Vargas struck out swinging.
J_Verlander,8700,K Morales,8610,2016-08-16,Kendrys Morales struck out swinging.
J_Verlander,8700,A Avila,7476,2016-08-31,Alex Avila struck out looking.
J_Verlander,8700,M Zunino,1326,2016-08-10,Mike Zunino struck out swinging.
J_Verlander,8700,T Anderson,1517,2016-09-05,Tim Anderson flied out to center (Fly).
J_Verlander,8700,J Bradley Jr.,1298,2016-07-25,Jackie Bradley Jr. grounded out to shortstop (Grounder).
J_Verlander,8700,A McCutchen,9847,2016-04-11,Andrew McCutchen flied out to center (Fly).
J_Verlander,8700,D Pedroia,8370,2016-07-25,Dustin Pedroia grounded out to third (Grounder).
J_Verlander,8700,A Escobar,6310,2016-06-16,Alcides Escobar fouled out to first (Fly).
J_Verlander,8700,M Ozuna,1032,2016-04-05,Marcell Ozuna struck out swinging.
J_Verlander,8700,C Casali,1251,2016-07-02,Curt Casali struck out swinging.
J_Verlander,8700,M Machado,1149,2016-05-13,Manny Machado flied out to second (Fly).
J_Verlander,8700,L Schafer,7937,2016-09-22,Logan Schafer flied out to right (Fly).
J_Verlander,8700,B Dozier,9810,2016-05-18,Brian Dozier flied out to second (Fly).
J_Verlander,8700,C Coghlan,6878,2016-04-27,Chris Coghlan flied out to right (Fliner (Fly)).
J_Verlander,8700,J Coats,1428,2016-06-05,Jason Coats struck out swinging.
J_Verlander,8700,M Martinez,7358,2016-06-26,Michael Martinez fouled out to third (Fly).
J_Verlander,8700,P Tucker,1363,2016-07-30,Preston Tucker struck out swinging.
J_Verlander,8700,C Cuthbert,1047,2016-08-16,Cheslor Cuthbert grounded out to third (Grounder).
J_Verlander,8700,M Trout,1015,2016-08-26,Mike Trout flied out to right (Fly).
J_Verlander,8700,M Bourn,6387,2016-09-11,Michael Bourn struck out swinging.
J_Verlander,8700,D Swanson,1831,2016-10-02,Dansby Swanson struck out swinging.
J_Verlander,8700,L Schafer,7937,2016-09-22,Logan Schafer fouled out to third (Fly).
J_Verlander,8700,C Santana,2396,2016-09-17,Carlos Santana struck out looking.
J_Verlander,8700,N Markakis,5930,2016-10-02,Nick Markakis flied out to center (Fly).
J_Verlander,8700,T Goeddel,1318,2016-05-24,Tyler Goeddel grounded out to third (Grounder).
J_Verlander,8700,A Garcia,5760,2016-06-05,Avisail Garcia struck out swinging.
J_Verlander,8700,M Martinez,7358,2016-09-27,Michael Martinez struck out looking.
J_Verlander,8700,B Butler,7399,2016-04-27,Billy Butler grounded out to third (Grounder).
J_Verlander,8700,A McCutchen,9847,2016-04-11,Andrew McCutchen flied out to center (Fly). John Jaso advanced to 3B.
J_Verlander,8700,J Castro,8722,2016-07-30,Jason Castro lined out to first (Liner).
J_Verlander,8700,P Tucker,1363,2016-04-16,Preston Tucker grounded out to pitcher (Grounder).
J_Verlander,8700,K Pillar,1243,2016-07-07,Kevin Pillar fouled out to catcher (Fly).
J_Verlander,8700,R Flaherty,7888,2016-05-13,Ryan Flaherty struck out looking.
J_Verlander,8700,G Polanco,1290,2016-04-11,Gregory Polanco was caught stealing.
J_Verlander,8700,N Buss,6835,2016-08-26,Nick Buss grounded out to first (Grounder).
J_Verlander,8700,T Naquin,1335,2016-09-17,Tyler Naquin struck out swinging.
J_Verlander,8700,L Martin,1184,2016-08-10,Leonys Martin lined out to shortstop (Fliner (Liner)).
J_Verlander,8700,A Garcia,5760,2016-06-05,Avisail Garcia struck out swinging.
J_Verlander,8700,C Gimenez,7324,2016-09-27,Chris Gimenez flied out to center (Fly).
J_Verlander,8700,W Merrifield,1128,2016-07-15,Whit Merrifield grounded out to shortstop (Grounder).
J_Verlander,8700,B Dozier,9810,2016-09-22,Brian Dozier struck out swinging.
J_Verlander,8700,J Shuck,6677,2016-08-31,J.B. Shuck flied out to left (Fly).
J_Verlander,8700,A Pujols,1177,2016-05-30,Albert Pujols struck out swinging.
J_Verlander,8700,M Martinez,7358,2016-09-27,Michael Martinez grounded out to first (Grounder).
J_Verlander,8700,C Cuthbert,1047,2016-08-16,Cheslor Cuthbert flied out to right (Fly).
J_Verlander,8700,J Morneau,1737,2016-08-31,Justin Morneau struck out swinging.
J_Verlander,8700,M Machado,1149,2016-05-13,Manny Machado struck out swinging.
J_Verlander,8700,C Granderson,4747,2016-08-05,Curtis Granderson flied out to first (Fly).
J_Verlander,8700,W Chen,1307,2016-04-05,Wei-Yin Chen struck out swinging.
J_Verlander,8700,C Pennington,3395,2016-08-26,Cliff Pennington flied out to left (Fliner (Fly)).
J_Verlander,8700,A De Aza,3371,2016-08-05,Alejandro De Aza struck out swinging.
J_Verlander,8700,P Tucker,1363,2016-07-30,Preston Tucker struck out looking.
J_Verlander,8700,E Hosmer,3516,2016-06-16,Eric Hosmer struck out swinging.
J_Verlander,8700,T Naquin,1335,2016-09-27,Tyler Naquin struck out swinging.
J_Verlander,8700,K Morales,8610,2016-08-16,Kendrys Morales flied out to shortstop (Fly).
J_Verlander,8700,M Trumbo,6876,2016-05-13,Mark Trumbo struck out swinging.
J_Verlander,8700,T Shaw,1198,2016-07-25,Travis Shaw struck out swinging.
J_Verlander,8700,E Hosmer,3516,2016-08-16,Eric Hosmer grounded out to shortstop (Grounder).
J_Verlander,8700,E Rosario,1215,2016-05-18,Eddie Rosario struck out swinging.
J_Verlander,8700,M Moreland,3086,2016-05-08,Mitch Moreland grounded out to second (Liner).
J_Verlander,8700,E Rosario,1215,2016-07-20,Eddie Rosario lined out to first (Liner).
J_Verlander,8700,S Perez,7304,2016-08-16,Salvador Perez grounded out to third (Grounder).
J_Verlander,8700,T Frazier,785&,2016-08-31,Todd Frazier struck out swinging.
J_Verlander,8700,A Almonte,5486,2016-09-27,Abraham Almonte struck out swinging.
J_Verlander,8700,D Santana,1032,2016-05-18,Danny Santana struck out swinging.
J_Verlander,8700,E Encarnacion,2151,2016-07-07,Edwin Encarnacion flied out to center (Fly). Josh Donaldson advanced to 3B.
J_Verlander,8700,X Bogaerts,1216,2016-07-25,Xander Bogaerts grounded out to second (Grounder).
J_Verlander,8700,L Valbuena,4969,2016-04-16,Luis Valbuena struck out swinging.
J_Verlander,8700,P Orlando,8628,2016-08-16,Paulo Orlando struck out swinging.
J_Verlander,8700,Y Alonso,2530,2016-04-27,Yonder Alonso flied out to third (Fliner (Fly)).
J_Verlander,8700,R Ortega,1032,2016-05-30,Rafael Ortega struck out swinging.
J_Verlander,8700,F Lindor,1291,2016-09-17,Francisco Lindor flied out to center (Fly).
J_Verlander,8700,A Rodriguez,1274,2016-06-11,Alex Rodriguez flied out to second (Fly).
J_Verlander,8700,M Sano,1216,2016-05-18,Miguel Sano flied out to center (Fly).
J_Verlander,8700,J Reddick,3892,2016-04-27,Josh Reddick flied out to shortstop (Fly).
J_Verlander,8700,F Lindor,1291,2016-06-26,Francisco Lindor flied out to left (Fliner (Liner)).
J_Verlander,8700,N Walker,7539,2016-08-05,Neil Walker grounded out to pitcher (Grounder).
J_Verlander,8700,J Morneau,1737,2016-08-31,Justin Morneau struck out swinging.
J_Verlander,8700,J Uribe,454&,2016-04-22,Juan Uribe flied out to second (Fly).
J_Verlander,8700,K Cowart,1149,2016-08-26,Kaleb Cowart flied out to shortstop (Fly).
