playername,playerid,vsname,vsid,date,Play
J_Wilson,4301,M Saunders,9981,2016-07-07,Michael Saunders reached on fielder's choice to first (Grounder). Ezequiel Carrera out at home. Josh Donaldson advanced to 2B.
J_Wilson,4301,T d'Arnaud,7739,2016-08-06,Travis d'Arnaud grounded into a double play to second (Grounder). Jay Bruce advanced to 3B. Wilmer Flores out at second.
J_Wilson,4301,L Cain,9077,2016-04-20,Lorenzo Cain grounded into a double play to shortstop (Grounder). Mike Moustakas out at second.
J_Wilson,4301,B Holt,9345,2016-07-25,Brock Holt struck out looking.
J_Wilson,4301,B Guyer,2636,2016-09-17,Brandon Guyer grounded out to third (Grounder).
J_Wilson,4301,B Brentz,1060,2016-07-25,Bryce Brentz struck out swinging.
J_Wilson,4301,J Dyson,4866,2016-06-19,Jarrod Dyson was caught stealing.
J_Wilson,4301,E Rosario,1215,2016-05-01,Eddie Rosario grounded out to third (Grounder).
J_Wilson,4301,D Barney,2430,2016-07-07,Darwin Barney grounded out to second (Grounder).
J_Wilson,4301,W Merrifield,1128,2016-06-19,Whit Merrifield fouled out to first (Bunt Fly).
J_Wilson,4301,R Howard,2154,2016-05-23,Ryan Howard struck out swinging.
J_Wilson,4301,K Johnson,2234,2016-08-06,Kelly Johnson grounded out to second (Grounder).
J_Wilson,4301,J Shuck,6677,2016-07-23,J.B. Shuck grounded out to second (Grounder). Avisail Garcia advanced to 3B.
J_Wilson,4301,S Pearce,9957,2016-05-21,Steve Pearce flied out to right (Fliner (Fly)).
J_Wilson,4301,J Donaldson,5038,2016-07-09,Josh Donaldson flied out to first (Fly).
J_Wilson,4301,B Butler,7399,2016-05-27,Billy Butler struck out swinging.
J_Wilson,4301,B Dozier,9810,2016-04-29,Brian Dozier struck out swinging.
J_Wilson,4301,J Smoak,9054,2016-06-07,Justin Smoak grounded out to third (Grounder).
J_Wilson,4301,A Avila,7476,2016-09-05,Alex Avila struck out swinging.
J_Wilson,4301,C Iannetta,8267,2016-06-20,Chris Iannetta grounded out to third (Grounder).
J_Wilson,4301,J Mauer,1857,2016-04-29,Joe Mauer struck out swinging.
J_Wilson,4301,D Gregorius,6012,2016-06-12,Didi Gregorius flied out to center (Fliner (Fly)).
J_Wilson,4301,A Escobar,6310,2016-08-17,Alcides Escobar fouled out to catcher (Fly).
J_Wilson,4301,A Garcia,5760,2016-09-05,Avisail Garcia grounded out to third (Grounder).
J_Wilson,4301,B Burns,1270,2016-05-29,Billy Burns struck out swinging.
J_Wilson,4301,R Cano,3269,2016-08-10,Robinson Cano flied out to right (Fly).
J_Wilson,4301,M Kepler,1214,2016-07-18,Max Kepler grounded out to shortstop (Grounder).
J_Wilson,4301,D Navarro,3179,2016-07-22,Dioner Navarro struck out swinging.
J_Wilson,4301,M Napoli,3057,2016-04-22,Mike Napoli struck out swinging.
J_Wilson,4301,K Suzuki,8259,2016-09-22,Kurt Suzuki struck out swinging.
J_Wilson,4301,B Dozier,9810,2016-09-22,Brian Dozier flied out to center (Fly).
J_Wilson,4301,F Gutierrez,3255,2016-06-20,Franklin Gutierrez struck out swinging.
J_Wilson,4301,C Johnson,1191,2016-04-05,Chris Johnson grounded out to second (Grounder).
J_Wilson,4301,E Hosmer,3516,2016-07-15,Eric Hosmer grounded out to shortstop (Grounder).
J_Wilson,4301,A Escobar,6310,2016-06-19,Alcides Escobar flied out to right (Fly).
J_Wilson,4301,T Saladino,1080,2016-09-05,Tyler Saladino grounded out to third (Grounder).
J_Wilson,4301,D Butera,3411,2016-08-17,Drew Butera grounded out to third (Grounder).
J_Wilson,4301,D Travis,1386,2016-06-07,Devon Travis grounded out to third (Grounder).
J_Wilson,4301,R Grossman,5254,2016-07-18,Robbie Grossman flied out to right (Fly).
J_Wilson,4301,B Miller,1277,2016-07-02,Brad Miller struck out swinging.
J_Wilson,4301,J Shuck,6677,2016-07-22,J.B. Shuck grounded out to second (Grounder).
J_Wilson,4301,E Escobar,6153,2016-08-25,Eduardo Escobar flied out to center (Fly).
J_Wilson,4301,B Gardner,9927,2016-06-12,Brett Gardner struck out swinging.
J_Wilson,4301,A Hechavarria,1045,2016-04-06,Adeiny Hechavarria lined out to second (Liner).
J_Wilson,4301,T Saladino,1080,2016-08-29,Tyler Saladino flied out to right (Fliner (Fly)).
J_Wilson,4301,M Zunino,1326,2016-08-09,Mike Zunino struck out swinging.
J_Wilson,4301,C Granderson,4747,2016-08-05,Curtis Granderson struck out looking.
J_Wilson,4301,D Murphy,4316,2016-05-10,Daniel Murphy struck out swinging.
J_Wilson,4301,M Ozuna,1032,2016-04-06,Marcell Ozuna grounded out to second (Grounder).
J_Wilson,4301,J Morneau,1737,2016-08-29,Justin Morneau flied out to left (Fliner (Fly)).
J_Wilson,4301,R Odor,1228,2016-05-07,Rougned Odor flied out to left (Fly).
J_Wilson,4301,J Realmuto,1173,2016-06-28,J.T. Realmuto grounded out to third (Grounder).
J_Wilson,4301,R Flaherty,7888,2016-05-12,Ryan Flaherty grounded out to shortstop (Grounder).
J_Wilson,4301,E Hosmer,3516,2016-04-20,Eric Hosmer struck out swinging.
J_Wilson,4301,A Garcia,5760,2016-08-29,Avisail Garcia grounded out to shortstop (Grounder).
J_Wilson,4301,M Napoli,3057,2016-09-26,Mike Napoli flied out to second (Fly).
J_Wilson,4301,J Harrison,8202,2016-04-13,Josh Harrison struck out swinging.
J_Wilson,4301,A Lind,8027,2016-08-10,Adam Lind flied out to right (Fliner (Fly)).
J_Wilson,4301,T Anderson,1517,2016-08-30,Tim Anderson grounded into a double play to second (Grounder). Adam Eaton out at second.
J_Wilson,4301,C Cuthbert,1047,2016-09-24,Cheslor Cuthbert grounded out to shortstop (Grounder).
J_Wilson,4301,S Perez,7304,2016-07-15,Salvador Perez flied out to second (Fly).
J_Wilson,4301,D Gregorius,6012,2016-04-08,Didi Gregorius flied out to shortstop (Fly).
J_Wilson,4301,T Frazier,785&,2016-06-03,Todd Frazier struck out swinging.
J_Wilson,4301,M Trumbo,6876,2016-09-11,Mark Trumbo flied out to right (Fly).
J_Wilson,4301,A Benintendi,1790,2016-08-20,Andrew Benintendi struck out looking.
J_Wilson,4301,J Kipnis,9776,2016-09-26,Jason Kipnis struck out swinging.
J_Wilson,4301,D DeShields,1137,2016-05-06,Delino DeShields reached on fielder's choice to first (Bunt Grounder). Elvis Andrus out at home. Bobby Wilson advanced to 3B. Delino DeShields advanced to 2B.
J_Wilson,4301,B Holaday,1128,2016-08-20,Bryan Holaday flied out to shortstop (Fly).
J_Wilson,4301,S Vogt,5000,2016-05-29,Stephen Vogt struck out swinging.
J_Wilson,4301,J Mercer,6547,2016-04-13,Jordy Mercer grounded out to second (Grounder).
J_Wilson,4301,J Abreu,1567,2016-06-03,Jose Abreu struck out swinging.
J_Wilson,4301,J Reddick,3892,2016-04-27,Josh Reddick flied out to right (Fliner (Fly)).
J_Wilson,4301,D Stubbs,9328,2016-09-11,Drew Stubbs flied out to right (Fly).
J_Wilson,4301,H Ramirez,8001,2016-08-21,Hanley Ramirez struck out swinging.
J_Wilson,4301,J Ellsbury,4727,2016-06-11,Jacoby Ellsbury fouled out to catcher (Fly).
J_Wilson,4301,E Rosario,1215,2016-05-17,Eddie Rosario struck out swinging.
J_Wilson,4301,D Ortiz,745&,2016-08-21,David Ortiz grounded out to third (Grounder).
J_Wilson,4301,J Shuck,6677,2016-06-03,J.B. Shuck grounded out to shortstop (Grounder).
J_Wilson,4301,D Swanson,1831,2016-10-01,Dansby Swanson struck out swinging.
J_Wilson,4301,P Fielder,4613,2016-05-07,Prince Fielder grounded out to second (Grounder).
J_Wilson,4301,F Lindor,1291,2016-06-26,Francisco Lindor struck out swinging.
J_Wilson,4301,B Gardner,9927,2016-06-11,Brett Gardner lined out to third (Liner).
J_Wilson,4301,J Centeno,7168,2016-05-17,Juan Centeno struck out looking.
J_Wilson,4301,N Mazara,1455,2016-05-06,Nomar Mazara grounded out to second (Grounder).
J_Wilson,4301,D Navarro,3179,2016-08-02,Dioner Navarro flied out to center (Fly).
J_Wilson,4301,M Betts,1361,2016-08-21,Mookie Betts advanced on defensive indifference to 2B.
J_Wilson,4301,T Frazier,785&,2016-08-02,Todd Frazier homered (Fliner (Fly)).
J_Wilson,4301,M Kepler,1214,2016-09-15,Max Kepler singled to second (Grounder).
J_Wilson,4301,M Kepler,1214,2016-09-15,Max Kepler advanced on a wild pitch to 2B.
J_Wilson,4301,S Leon,5273,2016-08-18,Sandy Leon walked.
J_Wilson,4301,A Eaton,1120,2016-08-30,Adam Eaton singled to left (Grounder).
J_Wilson,4301,M Zunino,1326,2016-08-10,Mike Zunino walked. Kyle Seager advanced to 2B.
J_Wilson,4301,D Dietrich,1054,2016-06-28,Derek Dietrich singled to second (Grounder).
J_Wilson,4301,D DeShields,1137,2016-05-07,Delino DeShields advanced on a stolen base to 2B.
J_Wilson,4301,M Franco,1217,2016-05-23,Maikel Franco was intentionally walked.
J_Wilson,4301,C Casali,1251,2016-05-21,Curt Casali walked.
J_Wilson,4301,B Butler,7399,2016-04-25,Billy Butler doubled to center (Fliner (Fly)).
J_Wilson,4301,J Beresford,4626,2016-09-22,James Beresford walked.
J_Wilson,4301,J Kipnis,9776,2016-04-22,Jason Kipnis singled to right (Liner).
J_Wilson,4301,R Odor,1228,2016-05-06,Rougned Odor doubled to left (Fliner (Liner)). Bobby Wilson scored. Delino DeShields scored.
J_Wilson,4301,A Eaton,1120,2016-09-07,Adam Eaton singled to left (Liner). Omar Narvaez scored. Tyler Saladino advanced to 2B.
J_Wilson,4301,C Beltran,589&,2016-06-12,Carlos Beltran walked. Jacoby Ellsbury advanced to 2B.
J_Wilson,4301,F Lindor,1291,2016-04-22,Francisco Lindor singled to left (Grounder). Jason Kipnis advanced to 2B.
J_Wilson,4301,J Abreu,1567,2016-08-29,Jose Abreu doubled to right (Liner). Melky Cabrera advanced to 3B.
J_Wilson,4301,K Pillar,1243,2016-07-07,Kevin Pillar singled to center (Liner). Troy Tulowitzki advanced to 2B.
J_Wilson,4301,T Kelly,7740,2016-08-06,Ty Kelly singled to right (Grounder).
J_Wilson,4301,J Abreu,1567,2016-06-04,Jose Abreu singled to left (Grounder).
J_Wilson,4301,P Bourjos,2578,2016-05-23,Peter Bourjos advanced on a wild pitch to 2B.
J_Wilson,4301,K Marte,1361,2016-06-20,Ketel Marte doubled to right (Liner).
J_Wilson,4301,P Bourjos,2578,2016-05-23,Peter Bourjos reached on error to third (Grounder). Error by Nick Castellanos.
J_Wilson,4301,J Kipnis,9776,2016-09-17,Jason Kipnis advanced on a wild pitch to 2B.
J_Wilson,4301,R Odor,1228,2016-05-08,Rougned Odor singled to center (Grounder).
J_Wilson,4301,K Suzuki,8259,2016-04-29,Kurt Suzuki walked.
J_Wilson,4301,L Martin,1184,2016-08-10,Leonys Martin singled to left (Fliner (Fly)). Kyle Seager scored. Mike Zunino advanced to 2B.
J_Wilson,4301,J Dyson,4866,2016-06-19,Jarrod Dyson was hit by a pitch.
J_Wilson,4301,A Garcia,5760,2016-07-23,Avisail Garcia singled to third (Grounder).
J_Wilson,4301,M Gonzalez,5497,2016-04-16,Marwin Gonzalez singled to left (Grounder).
J_Wilson,4301,H Ramirez,8001,2016-07-25,Hanley Ramirez singled to left (Grounder). David Ortiz advanced to 2B.
J_Wilson,4301,E Carrera,9048,2016-07-07,Ezequiel Carrera singled to center (Grounder).
J_Wilson,4301,A Garcia,5760,2016-07-23,Avisail Garcia advanced on a stolen base to 2B.
J_Wilson,4301,C Cuthbert,1047,2016-09-02,Cheslor Cuthbert singled to right (Grounder). Paulo Orlando advanced to 2B.
J_Wilson,4301,B Miller,1277,2016-05-21,Brad Miller tripled to right (Liner). Curt Casali scored. Brandon Guyer scored.
J_Wilson,4301,R Perez,2900,2016-09-26,Roberto Perez homered (Fly).
J_Wilson,4301,J Kipnis,9776,2016-09-17,Jason Kipnis advanced on a stolen base to 3B.
J_Wilson,4301,N Mazara,1455,2016-05-08,Nomar Mazara singled to center (Fliner (Liner)). Rougned Odor advanced to 3B.
J_Wilson,4301,J Ramirez,1351,2016-09-17,Jose Ramirez singled to center (Grounder). Jason Kipnis scored. Francisco Lindor advanced to 3B. Mike Napoli advanced to 2B.
J_Wilson,4301,P Alvarez,2495,2016-05-12,Pedro Alvarez singled to right (Grounder). Adam Jones scored. Chris Davis advanced to 3B.
J_Wilson,4301,E Hosmer,3516,2016-09-02,Eric Hosmer singled to center (Fliner (Liner)). Paulo Orlando scored. Cheslor Cuthbert advanced to 3B.
J_Wilson,4301,A Gordon,5209,2016-08-17,Alex Gordon homered (Fliner (Fly)).
J_Wilson,4301,N Cruz,2434,2016-08-10,Nelson Cruz homered (Fly).
J_Wilson,4301,A Eaton,1120,2016-07-23,Adam Eaton singled to left (Grounder). Avisail Garcia scored.
