playername,playerid,vsname,vsid,date,Play
M_Albers,4300,M Sano,1216,2016-07-29,Miguel Sano flied out to right (Fly). Robbie Grossman out at third.
M_Albers,4300,L Cain,9077,2016-05-27,Lorenzo Cain struck out swinging.
M_Albers,4300,E Andrus,8709,2016-04-23,Elvis Andrus lined out to pitcher (Liner). Hanser Alberto out at second.
M_Albers,4300,B Dozier,9810,2016-04-14,Brian Dozier grounded out to pitcher (Grounder).
M_Albers,4300,K Suzuki,8259,2016-07-30,Kurt Suzuki flied out to center (Fliner (Liner)).
M_Albers,4300,K Plawecki,1380,2016-06-01,Kevin Plawecki grounded out to third (Grounder).
M_Albers,4300,J Lagares,5384,2016-06-01,Juan Lagares grounded out to second (Grounder).
M_Albers,4300,K Suzuki,8259,2016-06-30,Kurt Suzuki flied out to right (Fliner (Fly)).
M_Albers,4300,R Goins,9807,2016-06-24,Ryan Goins grounded out to second (Liner).
M_Albers,4300,C Correa,1416,2016-05-17,Carlos Correa struck out swinging.
M_Albers,4300,D Barney,2430,2016-04-25,Darwin Barney struck out looking.
M_Albers,4300,C Cron,1254,2016-04-19,C.J. Cron singled to right (Grounder). Andrelton Simmons out at home. C.J. Cron
M_Albers,4300,J Murphy,1034,2016-04-14,John Ryan Murphy grounded out to shortstop (Grounder).
M_Albers,4300,J Loney,4556,2016-06-01,James Loney reached on fielder's choice to second (Grounder). Neil Walker out at second.
M_Albers,4300,W Contreras,1160,2016-07-25,Willson Contreras reached on fielder's choice to second (Grounder). Ben Zobrist out at second.
M_Albers,4300,A Hechavarria,1045,2016-08-13,Adeiny Hechavarria grounded into a double play to third (Grounder). J.T. Realmuto advanced to 3B. Derek Dietrich out at second.
M_Albers,4300,M Ozuna,1032,2016-08-13,Marcell Ozuna grounded into a double play to shortstop (Grounder). Giancarlo Stanton out at second.
M_Albers,4300,J Lowrie,4418,2016-04-05,Jed Lowrie struck out swinging.
M_Albers,4300,J Thole,9689,2016-04-25,Josh Thole flied out to center (Fliner (Liner)).
M_Albers,4300,F Lindor,1291,2016-05-23,Francisco Lindor lined out to shortstop (Liner).
M_Albers,4300,A Escobar,6310,2016-05-29,Alcides Escobar flied out to center (Fly).
M_Albers,4300,B Dozier,9810,2016-04-11,Brian Dozier reached on fielder's choice to shortstop (Grounder). Byron Buxton out at second.
M_Albers,4300,Y Alonso,2530,2016-04-05,Yonder Alonso grounded out to second (Grounder).
M_Albers,4300,B Wilson,6564,2016-05-09,Bobby Wilson struck out looking.
M_Albers,4300,C Perez,1064,2016-04-19,Carlos Perez grounded out to shortstop (Grounder).
M_Albers,4300,A Hicks,5297,2016-05-15,Aaron Hicks flied out to center (Fly).
M_Albers,4300,K Vargas,1210,2016-07-29,Kennys Vargas flied out to shortstop (Fly).
M_Albers,4300,D McGowan,8600,2016-08-13,Dustin McGowan grounded out to shortstop (Grounder).
M_Albers,4300,C Cuthbert,1047,2016-06-12,Cheslor Cuthbert struck out swinging.
M_Albers,4300,M Franco,1217,2016-08-24,Maikel Franco struck out swinging.
M_Albers,4300,N Castellanos,1173,2016-07-22,Nick Castellanos grounded out to shortstop (Grounder).
M_Albers,4300,J Rickard,1327,2016-05-01,Joey Rickard flied out to center (Fly).
M_Albers,4300,N Castellanos,1173,2016-06-13,Nick Castellanos grounded out to first (Grounder).
M_Albers,4300,B Guyer,2636,2016-04-17,Brandon Guyer was caught stealing.
M_Albers,4300,D Pedroia,8370,2016-05-05,Dustin Pedroia flied out to second (Fly).
M_Albers,4300,L Cain,9077,2016-05-22,Lorenzo Cain struck out swinging.
M_Albers,4300,C Colon,1114,2016-06-12,Christian Colon flied out to second (Fliner (Fly)).
M_Albers,4300,X Bogaerts,1216,2016-05-05,Xander Bogaerts grounded out to third (Grounder).
M_Albers,4300,M Napoli,3057,2016-04-09,Mike Napoli struck out swinging.
M_Albers,4300,W Merrifield,1128,2016-05-21,Whit Merrifield lined out to first (Liner).
M_Albers,4300,Y Cespedes,1311,2016-05-30,Yoenis Cespedes flied out to center (Fly).
M_Albers,4300,P Orlando,8628,2016-08-10,Paulo Orlando sacrificed to pitcher (Bunt Grounder). Christian Colon advanced to 2B.
M_Albers,4300,D Mastroianni,7316,2016-05-07,Darin Mastroianni grounded out to second (Grounder).
M_Albers,4300,L Forsythe,7185,2016-04-17,Logan Forsythe struck out looking.
M_Albers,4300,J Upton,5222,2016-07-22,Justin Upton grounded out to second (Grounder).
M_Albers,4300,C Hernandez,1055,2016-08-24,Cesar Hernandez grounded out to second (Grounder).
M_Albers,4300,V Martinez,393&,2016-06-04,Victor Martinez flied out to center (Fly).
M_Albers,4300,M Aviles,5986,2016-07-23,Mike Aviles grounded out to second (Grounder).
M_Albers,4300,J Polanco,1315,2016-09-04,Jorge Polanco flied out to center (Fly).
M_Albers,4300,Y Gomes,9627,2016-04-09,Yan Gomes struck out swinging.
M_Albers,4300,T Plouffe,7462,2016-05-07,Trevor Plouffe struck out looking.
M_Albers,4300,J Polanco,1315,2016-07-30,Jorge Polanco grounded out to pitcher (Grounder).
M_Albers,4300,M Trumbo,6876,2016-05-01,Mark Trumbo struck out looking.
M_Albers,4300,R Davis,3708,2016-08-16,Rajai Davis grounded out to third (Grounder). Roberto Perez advanced to 3B.
M_Albers,4300,J Uribe,454&,2016-04-09,Juan Uribe grounded out to shortstop (Grounder).
M_Albers,4300,E Andrus,8709,2016-05-10,Elvis Andrus fouled out to third (Fly).
M_Albers,4300,T Plouffe,7462,2016-09-04,Trevor Plouffe grounded out to third (Grounder).
M_Albers,4300,M Wieters,4298,2016-08-07,Matt Wieters flied out to right (Fly).
M_Albers,4300,J Iglesias,1023,2016-08-02,Jose Iglesias grounded out to first (Grounder).
M_Albers,4300,H Kim,1871,2016-08-07,Hyun Soo Kim flied out to left (Fliner (Fly)).
M_Albers,4300,C Hernandez,1055,2016-09-20,Cesar Hernandez was caught stealing.
M_Albers,4300,J Hardy,3797,2016-08-07,J.J. Hardy flied out to right (Fliner (Fly)).
M_Albers,4300,B Holaday,1128,2016-04-22,Bryan Holaday flied out to center (Fly).
M_Albers,4300,L Forsythe,7185,2016-09-27,Logan Forsythe grounded out to pitcher (Grounder).
M_Albers,4300,K Davis,9112,2016-08-19,Khris Davis grounded out to third (Grounder).
M_Albers,4300,C Crisp,1572,2016-08-19,Coco Crisp flied out to center (Fly).
M_Albers,4300,L Maile,1335,2016-09-27,Luke Maile struck out swinging.
M_Albers,4300,V Martinez,393&,2016-08-02,Victor Martinez flied out to third (Fly).
M_Albers,4300,J Decker,7945,2016-09-27,Jaff Decker grounded out to second (Grounder).
M_Albers,4300,A Rendon,1286,2016-06-08,Anthony Rendon flied out to first (Fliner (Fly)).
M_Albers,4300,R Zimmerman,4220,2016-06-08,Ryan Zimmerman walked.
M_Albers,4300,T Naquin,1335,2016-06-18,Tyler Naquin homered (Fly).
M_Albers,4300,A Ramirez,5133,2016-09-27,Alexei Ramirez reached on error to shortstop (Grounder). Error by Tim Anderson.
M_Albers,4300,B Harper,1157,2016-06-08,Wilson Ramos advanced on a wild pitch to 2B.
M_Albers,4300,S Pearce,9957,2016-08-07,Steve Pearce singled to right (Grounder). Chris Davis advanced to 2B.
M_Albers,4300,C Dickerson,1076,2016-09-27,Corey Dickerson singled to first (Grounder). Juniel Querecuto scored.
M_Albers,4300,J Querecuto,1214,2016-09-27,Juniel Querecuto tripled to center (Fliner (Fly)). Alexei Ramirez scored. Richie Shaffer scored.
M_Albers,4300,C Maybin,5223,2016-08-02,Cameron Maybin walked.
M_Albers,4300,D Valencia,6364,2016-08-19,Danny Valencia doubled to center (Fliner (Fly)).
M_Albers,4300,J Uribe,454&,2016-06-18,Juan Uribe homered (Fly). Jose Ramirez scored.
M_Albers,4300,N Castellanos,1173,2016-06-04,Nick Castellanos walked.
M_Albers,4300,A Jones,6368,2016-05-01,Adam Jones singled to right (Fliner (Fly)).
M_Albers,4300,C Maybin,5223,2016-06-04,Cameron Maybin singled to shortstop (Grounder). Mike Aviles scored. Jose Iglesias advanced to 2B.
M_Albers,4300,V Martinez,393&,2016-07-22,Victor Martinez hit a sacrifice fly to center (Fliner (Liner)). Ian Kinsler scored.
M_Albers,4300,O Herrera,1147,2016-08-24,Odubel Herrera advanced on a wild pitch to 2B.
M_Albers,4300,O Herrera,1147,2016-08-24,Odubel Herrera singled to left (Grounder).
M_Albers,4300,G Soto,3707,2016-07-15,Geovany Soto singled to right (Grounder). Johnny Giavotella scored. Jefry Marte advanced to 3B.
M_Albers,4300,B Guyer,2636,2016-04-17,Brandon Guyer singled to left (Liner).
M_Albers,4300,P Alvarez,2495,2016-08-07,Pedro Alvarez singled to center (Fliner (Liner)). Steve Pearce scored.
M_Albers,4300,D Butera,3411,2016-05-29,Drew Butera walked. Brett Eibner advanced to 3B. Cheslor Cuthbert advanced to 2B.
M_Albers,4300,J Dyson,4866,2016-05-21,Jarrod Dyson singled to center (Liner).
M_Albers,4300,J Martinez,6184,2016-06-04,J.D. Martinez doubled to center (Fliner (Fly)).
M_Albers,4300,M Cabrera,1744,2016-07-23,Miguel Cabrera grounded out to shortstop (Grounder). Cameron Maybin scored.
M_Albers,4300,J Baez,1297,2016-07-25,Javier Baez advanced on a stolen base to 3B.
M_Albers,4300,D Gregorius,6012,2016-05-15,Didi Gregorius walked.
M_Albers,4300,B Buxton,1416,2016-04-11,Byron Buxton singled to left (Grounder).
M_Albers,4300,M Kepler,1214,2016-04-14,Max Kepler walked.
M_Albers,4300,D Pedroia,8370,2016-06-22,Dustin Pedroia singled to center (Grounder). Sandy Leon advanced to 3B.
M_Albers,4300,N Walker,7539,2016-06-01,Neil Walker singled to left (Fliner (Fly)).
M_Albers,4300,C Crisp,1572,2016-04-05,Coco Crisp doubled to right (Fliner (Liner)).
M_Albers,4300,A Russell,1410,2016-07-25,Addison Russell walked. Jason Heyward advanced to 2B.
M_Albers,4300,G Springer,1285,2016-05-17,George Springer advanced on a stolen base to 2B.
M_Albers,4300,R Zimmerman,4220,2016-06-07,Ryan Zimmerman advanced on a wild pitch to 3B.
M_Albers,4300,C Maybin,5223,2016-07-23,"Cameron Maybin advanced on a stolen base to 2B, advanced to 3B on error. Error by Dioner Navarro."
M_Albers,4300,M Cabrera,1744,2016-07-22,Miguel Cabrera singled to second (Grounder). Ian Kinsler advanced to 3B. Cameron Maybin advanced to 2B.
M_Albers,4300,B Dozier,9810,2016-09-04,Brian Dozier doubled to left (Liner). Byron Buxton scored.
M_Albers,4300,A Rendon,1286,2016-06-07,Anthony Rendon reached on fielder's choice and error to shortstop (Grounder). Ryan Zimmerman advanced to 2B on error. Error by Tyler Saladino.
M_Albers,4300,G Springer,1285,2016-05-17,George Springer singled to center (Grounder).
M_Albers,4300,B Park,1849,2016-04-14,Byung-ho Park doubled to center (Fly).
M_Albers,4300,J Saltalamacchia,5557,2016-08-30,Jarrod Saltalamacchia walked. Justin Upton advanced to 2B.
M_Albers,4300,J Schoop,1126,2016-04-30,Jonathan Schoop walked.
M_Albers,4300,I Desmond,6885,2016-04-23,Ian Desmond walked.
M_Albers,4300,J Baez,1297,2016-07-25,Javier Baez doubled to right (Fliner (Fly)).
M_Albers,4300,D Fowler,4062,2016-07-25,Dexter Fowler singled to second (Grounder). Javier Baez scored.
M_Albers,4300,X Bogaerts,1216,2016-06-22,Xander Bogaerts singled to pitcher (Grounder). Sandy Leon scored. Dustin Pedroia advanced to 2B.
M_Albers,4300,J Bradley Jr.,1298,2016-06-23,Jackie Bradley Jr. was hit by a pitch. David Ortiz advanced to 3B. Ryan LaMarre advanced to 2B.
M_Albers,4300,J Ramirez,1351,2016-05-23,Jose Ramirez homered (Fly). Jason Kipnis scored.
M_Albers,4300,J Bradley Jr.,1298,2016-05-05,Jackie Bradley Jr. homered (Fliner (Fly)).
M_Albers,4300,S Leon,5273,2016-06-23,Sandy Leon singled to center (Grounder). Jackie Bradley Jr. scored. Hanley Ramirez advanced to 3B.
M_Albers,4300,G Stanton,4949,2016-08-13,Giancarlo Stanton singled to center (Liner). Adam Conley scored. Dee Gordon scored. Martin Prado advanced to 2B.
M_Albers,4300,W Merrifield,1128,2016-05-27,Whit Merrifield singled to left (Grounder). Brett Eibner scored. Jarrod Dyson scored. Alcides Escobar advanced to 2B.
M_Albers,4300,H Ramirez,8001,2016-06-23,Hanley Ramirez singled to second (Grounder). David Ortiz scored. Ryan LaMarre scored on error. Jackie Bradley Jr. advanced to 3B on error. Hanley Ramirez Error by Brett Lawrie.
M_Albers,4300,C Maybin,5223,2016-07-21,Cameron Maybin flied out to right (Fliner (Fly)).
M_Albers,4300,E Gattis,1100,2016-05-17,Evan Gattis homered (Fliner (Fly)). George Springer scored.
M_Albers,4300,E Escobar,6153,2016-07-30,Eduardo Escobar homered (Fly). Max Kepler scored. Brian Dozier scored.
