playername,playerid,vsname,vsid,date,Play
M_Barnes,1286,G Blanco,3123,2016-07-20,Gregor Blanco non-force gdp to first (Grounder). Brandon Belt out at home. Buster Posey advanced to 3B. Brandon Crawford advanced to 2B.
M_Barnes,1286,M Teixeira,1281,2016-08-09,Mark Teixeira struck out looking.
M_Barnes,1286,E Aybar,4082,2016-08-20,Erick Aybar flied out to shortstop (Fly).
M_Barnes,1286,C Gillaspie,9009,2016-07-20,Conor Gillaspie fouled out to first (Fly).
M_Barnes,1286,J Decker,7945,2016-09-25,Jaff Decker struck out looking.
M_Barnes,1286,C Joseph,7087,2016-04-11,Caleb Joseph flied out to left (Fliner (Liner)). Jonathan Schoop out at third.
M_Barnes,1286,N Franklin,1016,2016-09-23,Nick Franklin flied out to shortstop (Fly).
M_Barnes,1286,M Gonzalez,5497,2016-04-24,Marwin Gonzalez flied out to left (Fliner (Liner)).
M_Barnes,1286,H Conger,2505,2016-07-08,Hank Conger struck out swinging.
M_Barnes,1286,R Martin,4616,2016-06-04,Russell Martin struck out looking.
M_Barnes,1286,A Rodriguez,1274,2016-08-10,Alex Rodriguez flied out to right (Fly). Gary Sanchez advanced to 3B.
M_Barnes,1286,R Torreyes,1140,2016-09-17,Ronald Torreyes grounded out to third (Grounder).
M_Barnes,1286,L Forsythe,7185,2016-08-25,Logan Forsythe struck out swinging.
M_Barnes,1286,K Pillar,1243,2016-09-11,Kevin Pillar reached on fielder's choice to shortstop (Grounder). Melvin Upton Jr. out at second.
M_Barnes,1286,T Tulowitzki,3531,2016-10-01,Troy Tulowitzki flied out to center (Fliner (Liner)).
M_Barnes,1286,N Reimold,3441,2016-04-11,Nolan Reimold struck out swinging.
M_Barnes,1286,B Belt,1026,2016-07-20,Brandon Belt struck out swinging.
M_Barnes,1286,J Decker,7945,2016-09-23,Jaff Decker struck out swinging.
M_Barnes,1286,L Forsythe,7185,2016-08-30,Logan Forsythe was caught stealing.
M_Barnes,1286,M Teixeira,1281,2016-09-17,Mark Teixeira grounded out to third (Grounder).
M_Barnes,1286,R Pena,8841,2016-07-20,Ramiro Pena flied out to center (Fly).
M_Barnes,1286,O Infante,1609,2016-05-17,Omar Infante flied out to center (Fliner (Liner)).
M_Barnes,1286,J Giavotella,6740,2016-07-01,Johnny Giavotella grounded out to pitcher (Grounder).
M_Barnes,1286,L Forsythe,7185,2016-08-31,Logan Forsythe struck out swinging.
M_Barnes,1286,A Eaton,1120,2016-05-05,Adam Eaton grounded out to shortstop (Grounder).
M_Barnes,1286,K Kiermaier,1103,2016-08-25,Kevin Kiermaier flied out to shortstop (Fly).
M_Barnes,1286,H Kim,1871,2016-04-13,Hyun Soo Kim out on a dropped third strike.
M_Barnes,1286,D Span,8347,2016-07-20,Denard Span flied out to center (Fliner (Fly)).
M_Barnes,1286,C Rasmus,9893,2016-04-24,Colby Rasmus grounded out to shortstop (Grounder).
M_Barnes,1286,W Myers,1004,2016-09-06,Wil Myers out on a dropped third strike.
M_Barnes,1286,R Davis,3708,2016-04-06,Rajai Davis was caught stealing. Francisco Lindor advanced to 2B.
M_Barnes,1286,L Morrison,9205,2016-04-19,Logan Morrison flied out to center (Fliner (Fly)).
M_Barnes,1286,M Cabrera,4022,2016-06-21,Melky Cabrera struck out looking.
M_Barnes,1286,B Gardner,9927,2016-07-16,Brett Gardner struck out swinging.
M_Barnes,1286,T Mancini,1514,2016-09-20,Trey Mancini grounded out to first (Grounder). Jonathan Schoop advanced to 3B.
M_Barnes,1286,C Casali,1251,2016-07-09,Curt Casali flied out to left (Fly).
M_Barnes,1286,J Bautista,1887,2016-06-04,Jose Bautista grounded out to shortstop (Grounder).
M_Barnes,1286,J Rollins,971&,2016-05-05,Jimmy Rollins grounded out to second (Grounder).
M_Barnes,1286,A Beltre,639&,2016-07-04,Adrian Beltre grounded out to third (Grounder).
M_Barnes,1286,J Ramirez,1351,2016-04-06,Jose Ramirez struck out swinging.
M_Barnes,1286,J Rickard,1327,2016-04-13,Joey Rickard flied out to right (Fliner (Fly)).
M_Barnes,1286,J Bautista,1887,2016-04-08,Jose Bautista lined out to shortstop (Liner).
M_Barnes,1286,M Machado,1149,2016-09-13,Manny Machado struck out swinging.
M_Barnes,1286,M Byrd,950&,2016-04-06,Marlon Byrd struck out looking.
M_Barnes,1286,J Iglesias,1023,2016-07-27,Jose Iglesias grounded out to second (Grounder).
M_Barnes,1286,C Casali,1251,2016-04-19,Curt Casali out on a dropped third strike.
M_Barnes,1286,J Upton,5222,2016-07-27,Justin Upton reached on fielder's choice to second (Grounder). Victor Martinez out at second.
M_Barnes,1286,A Jones,6368,2016-08-16,Adam Jones grounded out to shortstop (Grounder).
M_Barnes,1286,D Barney,2430,2016-06-04,Darwin Barney grounded out to shortstop (Grounder).
M_Barnes,1286,J Uribe,454&,2016-05-20,Juan Uribe flied out to center (Fliner (Fly)).
M_Barnes,1286,B Lawrie,5247,2016-06-21,Brett Lawrie flied out to right (Fliner (Fly)).
M_Barnes,1286,A Jones,6368,2016-09-13,Adam Jones grounded out to shortstop (Grounder).
M_Barnes,1286,P Fielder,4613,2016-07-04,Prince Fielder flied out to second (Fly).
M_Barnes,1286,S Van Slyke,4365,2016-08-06,Scott Van Slyke was caught stealing.
M_Barnes,1286,J Smoak,9054,2016-05-27,Justin Smoak struck out swinging.
M_Barnes,1286,L Forsythe,7185,2016-07-09,Logan Forsythe grounded out to shortstop (Grounder).
M_Barnes,1286,T Beckham,7949,2016-04-21,Tim Beckham struck out swinging.
M_Barnes,1286,M Saunders,9981,2016-06-04,Michael Saunders struck out swinging.
M_Barnes,1286,Y Gomes,9627,2016-05-20,Yan Gomes flied out to right (Fliner (Fly)).
M_Barnes,1286,G Sanchez,1144,2016-09-17,Gary Sanchez struck out looking.
M_Barnes,1286,T Plouffe,7462,2016-06-12,Trevor Plouffe sacrificed to catcher (Bunt Grounder). Joe Mauer advanced to 2B.
M_Barnes,1286,T Beckham,7949,2016-04-21,Tim Beckham struck out swinging.
M_Barnes,1286,C Headley,4720,2016-04-29,Chase Headley grounded out to second (Grounder).
M_Barnes,1286,S Pearce,9957,2016-04-21,Steve Pearce grounded out to shortstop (Grounder).
M_Barnes,1286,A Beltre,639&,2016-06-24,Adrian Beltre struck out swinging.
M_Barnes,1286,I Desmond,6885,2016-06-24,Ian Desmond flied out to right (Fly).
M_Barnes,1286,T Plouffe,7462,2016-06-10,Trevor Plouffe struck out swinging.
M_Barnes,1286,B Wilson,6564,2016-07-06,Bobby Wilson struck out swinging.
M_Barnes,1286,D Ackley,1009,2016-05-07,Dustin Ackley flied out to second (Fly).
M_Barnes,1286,D Gregorius,6012,2016-04-29,Didi Gregorius grounded out to shortstop (Grounder).
M_Barnes,1286,D Gregorius,6012,2016-08-11,Didi Gregorius struck out swinging.
M_Barnes,1286,Y Sanchez,1160,2016-05-03,Carlos Sanchez struck out looking.
M_Barnes,1286,B Crawford,5343,2016-07-20,Brandon Crawford grounded out to second (Grounder).
M_Barnes,1286,J Donaldson,5038,2016-05-27,Josh Donaldson struck out swinging.
M_Barnes,1286,M Machado,1149,2016-06-16,Manny Machado flied out to center (Fliner (Fly)).
M_Barnes,1286,A Beltre,639&,2016-06-24,Adrian Beltre fouled out to right (Fly).
M_Barnes,1286,T Tulowitzki,3531,2016-04-17,Troy Tulowitzki struck out swinging.
M_Barnes,1286,E Encarnacion,2151,2016-05-27,Edwin Encarnacion flied out to center (Fly).
M_Barnes,1286,D Castro,1545,2016-04-27,Daniel Castro grounded out to third (Grounder).
M_Barnes,1286,B Dozier,9810,2016-06-10,Brian Dozier flied out to left (Fly).
M_Barnes,1286,B Wilson,6564,2016-06-24,Bobby Wilson struck out swinging.
M_Barnes,1286,C Dickerson,1076,2016-08-22,Corey Dickerson struck out looking.
M_Barnes,1286,B Miller,1277,2016-08-22,Brad Miller struck out looking.
M_Barnes,1286,S Choo,3174,2016-06-24,Shin-Soo Choo flied out to left (Fliner (Fly)).
M_Barnes,1286,A Ellis,5677,2016-08-06,A.J. Ellis struck out looking.
M_Barnes,1286,L Maile,1335,2016-08-25,Luke Maile sacrificed to pitcher (Bunt Grounder). Mikie Mahtook advanced to 3B.
M_Barnes,1286,G Blanco,3123,2016-07-20,Gregor Blanco flied out to left (Fly).
M_Barnes,1286,E Encarnacion,2151,2016-04-17,Edwin Encarnacion struck out swinging.
M_Barnes,1286,C Gonzalez,7287,2016-05-24,Carlos Gonzalez grounded out to pitcher (Grounder).
M_Barnes,1286,T Motter,1239,2016-06-28,Taylor Motter grounded out to second (Grounder).
M_Barnes,1286,A Garcia,1377,2016-04-27,Adonis Garcia grounded out to second (Grounder).
M_Barnes,1286,H Kim,1871,2016-06-01,Hyun Soo Kim grounded out to shortstop (Grounder).
M_Barnes,1286,K Suzuki,8259,2016-06-10,Kurt Suzuki flied out to right (Fly).
M_Barnes,1286,M Machado,1149,2016-06-01,Manny Machado grounded out to shortstop (Grounder).
M_Barnes,1286,B Buxton,1416,2016-06-10,Byron Buxton reached on fielder's choice to shortstop (Grounder). Max Kepler out at second.
M_Barnes,1286,M Semien,1253,2016-05-11,Marcus Semien grounded out to third (Grounder).
M_Barnes,1286,T Ladendorf,3211,2016-05-11,Tyler Ladendorf out on a dropped third strike.
M_Barnes,1286,B Lawrie,5247,2016-05-03,Brett Lawrie walked.
M_Barnes,1286,M Duffy,1383,2016-08-22,Matt Duffy advanced on a wild pitch to 2B.
M_Barnes,1286,J Smoak,9054,2016-04-17,Justin Smoak walked.
M_Barnes,1286,E Andrus,8709,2016-07-06,Elvis Andrus advanced on a stolen base to 2B.
M_Barnes,1286,K Kiermaier,1103,2016-08-22,Kevin Kiermaier singled to center (Grounder).
M_Barnes,1286,J Rickard,1327,2016-06-16,Joey Rickard walked.
M_Barnes,1286,M Duffy,1383,2016-08-22,Matt Duffy singled to right (Liner).
M_Barnes,1286,K Pillar,1243,2016-06-04,Kevin Pillar grounded out to second (Grounder). Devon Travis scored.
M_Barnes,1286,D Gregorius,6012,2016-05-07,Didi Gregorius singled to center (Fliner (Liner)).
M_Barnes,1286,E Longoria,9368,2016-04-19,Evan Longoria was intentionally walked.
M_Barnes,1286,A Hicks,5297,2016-05-07,Aaron Hicks hit a sacrifice fly to right (Fliner (Liner)). Didi Gregorius scored. Austin Romine advanced to 3B.
M_Barnes,1286,M Saunders,9981,2016-04-17,Michael Saunders singled to left (Liner).
M_Barnes,1286,S Souza Jr.,5667,2016-04-21,Steven Souza Jr. walked.
M_Barnes,1286,A Escobar,6310,2016-05-17,Alcides Escobar advanced on a wild pitch to 2B.
M_Barnes,1286,L Forsythe,7185,2016-04-21,Logan Forsythe walked.
M_Barnes,1286,J Donaldson,5038,2016-04-17,Josh Donaldson singled to center (Fliner (Liner)). Michael Saunders advanced to 2B.
M_Barnes,1286,A Escobar,6310,2016-05-17,Alcides Escobar walked.
M_Barnes,1286,S Van Slyke,4365,2016-08-06,Scott Van Slyke singled to center (Grounder).
M_Barnes,1286,J Altuve,5417,2016-04-24,Jose Altuve advanced on a stolen base to 2B.
M_Barnes,1286,M Gonzalez,5497,2016-05-13,Marwin Gonzalez advanced on a stolen base to 2B.
M_Barnes,1286,J Donaldson,5038,2016-05-28,Josh Donaldson walked.
M_Barnes,1286,L Chisenhall,7571,2016-05-20,Lonnie Chisenhall walked.
M_Barnes,1286,J Schoop,1126,2016-06-01,Jonathan Schoop singled to center (Grounder). Joey Rickard scored. Matt Wieters advanced to 2B.
M_Barnes,1286,J Bautista,1887,2016-04-17,Jose Bautista doubled to left (Fliner (Liner)). Michael Saunders scored. Josh Donaldson advanced to 3B.
M_Barnes,1286,J Schoop,1126,2016-09-13,Jonathan Schoop singled to third (Grounder).
M_Barnes,1286,B Dozier,9810,2016-06-12,Brian Dozier advanced on defensive indifference to 2B.
M_Barnes,1286,A Pagan,2918,2016-07-20,Angel Pagan singled to center (Grounder). Trevor Brown advanced to 2B.
M_Barnes,1286,N Mazara,1455,2016-07-04,Nomar Mazara singled to right (Fliner (Liner)). Nomar Mazara advanced to 2B on error. Error by Mookie Betts.
M_Barnes,1286,D Travis,1386,2016-06-04,Devon Travis advanced on a wild pitch to 2B.
M_Barnes,1286,D Travis,1386,2016-06-04,Devon Travis advanced on a stolen base to 3B.
M_Barnes,1286,J Uribe,454&,2016-05-22,Juan Uribe walked. Lonnie Chisenhall advanced to 2B.
M_Barnes,1286,M Trumbo,6876,2016-08-16,Mark Trumbo walked.
M_Barnes,1286,A Pujols,1177,2016-07-03,Albert Pujols doubled to center (Fliner (Fly)). Kole Calhoun scored.
M_Barnes,1286,L Forsythe,7185,2016-04-19,Logan Forsythe doubled to center (Fliner (Fly)).
M_Barnes,1286,P Fielder,4613,2016-06-24,Prince Fielder homered (Fly).
M_Barnes,1286,K Kiermaier,1103,2016-08-31,Kevin Kiermaier singled to right (Liner).
M_Barnes,1286,C Headley,4720,2016-07-16,Chase Headley homered (Fly).
M_Barnes,1286,D Gregorius,6012,2016-08-10,Didi Gregorius singled to center (Grounder).
M_Barnes,1286,M Sano,1216,2016-07-24,Miguel Sano singled to center (Liner).
M_Barnes,1286,J Schoop,1126,2016-06-16,Jonathan Schoop doubled to left (Grounder). Chris Davis scored.
M_Barnes,1286,M Saunders,9981,2016-10-01,Michael Saunders walked. Russell Martin advanced to 2B.
M_Barnes,1286,J Castro,8722,2016-05-13,Jason Castro singled to center (Liner).
M_Barnes,1286,D Travis,1386,2016-06-04,Devon Travis walked.
M_Barnes,1286,D Travis,1386,2016-09-10,Devon Travis singled to center (Liner). Kevin Pillar advanced to 3B.
M_Barnes,1286,G Sanchez,1144,2016-08-10,Gary Sanchez singled to left (Grounder). Didi Gregorius advanced to 2B.
M_Barnes,1286,B Dozier,9810,2016-07-24,Brian Dozier singled to left (Grounder). Miguel Sano advanced to 2B.
M_Barnes,1286,S Souza Jr.,5667,2016-04-21,Steven Souza Jr. singled to right (Grounder). Desmond Jennings scored.
M_Barnes,1286,E Gattis,1100,2016-04-24,Evan Gattis doubled to left (Fliner (Liner)).
M_Barnes,1286,E Longoria,9368,2016-09-25,Evan Longoria walked. Logan Forsythe advanced to 2B.
M_Barnes,1286,L Forsythe,7185,2016-09-25,Logan Forsythe singled to center (Grounder).
M_Barnes,1286,J Lamb,1332,2016-08-13,Jake Lamb walked. Michael Bourn advanced to 3B. Paul Goldschmidt advanced to 2B.
M_Barnes,1286,B Dozier,9810,2016-06-12,Brian Dozier singled to center (Liner). Joe Mauer advanced to 3B.
M_Barnes,1286,J Schoop,1126,2016-04-11,Jonathan Schoop doubled to left (Fliner (Liner)). J.J. Hardy scored.
M_Barnes,1286,K Pillar,1243,2016-10-01,Kevin Pillar singled to center (Grounder). Russell Martin scored. Michael Saunders advanced to 3B.
M_Barnes,1286,R Mondesi,1376,2016-08-28,Raul Mondesi tripled to center (Fliner (Fly)). Kendrys Morales scored. Salvador Perez scored. Alcides Escobar scored.
