playername,playerid,vsname,vsid,date,Play
O_Perez,1514,A McCutchen,9847,2016-07-17,Andrew McCutchen grounded into a double play to shortstop (Grounder). Adam Frazier out at second.
O_Perez,1514,K Hernandez,1047,2016-06-22,Kiké Hernandez struck out looking.
O_Perez,1514,D Dietrich,1054,2016-05-13,Derek Dietrich grounded into a double play to shortstop (Grounder). Chris Johnson out at second.
O_Perez,1514,J Kipnis,9776,2016-07-26,Jason Kipnis flied out to left (Fliner (Fly)).
O_Perez,1514,C Seager,1362,2016-06-22,Corey Seager flied out to center (Fly).
O_Perez,1514,J Loney,4556,2016-06-28,James Loney struck out swinging.
O_Perez,1514,E Kratz,4403,2016-07-17,Erik Kratz flied out to pitcher (Bunt Fly).
O_Perez,1514,S Rodriguez,6589,2016-07-17,Sean Rodriguez reached on fielder's choice to third (Grounder). Jordy Mercer out at second.
O_Perez,1514,E Hosmer,3516,2016-05-02,Eric Hosmer struck out swinging.
O_Perez,1514,E Rosario,1215,2016-04-24,Eddie Rosario flied out to right (Fly).
O_Perez,1514,F Freeman,5361,2016-09-07,Freddie Freeman grounded out to second (Liner).
O_Perez,1514,K Morales,8610,2016-05-02,Kendrys Morales struck out looking.
O_Perez,1514,D Dietrich,1054,2016-09-30,Derek Dietrich struck out swinging.
O_Perez,1514,F Freeman,5361,2016-09-06,Freddie Freeman grounded out to second (Grounder).
O_Perez,1514,B Phillips,791&,2016-07-01,Brandon Phillips grounded out to first (Grounder).
O_Perez,1514,O Herrera,1147,2016-04-26,Odubel Herrera struck out swinging.
O_Perez,1514,M Kepler,1214,2016-04-24,Max Kepler struck out looking.
O_Perez,1514,C Bettis,1058,2016-08-28,Chad Bettis grounded out to first (Bunt Grounder).
O_Perez,1514,B Wallace,8434,2016-07-24,Brett Wallace struck out swinging.
O_Perez,1514,J Bruce,9892,2016-09-02,Jay Bruce struck out swinging.
O_Perez,1514,C Blackmon,7859,2016-08-28,Charlie Blackmon grounded out to first (Grounder).
O_Perez,1514,M Prado,3312,2016-04-20,Martin Prado grounded out to third (Grounder).
O_Perez,1514,J Heyward,4940,2016-06-14,Jason Heyward flied out to shortstop (Fly).
O_Perez,1514,D Dietrich,1054,2016-10-02,Derek Dietrich flied out to right (Fliner (Fly)).
O_Perez,1514,N Markakis,5930,2016-04-13,Nick Markakis grounded out to second (Grounder).
O_Perez,1514,T Wolters,1147,2016-08-28,Tony Wolters grounded out to pitcher (Grounder).
O_Perez,1514,D Fowler,4062,2016-06-15,Dexter Fowler flied out to center (Fliner (Fly)).
O_Perez,1514,D Dietrich,1054,2016-05-15,Derek Dietrich grounded out to first (Grounder).
O_Perez,1514,J Reyes,1736,2016-07-07,Jose Reyes flied out to shortstop (Fly).
O_Perez,1514,F Freeman,5361,2016-04-13,Freddie Freeman struck out looking.
O_Perez,1514,D Gordon,8203,2016-04-07,Dee Gordon out on a dropped third strike.
O_Perez,1514,A De Aza,3371,2016-05-17,Alejandro De Aza struck out swinging.
O_Perez,1514,A Wainwright,2233,2016-05-28,Adam Wainwright struck out swinging.
O_Perez,1514,M Reynolds,1378,2016-05-17,Matt Reynolds grounded out to third (Grounder).
O_Perez,1514,D Wright,3787,2016-05-25,David Wright struck out swinging.
O_Perez,1514,J Pederson,1189,2016-06-20,Joc Pederson struck out swinging.
O_Perez,1514,J Bour,9744,2016-10-02,Justin Bour struck out swinging.
O_Perez,1514,M Conforto,1637,2016-05-25,Michael Conforto lined out to second (Liner).
O_Perez,1514,A Gonzalez,1908,2016-07-21,Adrian Gonzalez flied out to center (Fliner (Liner)).
O_Perez,1514,A Garcia,1377,2016-04-13,Adonis Garcia struck out swinging.
O_Perez,1514,J Turner,5235,2016-07-21,Justin Turner struck out swinging.
O_Perez,1514,R Howard,2154,2016-06-01,Ryan Howard flied out to center (Fly).
O_Perez,1514,B Paulsen,9741,2016-08-17,Ben Paulsen struck out swinging.
O_Perez,1514,A Ramirez,5133,2016-07-22,Alexei Ramirez flied out to right (Fliner (Fly)).
O_Perez,1514,Y Grandal,1136,2016-07-19,Yasmani Grandal fouled out to third (Fly).
O_Perez,1514,C Davis,9272,2016-08-23,Chris Davis struck out swinging.
O_Perez,1514,F Freeman,5361,2016-09-17,Freddie Freeman struck out looking.
O_Perez,1514,D Dietrich,1054,2016-05-22,Derek Dietrich grounded out to third (Grounder).
O_Perez,1514,J Peterson,1232,2016-08-14,Jace Peterson flied out to shortstop (Fly).
O_Perez,1514,M Trumbo,6876,2016-08-23,Mark Trumbo grounded out to third (Grounder).
O_Perez,1514,J Schoop,1126,2016-08-23,Jonathan Schoop struck out swinging.
O_Perez,1514,E Inciarte,4922,2016-08-14,Ender Inciarte flied out to left (Fliner (Liner)).
O_Perez,1514,J Lagares,5384,2016-05-19,Juan Lagares flied out to left (Fly).
O_Perez,1514,A Jackson,9848,2016-06-08,Austin Jackson grounded out to second (Grounder).
O_Perez,1514,C Yelich,1147,2016-05-14,Christian Yelich struck out looking.
O_Perez,1514,E Aybar,4082,2016-08-14,Erick Aybar flied out to first (Fly).
O_Perez,1514,B Hamilton,1019,2016-07-03,Billy Hamilton struck out looking.
O_Perez,1514,A Avila,7476,2016-06-08,Alex Avila was hit by a pitch.
O_Perez,1514,A Garcia,5760,2016-06-08,Avisail Garcia singled to center (Liner). Melky Cabrera scored. Jimmy Rollins scored. Alex Avila advanced to 2B.
O_Perez,1514,M Ozuna,1032,2016-05-14,Marcell Ozuna singled to left (Grounder). Martin Prado advanced to 3B. Giancarlo Stanton advanced to 2B.
O_Perez,1514,M Prado,3312,2016-05-14,Martin Prado singled to center (Fliner (Liner)).
O_Perez,1514,A Rizzo,3473,2016-05-06,Anthony Rizzo advanced on a wild pitch to 2B.
O_Perez,1514,A Rizzo,3473,2016-05-06,Anthony Rizzo walked.
O_Perez,1514,D Span,8347,2016-08-06,Denard Span doubled to left (Liner). Ehire Adrianza advanced to 3B.
O_Perez,1514,A Garcia,1377,2016-08-12,Adonis Garcia was intentionally walked.
O_Perez,1514,H Pence,8252,2016-08-06,Hunter Pence walked.
O_Perez,1514,M Prado,3312,2016-04-18,Martin Prado walked.
O_Perez,1514,C Yelich,1147,2016-04-18,Christian Yelich singled to right (Grounder). Martin Prado advanced to 2B.
O_Perez,1514,D Gordon,8203,2016-10-02,Dee Gordon advanced on a wild pitch to 2B.
O_Perez,1514,Y Cespedes,1311,2016-07-07,Yoenis Cespedes was intentionally walked.
O_Perez,1514,E Adrianza,8418,2016-08-06,Ehire Adrianza singled to left (Liner). Hunter Pence scored.
O_Perez,1514,B Wallace,8434,2016-07-22,Brett Wallace was hit by a pitch.
O_Perez,1514,D Gordon,8203,2016-10-02,Dee Gordon singled to center (Fliner (Liner)).
O_Perez,1514,F Freeman,5361,2016-08-12,Freddie Freeman was hit by a pitch.
O_Perez,1514,C Blackmon,7859,2016-08-16,Charlie Blackmon walked.
O_Perez,1514,G Parra,8553,2016-08-28,Gerardo Parra singled to center (Grounder).
O_Perez,1514,W Myers,1004,2016-07-24,Wil Myers walked.
O_Perez,1514,M Kemp,5631,2016-08-12,Matt Kemp walked. Freddie Freeman advanced to 2B.
O_Perez,1514,J Kipnis,9776,2016-08-10,Jason Kipnis singled to first (Grounder). Rajai Davis advanced to 2B.
O_Perez,1514,C Bethancourt,1002,2016-06-17,Christian Bethancourt walked.
O_Perez,1514,N Markakis,5930,2016-04-12,Nick Markakis walked.
O_Perez,1514,G Parra,8553,2016-08-16,Gerardo Parra doubled to center (Fliner (Fly)).
O_Perez,1514,D Descalso,8392,2016-08-28,Daniel Descalso doubled to center (Fliner (Fly)). Gerardo Parra advanced to 3B.
O_Perez,1514,A Cabrera,4962,2016-07-07,Asdrubal Cabrera singled to center (Liner).
O_Perez,1514,A Diaz,1593,2016-05-29,Aledmys Diaz singled to left (Liner).
O_Perez,1514,M Smith,1360,2016-04-12,Mallex Smith advanced on a wild pitch to 2B.
O_Perez,1514,M Smith,1360,2016-04-12,Mallex Smith walked.
O_Perez,1514,A Blanco,1907,2016-04-26,Andres Blanco doubled to left (Fliner (Liner)).
O_Perez,1514,A Frazier,1522,2016-07-17,Adam Frazier walked.
O_Perez,1514,A Pagan,2918,2016-07-29,Angel Pagan singled to left (Fliner (Fly)). Denard Span advanced to 2B.
O_Perez,1514,T Brown,1389,2016-07-28,Trevor Brown walked. Brandon Belt advanced to 3B. Mac Williamson advanced to 2B.
O_Perez,1514,G Blanco,3123,2016-07-28,Gregor Blanco reached on fielder's choice and error to third (Grounder). Brandon Belt scored on error. Mac Williamson advanced to 3B. Trevor Brown advanced to 2B on error. Error by Danny Espinosa.
O_Perez,1514,F Lindor,1291,2016-07-26,Francisco Lindor singled to right (Grounder). Chris Gimenez scored. Lonnie Chisenhall advanced to 3B. Rajai Davis advanced to 2B.
O_Perez,1514,W Flores,5827,2016-07-07,Wilmer Flores homered (Fliner (Fly)). Asdrubal Cabrera scored. Brandon Nimmo scored.
O_Perez,1514,A Rizzo,3473,2016-06-15,Anthony Rizzo homered (Fliner (Fly)). Kris Bryant scored.
