playername,playerid,vsname,vsid,date,Play
P_Clemens,8037,N Arenado,9777,2016-06-20,Nolan Arenado grounded into a double play to third (Grounder). Charlie Blackmon advanced to 3B. DJ LeMahieu out at second.
P_Clemens,8037,Y Moncada,1723,2016-09-06,Yoan Moncada struck out looking.
P_Clemens,8037,R Raburn,2218,2016-06-20,Ryan Raburn grounded into a double play to shortstop (Grounder). Trevor Story out at second.
P_Clemens,8037,A Bradley,1291,2016-08-18,Archie Bradley struck out swinging.
P_Clemens,8037,C Buchholz,3543,2016-09-06,Clay Buchholz struck out swinging.
P_Clemens,8037,M Kemp,5631,2016-08-31,Matt Kemp grounded into a double play to third (Grounder). Adonis Garcia out at third.
P_Clemens,8037,T Pham,2967,2016-07-20,Tommy Pham grounded out to second (Grounder).
P_Clemens,8037,J Segura,5933,2016-10-02,Jean Segura was caught stealing.
P_Clemens,8037,J Soler,1422,2016-08-24,Jorge Soler fouled out to catcher (Fly).
P_Clemens,8037,M Haniger,1427,2016-08-18,Mitch Haniger reached on fielder's choice to shortstop (Grounder). Welington Castillo out at second.
P_Clemens,8037,P Goldschmidt,9218,2016-09-20,Paul Goldschmidt grounded into a double play to shortstop (Grounder). Jean Segura out at second.
P_Clemens,8037,J Baez,1297,2016-06-25,Javier Baez flied out to first (Fliner (Fly)).
P_Clemens,8037,J Segura,5933,2016-08-18,Jean Segura fouled out to right (Fly).
P_Clemens,8037,J de la Rosa,2047,2016-06-20,Jorge de la Rosa struck out swinging.
P_Clemens,8037,B Phillips,791&,2016-07-31,Brandon Phillips flied out to right (Fly).
P_Clemens,8037,A Pagan,2918,2016-09-12,Angel Pagan struck out looking.
P_Clemens,8037,B Drury,1161,2016-10-02,Brandon Drury flied out to right (Fly).
P_Clemens,8037,Y Tomas,1717,2016-08-18,Yasmany Tomas flied out to center (Fly).
P_Clemens,8037,A Altherr,1127,2016-08-06,Aaron Altherr flied out to shortstop (Fly).
P_Clemens,8037,C Asche,1199,2016-08-06,Cody Asche reached on fielder's choice to first (Grounder). Ryan Howard advanced to 3B. Cameron Rupp out at second.
P_Clemens,8037,A Gonzalez,1908,2016-09-27,Adrian Gonzalez grounded out to second (Grounder).
P_Clemens,8037,P Goldschmidt,9218,2016-10-02,Paul Goldschmidt grounded out to third (Grounder).
P_Clemens,8037,A Garcia,1377,2016-08-31,Adonis Garcia struck out swinging.
P_Clemens,8037,K Wong,1253,2016-07-20,Kolten Wong struck out swinging.
P_Clemens,8037,M Koch,1342,2016-10-02,Matt Koch struck out swinging.
P_Clemens,8037,T Gosewisch,5277,2016-10-02,Tuffy Gosewisch flied out to center (Fly).
P_Clemens,8037,C Gillaspie,9009,2016-09-12,Conor Gillaspie struck out swinging.
P_Clemens,8037,A Rizzo,3473,2016-06-25,Anthony Rizzo flied out to center (Fly). Kris Bryant advanced to 3B.
P_Clemens,8037,B Posey,9166,2016-09-12,Buster Posey grounded out to shortstop (Grounder).
P_Clemens,8037,T Gosewisch,5277,2016-10-02,Tuffy Gosewisch struck out swinging.
P_Clemens,8037,J Segura,5933,2016-09-20,Jean Segura flied out to third (Fly).
P_Clemens,8037,A Toles,1341,2016-09-27,Andrew Toles flied out to left (Fly).
P_Clemens,8037,J Lamb,1332,2016-08-18,Jake Lamb struck out swinging.
P_Clemens,8037,M Betts,1361,2016-09-06,Mookie Betts flied out to third (Fly).
P_Clemens,8037,Y Tomas,1717,2016-10-02,Yasmany Tomas grounded out to third (Grounder). Brandon Drury advanced to 2B.
P_Clemens,8037,M Haniger,1427,2016-09-20,Mitch Haniger fouled out to left (Fly).
P_Clemens,8037,B Hamilton,1019,2016-07-31,Billy Hamilton flied out to right (Fly).
P_Clemens,8037,J Garcia,8137,2016-07-20,Jaime Garcia flied out to left (Fly).
P_Clemens,8037,J Samardzija,3254,2016-09-12,Jeff Samardzija flied out to center (Fly).
P_Clemens,8037,A Russell,1410,2016-06-25,Addison Russell grounded out to shortstop (Grounder).
P_Clemens,8037,J Baez,1297,2016-06-25,Javier Baez grounded out to shortstop (Grounder).
P_Clemens,8037,S Leon,5273,2016-09-06,Sandy Leon grounded out to second (Grounder).
P_Clemens,8037,B Crawford,5343,2016-09-12,Brandon Crawford flied out to right (Fly).
P_Clemens,8037,W Contreras,1160,2016-08-24,Willson Contreras grounded out to shortstop (Grounder).
P_Clemens,8037,C Owings,1003,2016-10-02,Chris Owings reached on fielder's choice to second (Grounder). Brandon Drury scored. Yasmany Tomas out at second.
P_Clemens,8037,C Blackmon,7859,2016-06-20,Charlie Blackmon flied out to center (Fly).
P_Clemens,8037,H Ramirez,8001,2016-09-06,Hanley Ramirez flied out to center (Fly).
P_Clemens,8037,G Garcia,1095,2016-07-20,Greg Garcia struck out looking.
P_Clemens,8037,C Hernandez,1055,2016-08-06,Cesar Hernandez struck out swinging.
P_Clemens,8037,M Koch,1342,2016-10-02,Matt Koch struck out swinging.
P_Clemens,8037,D LeMahieu,9874,2016-06-20,DJ LeMahieu flied out to center (Fly).
P_Clemens,8037,A De Aza,3371,2016-08-12,Alejandro De Aza flied out to right (Fliner (Fly)).
P_Clemens,8037,J Votto,4314,2016-07-31,Joey Votto struck out looking.
P_Clemens,8037,A Rosario,7125,2016-07-20,Alberto Rosario flied out to left (Fliner (Fly)).
P_Clemens,8037,Z Cozart,2616,2016-07-31,Zack Cozart reached on fielder's choice to third (Grounder). Homer Bailey out at second.
P_Clemens,8037,F Galvis,6609,2016-08-06,Freddy Galvis flied out to center (Fly).
P_Clemens,8037,T Barnhart,1020,2016-07-31,Tucker Barnhart flied out to first (Fly).
P_Clemens,8037,T Flowers,9134,2016-08-31,Tyler Flowers grounded out to third (Grounder).
P_Clemens,8037,Y Grandal,1136,2016-09-27,Yasmani Grandal fouled out to shortstop (Fly).
P_Clemens,8037,J Pederson,1189,2016-09-27,Joc Pederson struck out looking.
P_Clemens,8037,T Gosewisch,5277,2016-09-20,Tuffy Gosewisch grounded out to shortstop (Grounder).
P_Clemens,8037,A Rizzo,3473,2016-06-25,Anthony Rizzo flied out to shortstop (Fly).
P_Clemens,8037,M Haniger,1427,2016-10-02,Mitch Haniger grounded out to shortstop (Grounder). Chris Owings advanced to 2B.
P_Clemens,8037,A Russell,1410,2016-06-25,Addison Russell struck out swinging.
P_Clemens,8037,K Wong,1253,2016-07-20,Kolten Wong flied out to left (Fly).
P_Clemens,8037,K Hendricks,1204,2016-08-24,Kyle Hendricks flied out to center (Fliner (Liner)).
P_Clemens,8037,M Franco,1217,2016-08-06,Maikel Franco grounded out to third (Grounder).
P_Clemens,8037,J Lamb,1332,2016-10-02,Jake Lamb flied out to center (Fly).
P_Clemens,8037,H Pence,8252,2016-09-12,Hunter Pence flied out to center (Fly).
P_Clemens,8037,K Bryant,1542,2016-06-25,Kris Bryant flied out to right (Fliner (Fly)).
P_Clemens,8037,D LeMahieu,9874,2016-06-20,DJ LeMahieu flied out to right (Fly).
P_Clemens,8037,J Garcia,8137,2016-07-20,Jaime Garcia struck out looking.
P_Clemens,8037,A Duvall,1095,2016-07-31,Adam Duvall struck out swinging.
P_Clemens,8037,J de la Rosa,2047,2016-06-20,Jorge de la Rosa struck out swinging.
P_Clemens,8037,M Reynolds,1378,2016-08-12,Matt Reynolds struck out swinging.
P_Clemens,8037,C Granderson,4747,2016-08-12,Curtis Granderson flied out to shortstop (Fly).
P_Clemens,8037,M Bourn,6387,2016-08-18,Michael Bourn flied out to center (Fliner (Fly)). Jean Segura advanced to 3B.
P_Clemens,8037,H Kendrick,4229,2016-07-08,Howie Kendrick grounded into a double play to shortstop (Grounder). Yasmani Grandal out at second.
P_Clemens,8037,A Almora Jr.,1410,2016-06-25,Albert Almora grounded out to third (Bunt Grounder).
P_Clemens,8037,Y Moncada,1723,2016-09-06,Yoan Moncada struck out swinging.
P_Clemens,8037,K Bryant,1542,2016-08-24,Kris Bryant struck out swinging.
P_Clemens,8037,A Pagan,2918,2016-09-12,Angel Pagan grounded out to second (Grounder).
P_Clemens,8037,D Fowler,4062,2016-08-24,Dexter Fowler grounded out to catcher (Grounder).
P_Clemens,8037,P Goldschmidt,9218,2016-10-02,Paul Goldschmidt struck out swinging.
P_Clemens,8037,A De Aza,3371,2016-08-12,Alejandro De Aza reached on fielder's choice to first (Grounder). Travis d'Arnaud out at second.
P_Clemens,8037,T Barnhart,1020,2016-07-31,Tucker Barnhart struck out looking.
P_Clemens,8037,J Turner,5235,2016-09-27,Justin Turner flied out to second (Fly).
P_Clemens,8037,A Altherr,1127,2016-08-06,Aaron Altherr grounded out to shortstop (Grounder).
P_Clemens,8037,C Blackmon,7859,2016-06-20,Charlie Blackmon flied out to left (Fly).
P_Clemens,8037,P Gosselin,1095,2016-07-04,Phil Gosselin flied out to right (Fliner (Fly)).
P_Clemens,8037,C Granderson,4747,2016-08-12,Curtis Granderson grounded out to second (Grounder).
P_Clemens,8037,N Ahmed,1214,2016-07-04,Nick Ahmed hit a sacrifice fly to right (Fliner (Liner)). Brandon Drury scored.
P_Clemens,8037,T Rivera,1249,2016-08-12,T.J. Rivera flied out to left (Fliner (Liner)).
P_Clemens,8037,B Zobrist,7435,2016-08-24,Ben Zobrist grounded out to first (Grounder).
P_Clemens,8037,J Bruce,9892,2016-08-12,Jay Bruce fouled out to shortstop (Fly).
P_Clemens,8037,T Kelly,7740,2016-08-12,Ty Kelly flied out to right (Fly).
P_Clemens,8037,K Hendricks,1204,2016-08-24,Kyle Hendricks struck out looking.
P_Clemens,8037,T Rivera,1249,2016-08-12,T.J. Rivera grounded out to shortstop (Grounder).
P_Clemens,8037,S Piscotty,1336,2016-07-20,Stephen Piscotty flied out to center (Fliner (Fly)).
P_Clemens,8037,J Soler,1422,2016-08-24,Jorge Soler hit a sacrifice fly to center (Fly). Ben Zobrist scored.
P_Clemens,8037,J Donaldson,5038,2016-07-26,Josh Donaldson advanced on defensive indifference to 2B.
P_Clemens,8037,Y Puig,1422,2016-07-08,Yasiel Puig hit a sacrifice fly to left (Fliner (Liner)). Justin Turner scored.
P_Clemens,8037,B Drury,1161,2016-07-04,Brandon Drury advanced on a passed ball to 3B. Passed ball by Christian Bethancourt.
P_Clemens,8037,N Walker,7539,2016-08-12,Neil Walker walked.
P_Clemens,8037,N Walker,7539,2016-08-12,Neil Walker walked.
P_Clemens,8037,P Goldschmidt,9218,2016-08-18,Paul Goldschmidt advanced on a stolen base to 2B.
P_Clemens,8037,N Walker,7539,2016-08-12,Neil Walker walked.
P_Clemens,8037,T d'Arnaud,7739,2016-08-12,Travis d'Arnaud singled to third (Grounder).
P_Clemens,8037,A Duvall,1095,2016-07-31,Adam Duvall walked.
P_Clemens,8037,T Pham,2967,2016-07-20,Tommy Pham advanced on a stolen base to 2B.
P_Clemens,8037,C Hernandez,1055,2016-08-06,Cesar Hernandez reached on error to first (Grounder). Error by Wil Myers.
P_Clemens,8037,G Garcia,1095,2016-07-20,Greg Garcia walked.
P_Clemens,8037,N Arenado,9777,2016-06-20,Nolan Arenado singled to right (Liner).
P_Clemens,8037,M Reynolds,7619,2016-06-20,Mark Reynolds walked.
P_Clemens,8037,B Belt,1026,2016-09-12,Brandon Belt walked.
P_Clemens,8037,J Heyward,4940,2016-06-25,Jason Heyward walked.
P_Clemens,8037,Y Tomas,1717,2016-08-18,Yasmany Tomas walked.
P_Clemens,8037,E Inciarte,4922,2016-08-31,Ender Inciarte advanced on a stolen base to 2B.
P_Clemens,8037,J Turner,5235,2016-07-08,Justin Turner doubled to center (Liner).
P_Clemens,8037,P Goldschmidt,9218,2016-10-02,Paul Goldschmidt singled to left (Grounder). Jake Lamb advanced to 2B.
P_Clemens,8037,A Rizzo,3473,2016-06-25,Anthony Rizzo doubled to right (Liner). Jason Heyward advanced to 3B.
P_Clemens,8037,J Baez,1297,2016-08-24,Javier Baez singled to left (Grounder).
P_Clemens,8037,J Panik,1193,2016-09-12,Joe Panik was hit by a pitch. Brandon Belt advanced to 2B.
P_Clemens,8037,J Baez,1297,2016-06-25,Javier Baez was hit by a pitch. Willson Contreras advanced to 2B.
P_Clemens,8037,H Bailey,8362,2016-07-31,Homer Bailey singled to shortstop (Grounder).
P_Clemens,8037,B Crawford,5343,2016-09-12,Hunter Pence advanced on a wild pitch to 2B.
P_Clemens,8037,J Loney,4556,2016-08-12,James Loney singled to right (Fliner (Liner)).
P_Clemens,8037,Z Cozart,2616,2016-07-31,Zack Cozart singled to left (Grounder).
P_Clemens,8037,P Goldschmidt,9218,2016-08-18,Paul Goldschmidt singled to right (Grounder).
P_Clemens,8037,J Bruce,9892,2016-08-12,Jay Bruce singled to right (Liner). Curtis Granderson scored. Neil Walker advanced to 2B.
P_Clemens,8037,J Lackey,1507,2016-06-25,John Lackey walked.
P_Clemens,8037,J Lamb,1332,2016-08-18,Jake Lamb singled to left (Liner). Paul Goldschmidt advanced to 2B.
P_Clemens,8037,N Markakis,5930,2016-08-31,Nick Markakis walked.
P_Clemens,8037,B Crawford,5343,2016-09-12,Brandon Crawford singled to right (Fliner (Liner)).
P_Clemens,8037,E Inciarte,4922,2016-08-31,Ender Inciarte reached on error to shortstop (Grounder). Error by Luis Sardinas.
P_Clemens,8037,T Story,1256,2016-06-20,Trevor Story walked.
P_Clemens,8037,J Segura,5933,2016-09-20,Jean Segura walked.
P_Clemens,8037,K Bryant,1542,2016-08-24,Kris Bryant singled to second (Grounder).
P_Clemens,8037,W Castillo,3256,2016-08-18,Welington Castillo singled to center (Grounder).
P_Clemens,8037,M Betts,1361,2016-09-06,Mookie Betts singled to right (Fliner (Liner)). Xander Bogaerts advanced to 2B.
P_Clemens,8037,E Suarez,1255,2016-07-31,Eugenio Suarez singled to right (Fliner (Liner)).
P_Clemens,8037,D Pedroia,8370,2016-09-06,Dustin Pedroia singled to right (Grounder).
P_Clemens,8037,C Blackmon,7859,2016-06-20,Charlie Blackmon singled to right (Grounder).
P_Clemens,8037,T Flowers,9134,2016-08-31,Tyler Flowers singled to center (Grounder). Nick Markakis advanced to 2B.
P_Clemens,8037,B Zobrist,7435,2016-08-24,Ben Zobrist singled to left (Fliner (Liner)). Kris Bryant advanced to 2B.
P_Clemens,8037,C Rupp,1114,2016-08-06,Cameron Rupp reached on error to shortstop (Grounder). Maikel Franco scored on error. Error by Alexei Ramirez.
P_Clemens,8037,R Howard,2154,2016-08-06,Ryan Howard homered (Fly).
P_Clemens,8037,D Fowler,4062,2016-08-24,Dexter Fowler doubled to right (Fliner (Liner)).
P_Clemens,8037,J Peterson,1232,2016-08-31,Jace Peterson walked. Nick Markakis advanced to 3B. Tyler Flowers advanced to 2B.
P_Clemens,8037,J Soler,1422,2016-08-24,Jorge Soler doubled to right (Fliner (Fly)).
P_Clemens,8037,D LeMahieu,9874,2016-06-20,DJ LeMahieu singled to third (Bunt Grounder). Charlie Blackmon advanced to 2B.
P_Clemens,8037,E Inciarte,4922,2016-08-31,Ender Inciarte balked to score.
P_Clemens,8037,K Bryant,1542,2016-08-24,Kris Bryant doubled to center (Fliner (Fly)). Dexter Fowler advanced to 3B.
P_Clemens,8037,C Young,3882,2016-09-06,Chris Young homered (Fliner (Liner)).
P_Clemens,8037,C Young,3882,2016-09-06,Chris Young doubled to left (Grounder). Jackie Bradley Jr. advanced to 3B.
P_Clemens,8037,J Donaldson,5038,2016-07-26,Josh Donaldson reached on fielder's choice to second (Grounder). Darwin Barney scored. Devon Travis advanced to 3B. Jose Bautista out at second.
P_Clemens,8037,W Castillo,3256,2016-08-18,Welington Castillo singled to center (Grounder). Paul Goldschmidt scored. Jake Lamb advanced to 3B.
P_Clemens,8037,M Montero,3364,2016-06-25,Miguel Montero homered (Fliner (Fly)).
P_Clemens,8037,N Hundley,3376,2016-06-20,Nick Hundley homered (Fliner (Fly)).
P_Clemens,8037,A Russell,1410,2016-08-24,Addison Russell reached on error to shortstop (Grounder). Kris Bryant scored on error. Ben Zobrist scored on error. Addison Russell advanced to 2B. Error by Luis Sardinas.
P_Clemens,8037,B Zobrist,7435,2016-08-24,Ben Zobrist tripled to center (Fliner (Liner)). Dexter Fowler scored. Kris Bryant scored.
P_Clemens,8037,J Gyorko,1081,2016-07-20,Jedd Gyorko homered (Fly). Greg Garcia scored.
P_Clemens,8037,J Bautista,1887,2016-07-26,Jose Bautista walked. Kevin Pillar scored. Darwin Barney advanced to 3B. Devon Travis advanced to 2B.
P_Clemens,8037,A Russell,1410,2016-06-25,Addison Russell homered (Fliner (Fly)). Willson Contreras scored. Javier Baez scored.
