playername,playerid,vsname,vsid,date,Play
R_Hill,4806,G Polanco,1290,2016-07-02,Gregory Polanco grounded into a double play to first (Grounder). Andrew McCutchen advanced to 3B. Jung Ho Kang out at second.
R_Hill,4806,M Cabrera,1744,2016-05-29,Miguel Cabrera grounded into a double play to second (Grounder). Ian Kinsler advanced to 3B. J.D. Martinez out at second.
R_Hill,4806,F Gutierrez,3255,2016-05-23,Franklin Gutierrez grounded into a double play to shortstop (Grounder). Leonys Martin out at second.
R_Hill,4806,K Kiermaier,1103,2016-05-13,Kevin Kiermaier grounded out to second (Grounder).
R_Hill,4806,C Taylor,1375,2016-05-23,Chris Taylor struck out swinging.
R_Hill,4806,E Kratz,4403,2016-07-02,Erik Kratz flied out to left (Fly).
R_Hill,4806,B Miller,1277,2016-05-13,Brad Miller reached on fielder's choice to catcher (Bunt Grounder). Steven Souza Jr. out at second.
R_Hill,4806,J McCann,1285,2016-05-29,James McCann struck out swinging.
R_Hill,4806,M Gonzalez,5497,2016-07-07,Marwin Gonzalez struck out looking.
R_Hill,4806,E Nunez,6848,2016-09-20,Eduardo Nunez was caught stealing.
R_Hill,4806,J Martinez,6184,2016-04-26,J.D. Martinez grounded into a double play to shortstop (Grounder). Miguel Cabrera out at second.
R_Hill,4806,M Williamson,1415,2016-09-20,Mac Williamson struck out swinging.
R_Hill,4806,R Cano,3269,2016-05-23,Robinson Cano grounded into a double play to second (Grounder). Leonys Martin out at second.
R_Hill,4806,D Lee,1872,2016-05-23,Dae-Ho Lee struck out swinging.
R_Hill,4806,E Hosmer,3516,2016-04-15,Eric Hosmer grounded into a double play to second (Grounder). Omar Infante scored. Lorenzo Cain out at second.
R_Hill,4806,J Iglesias,1023,2016-05-29,Jose Iglesias flied out to second (Fly).
R_Hill,4806,O Infante,1609,2016-04-15,Omar Infante grounded out to pitcher (Grounder).
R_Hill,4806,D Freese,9549,2016-07-02,David Freese grounded out to shortstop (Grounder).
R_Hill,4806,B Crawford,5343,2016-08-24,Brandon Crawford struck out looking.
R_Hill,4806,K Tomlinson,1300,2016-09-30,Kelby Tomlinson struck out swinging.
R_Hill,4806,R Torreyes,1140,2016-04-21,Ronald Torreyes grounded out to third (Grounder).
R_Hill,4806,N Cruz,2434,2016-04-09,Nelson Cruz flied out to right (Fly).
R_Hill,4806,K Seager,9785,2016-04-09,Kyle Seager struck out swinging.
R_Hill,4806,V Martinez,393&,2016-04-26,Victor Martinez flied out to right (Fly).
R_Hill,4806,D Stubbs,9328,2016-05-18,Drew Stubbs struck out swinging.
R_Hill,4806,B Posey,9166,2016-09-30,Buster Posey struck out swinging.
R_Hill,4806,B Posey,9166,2016-08-24,Buster Posey flied out to center (Fly).
R_Hill,4806,K Marte,1361,2016-04-09,Ketel Marte struck out swinging.
R_Hill,4806,C Yelich,1147,2016-09-10,Christian Yelich flied out to left (Fly).
R_Hill,4806,W Myers,1004,2016-09-03,Wil Myers struck out looking.
R_Hill,4806,K Kiermaier,1103,2016-05-13,Kevin Kiermaier flied out to right (Fly).
R_Hill,4806,M Teixeira,1281,2016-04-21,Mark Teixeira struck out looking.
R_Hill,4806,P Janish,7412,2016-05-07,Paul Janish flied out to second (Fly).
R_Hill,4806,J Rollins,971&,2016-04-04,Jimmy Rollins flied out to center (Fliner (Fly)).
R_Hill,4806,F Gutierrez,3255,2016-05-23,Franklin Gutierrez fouled out to first (Fly).
R_Hill,4806,F Gutierrez,3255,2016-05-23,Franklin Gutierrez flied out to right (Fliner (Liner)).
R_Hill,4806,C Colon,1114,2016-04-15,Christian Colon flied out to shortstop (Fly).
R_Hill,4806,Y Solarte,5352,2016-09-03,Yangervis Solarte lined out to second (Liner).
R_Hill,4806,E Gattis,1100,2016-07-07,Evan Gattis struck out swinging.
R_Hill,4806,C Iannetta,8267,2016-04-09,Chris Iannetta struck out swinging.
R_Hill,4806,J Altuve,5417,2016-07-07,Jose Altuve fouled out to first (Fly).
R_Hill,4806,J Mercer,6547,2016-07-02,Jordy Mercer struck out looking.
R_Hill,4806,N Aoki,1307,2016-05-23,Nori Aoki lined out to third (Liner).
R_Hill,4806,R Rua,1240,2016-05-18,Ryan Rua flied out to center (Fly).
R_Hill,4806,S Rodriguez,6589,2016-07-02,Sean Rodriguez struck out looking.
R_Hill,4806,M Wieters,4298,2016-05-07,Matt Wieters reached on fielder's choice to third (Grounder). Mark Trumbo out at second.
R_Hill,4806,R Cano,3269,2016-04-09,Robinson Cano struck out swinging.
R_Hill,4806,A Beltre,639&,2016-05-18,Adrian Beltre fouled out to first (Fly).
R_Hill,4806,I Kinsler,6195,2016-04-26,Ian Kinsler flied out to center (Fly).
R_Hill,4806,E Adrianza,8418,2016-08-24,Ehire Adrianza grounded out to third (Grounder).
R_Hill,4806,J Schoop,1126,2016-05-07,Jonathan Schoop struck out swinging.
R_Hill,4806,D Gordon,8203,2016-09-10,Dee Gordon flied out to center (Fliner (Fly)).
R_Hill,4806,H Pence,8252,2016-09-30,Hunter Pence reached on fielder's choice to shortstop (Grounder). Brandon Belt advanced to 3B. Buster Posey out at second.
R_Hill,4806,D Lee,1872,2016-05-23,Dae-Ho Lee flied out to right (Fly).
R_Hill,4806,A Ramirez,5133,2016-09-03,Alexei Ramirez grounded out to shortstop (Grounder).
R_Hill,4806,N Castellanos,1173,2016-04-26,Nick Castellanos fouled out to right (Fly).
R_Hill,4806,L Cain,9077,2016-04-15,Lorenzo Cain struck out looking.
R_Hill,4806,A Jones,6368,2016-05-07,Adam Jones flied out to right (Fliner (Fly)).
R_Hill,4806,J Iglesias,1023,2016-04-26,Jose Iglesias struck out swinging.
R_Hill,4806,C Gomez,4881,2016-07-07,Carlos Gomez grounded out to third (Grounder).
R_Hill,4806,H Pence,8252,2016-08-24,Hunter Pence reached on fielder's choice to shortstop (Grounder). Buster Posey out at second.
R_Hill,4806,M Moreland,3086,2016-05-18,Mitch Moreland struck out swinging.
R_Hill,4806,E Kratz,4403,2016-07-02,Erik Kratz struck out swinging.
R_Hill,4806,H Pence,8252,2016-08-24,Hunter Pence flied out to right (Fliner (Fly)).
R_Hill,4806,J Iglesias,1023,2016-04-26,Jose Iglesias flied out to right (Fliner (Fly)).
R_Hill,4806,T Jankowski,1376,2016-09-03,Travis Jankowski struck out swinging.
R_Hill,4806,C Rasmus,9893,2016-05-01,Colby Rasmus flied out to left (Fly).
R_Hill,4806,C Casali,1251,2016-05-13,Curt Casali struck out looking.
R_Hill,4806,N Cruz,2434,2016-04-09,Nelson Cruz struck out swinging.
R_Hill,4806,E Gattis,1100,2016-07-07,Evan Gattis grounded out to third (Grounder).
R_Hill,4806,N Castellanos,1173,2016-04-26,Nick Castellanos grounded out to third (Grounder).
R_Hill,4806,G Polanco,1290,2016-07-02,Gregory Polanco grounded out to second (Grounder).
R_Hill,4806,C Yelich,1147,2016-09-10,Christian Yelich struck out swinging.
R_Hill,4806,B Belt,1026,2016-09-20,Brandon Belt singled to left (Fliner (Liner)). Brandon Crawford out at third. Brandon Belt
R_Hill,4806,M Cabrera,4022,2016-04-04,Melky Cabrera grounded out to second (Grounder).
R_Hill,4806,M Haniger,1427,2016-09-15,Mitch Haniger flied out to center (Fly).
R_Hill,4806,D Norris,6867,2016-09-03,Derek Norris grounded out to third (Grounder).
R_Hill,4806,E Hosmer,3516,2016-04-15,Eric Hosmer grounded out to first (Grounder).
R_Hill,4806,G Beckham,9015,2016-09-30,Gordon Beckham grounded out to shortstop (Grounder).
R_Hill,4806,N Aoki,1307,2016-04-09,Nori Aoki was caught stealing.
R_Hill,4806,R Odor,1228,2016-05-18,Rougned Odor grounded out to first (Grounder).
R_Hill,4806,D Gordon,8203,2016-09-10,Dee Gordon flied out to second (Fliner (Fly)).
R_Hill,4806,R Odor,1228,2016-05-18,Rougned Odor grounded out to second (Grounder).
R_Hill,4806,E Nunez,6848,2016-08-24,Eduardo Nunez flied out to right (Fliner (Fly)).
R_Hill,4806,A Beltre,639&,2016-05-18,Adrian Beltre flied out to left (Fly).
R_Hill,4806,A Gordon,5209,2016-04-15,Alex Gordon struck out swinging.
R_Hill,4806,C Taylor,1375,2016-05-23,Chris Taylor struck out swinging.
R_Hill,4806,J Ellsbury,4727,2016-04-21,Jacoby Ellsbury grounded out to second (Grounder).
R_Hill,4806,B Holaday,1128,2016-05-18,Bryan Holaday struck out swinging.
R_Hill,4806,G Springer,1285,2016-05-01,George Springer reached on fielder's choice to third (Grounder). Jason Castro advanced to 3B. Jose Altuve out at second.
R_Hill,4806,G Beckham,9015,2016-09-30,Gordon Beckham grounded out to pitcher (Grounder). Brandon Crawford advanced to 2B.
R_Hill,4806,N Castellanos,1173,2016-05-29,Nick Castellanos flied out to center (Fliner (Fly)).
R_Hill,4806,G Springer,1285,2016-05-01,George Springer flied out to shortstop (Fly).
R_Hill,4806,G Springer,1285,2016-07-07,George Springer struck out swinging.
R_Hill,4806,K Seager,9785,2016-05-23,Kyle Seager grounded out to shortstop (Grounder).
R_Hill,4806,W Myers,1004,2016-09-03,Wil Myers grounded out to first (Grounder).
R_Hill,4806,M Wieters,4298,2016-05-07,Matt Wieters lined out to third (Liner).
R_Hill,4806,I Kinsler,6195,2016-04-26,Ian Kinsler struck out swinging.
R_Hill,4806,S Pearce,9957,2016-05-13,Steve Pearce grounded out to third (Grounder).
R_Hill,4806,A Hechavarria,1045,2016-09-10,Adeiny Hechavarria struck out swinging.
R_Hill,4806,C Headley,4720,2016-04-21,Chase Headley flied out to center (Fly).
R_Hill,4806,N Castellanos,1173,2016-05-29,Nick Castellanos struck out swinging.
R_Hill,4806,A Pagan,2918,2016-08-24,Angel Pagan grounded out to pitcher (Grounder).
R_Hill,4806,J Cueto,6893,2016-09-20,Johnny Cueto grounded out to pitcher (Grounder).
R_Hill,4806,J Saltalamacchia,5557,2016-04-26,Jarrod Saltalamacchia struck out looking.
R_Hill,4806,N Cruz,2434,2016-05-23,Nelson Cruz flied out to center (Fly).
R_Hill,4806,P Orlando,8628,2016-04-15,Paulo Orlando struck out swinging.
R_Hill,4806,J Upton,5222,2016-05-29,Justin Upton flied out to center (Fly).
R_Hill,4806,B Guyer,2636,2016-05-13,Brandon Guyer grounded out to third (Grounder).
R_Hill,4806,J Upton,5222,2016-05-29,Justin Upton reached on fielder's choice to shortstop (Grounder). Victor Martinez out at second.
R_Hill,4806,J Iglesias,1023,2016-05-29,Jose Iglesias flied out to center (Fliner (Fly)).
R_Hill,4806,S Marte,9241,2016-07-02,Starling Marte flied out to right (Fly).
R_Hill,4806,K Seager,9785,2016-04-09,Kyle Seager grounded out to third (Grounder).
R_Hill,4806,J Francoeur,4792,2016-09-10,Jeff Francoeur struck out swinging.
R_Hill,4806,L Martin,1184,2016-04-09,Leonys Martin grounded out to first (Grounder).
R_Hill,4806,B Belt,1026,2016-08-24,Brandon Belt flied out to right (Fly).
R_Hill,4806,M Williamson,1415,2016-09-20,Mac Williamson struck out swinging.
R_Hill,4806,T Beckham,7949,2016-05-13,Tim Beckham struck out swinging.
R_Hill,4806,E Gattis,1100,2016-05-01,Evan Gattis flied out to right (Fly).
R_Hill,4806,X Scruggs,7409,2016-09-10,Xavier Scruggs struck out swinging.
R_Hill,4806,D Norris,6867,2016-09-03,Derek Norris struck out looking.
R_Hill,4806,J Martinez,6184,2016-05-29,J.D. Martinez struck out swinging.
R_Hill,4806,E Hosmer,3516,2016-04-15,Eric Hosmer grounded out to pitcher (Grounder). Lorenzo Cain advanced to 2B.
R_Hill,4806,G Hernandez,4146,2016-09-20,Gorkys Hernandez grounded out to pitcher (Bunt Fly).
R_Hill,4806,L Perdomo,1468,2016-09-03,Luis Perdomo struck out swinging.
R_Hill,4806,A McCutchen,9847,2016-07-02,Andrew McCutchen struck out swinging.
R_Hill,4806,P Tucker,1363,2016-05-01,Preston Tucker grounded out to second (Grounder).
R_Hill,4806,P Fielder,4613,2016-05-18,Prince Fielder grounded out to first (Grounder).
R_Hill,4806,T Jankowski,1376,2016-09-03,Travis Jankowski grounded out to second (Grounder).
R_Hill,4806,M Prado,3312,2016-09-10,Martin Prado flied out to center (Fly).
R_Hill,4806,M Gonzalez,5497,2016-07-07,Marwin Gonzalez struck out swinging.
R_Hill,4806,J Upton,5222,2016-04-26,Justin Upton grounded out to shortstop (Grounder).
R_Hill,4806,W Myers,1004,2016-09-03,Wil Myers fouled out to first (Fly).
R_Hill,4806,T Koehler,6570,2016-09-10,Tom Koehler grounded out to pitcher (Bunt Grounder).
R_Hill,4806,N Reimold,3441,2016-05-07,Nolan Reimold struck out swinging.
R_Hill,4806,C Maybin,5223,2016-05-29,Cameron Maybin lined out to shortstop (Liner).
R_Hill,4806,C Correa,1416,2016-05-01,Carlos Correa struck out looking.
R_Hill,4806,D Freese,9549,2016-07-02,David Freese grounded out to shortstop (Grounder).
R_Hill,4806,L Sardinas,1315,2016-09-03,Luis Sardinas flied out to center (Fly).
R_Hill,4806,A Gose,5097,2016-04-26,Anthony Gose grounded out to second (Grounder).
R_Hill,4806,T White,1556,2016-05-01,Tyler White struck out looking.
R_Hill,4806,J Francoeur,4792,2016-09-10,Jeff Francoeur flied out to second (Fly).
R_Hill,4806,R Cano,3269,2016-05-23,Robinson Cano fouled out to first (Fly).
R_Hill,4806,B Lawrie,5247,2016-04-04,Brett Lawrie grounded out to first (Grounder).
R_Hill,4806,D Jennings,1965,2016-05-13,Desmond Jennings grounded out to shortstop (Grounder).
R_Hill,4806,M Cabrera,1744,2016-04-26,Miguel Cabrera struck out looking.
R_Hill,4806,M Haniger,1427,2016-09-15,Mitch Haniger struck out looking.
R_Hill,4806,C Beltran,589&,2016-04-21,Carlos Beltran out on a dropped third strike.
R_Hill,4806,A Beltre,639&,2016-05-18,Adrian Beltre flied out to second (Fly).
R_Hill,4806,B Posey,9166,2016-09-20,Buster Posey flied out to right (Fly).
R_Hill,4806,K Kiermaier,1103,2016-05-13,Kevin Kiermaier flied out to left (Fliner (Fly)).
R_Hill,4806,R Schimpf,9953,2016-09-03,Ryan Schimpf struck out swinging.
R_Hill,4806,L Martin,1184,2016-05-23,Leonys Martin flied out to first (Fly).
R_Hill,4806,L Sardinas,1315,2016-09-03,Luis Sardinas struck out swinging.
R_Hill,4806,R Rua,1240,2016-05-18,Ryan Rua struck out swinging.
R_Hill,4806,J McCann,1285,2016-05-29,James McCann struck out swinging.
R_Hill,4806,J Martinez,6184,2016-05-29,J.D. Martinez struck out swinging.
R_Hill,4806,N Aoki,1307,2016-05-23,Nori Aoki grounded out to pitcher (Grounder).
R_Hill,4806,R Andino,4900,2016-09-10,Robert Andino struck out swinging.
R_Hill,4806,C Headley,4720,2016-04-21,Chase Headley grounded out to pitcher (Liner). Mark Teixeira advanced to 3B. Alex Rodriguez advanced to 2B.
R_Hill,4806,M Prado,3312,2016-09-10,Martin Prado flied out to left (Fliner (Fly)).
R_Hill,4806,F Gutierrez,3255,2016-05-23,Franklin Gutierrez singled to left (Fliner (Liner)). Chris Taylor advanced to 3B.
R_Hill,4806,D Stubbs,9328,2016-05-18,Drew Stubbs advanced on a stolen base to 2B.
R_Hill,4806,C Taylor,1375,2016-05-23,Chris Taylor singled to center (Fliner (Fly)).
R_Hill,4806,M Gonzalez,5497,2016-05-01,Marwin Gonzalez advanced on a stolen base to 2B.
R_Hill,4806,P Orlando,8628,2016-04-15,Paulo Orlando singled to center (Liner).
R_Hill,4806,D Stubbs,9328,2016-05-18,Drew Stubbs walked.
R_Hill,4806,J Abreu,1567,2016-04-04,Jose Abreu was hit by a pitch.
R_Hill,4806,S Marte,9241,2016-07-02,Starling Marte advanced on a stolen base to 2B.
R_Hill,4806,E Adrianza,8418,2016-08-24,Ehire Adrianza singled to shortstop (Grounder).
R_Hill,4806,D Jennings,1965,2016-05-13,Desmond Jennings walked.
R_Hill,4806,R Cano,3269,2016-05-23,Robinson Cano singled to center (Grounder).
R_Hill,4806,F Gutierrez,3255,2016-04-09,Franklin Gutierrez singled to right (Fliner (Liner)).
R_Hill,4806,A Gose,5097,2016-04-26,Anthony Gose singled to left (Liner).
R_Hill,4806,M Machado,1149,2016-05-07,Manny Machado singled to left (Liner).
R_Hill,4806,E Gattis,1100,2016-05-01,Evan Gattis walked. Carlos Correa advanced to 2B.
R_Hill,4806,V Martinez,393&,2016-05-29,Victor Martinez singled to left (Fliner (Liner)).
R_Hill,4806,O Infante,1609,2016-04-15,Omar Infante doubled to center (Fliner (Fly)).
R_Hill,4806,M Gonzalez,5497,2016-05-01,Marwin Gonzalez was hit by a pitch.
R_Hill,4806,V Martinez,393&,2016-04-26,Victor Martinez singled to center (Grounder). Ian Kinsler advanced to 2B.
R_Hill,4806,H Pence,8252,2016-08-24,Hunter Pence singled to third (Grounder). Buster Posey advanced to 2B.
R_Hill,4806,A Escobar,6310,2016-04-15,Alcides Escobar singled to center (Grounder). Paulo Orlando advanced to 3B.
R_Hill,4806,C Correa,1416,2016-05-01,Carlos Correa walked.
R_Hill,4806,D Lee,1872,2016-04-09,Dae-Ho Lee was hit by a pitch. Franklin Gutierrez advanced to 2B.
R_Hill,4806,I Desmond,6885,2016-05-18,Ian Desmond singled to left (Fliner (Liner)).
R_Hill,4806,C Davis,9272,2016-05-07,Chris Davis was hit by a pitch. Manny Machado advanced to 2B.
R_Hill,4806,C Correa,1416,2016-05-01,Carlos Correa walked. George Springer advanced to 2B.
R_Hill,4806,A Jackson,9848,2016-04-04,Austin Jackson walked.
R_Hill,4806,A Rodriguez,1274,2016-04-21,Alex Rodriguez walked.
R_Hill,4806,B Posey,9166,2016-09-20,Buster Posey singled to right (Fliner (Liner)).
R_Hill,4806,K Marte,1361,2016-04-09,Ketel Marte was hit by a pitch.
R_Hill,4806,B Belt,1026,2016-09-30,Brandon Belt singled to left (Liner).
R_Hill,4806,M Trumbo,6876,2016-05-07,Mark Trumbo walked.
R_Hill,4806,L Cain,9077,2016-04-15,Lorenzo Cain walked.
R_Hill,4806,I Kinsler,6195,2016-05-29,Ian Kinsler walked.
R_Hill,4806,C Correa,1416,2016-07-07,Carlos Correa walked. George Springer advanced to 2B.
R_Hill,4806,A Eaton,1120,2016-04-04,Adam Eaton was hit by a pitch.
R_Hill,4806,A Gordon,5209,2016-04-15,Alex Gordon singled to right (Liner). Kendrys Morales advanced to 2B.
R_Hill,4806,E Nunez,6848,2016-09-20,Eduardo Nunez singled to left (Fliner (Liner)).
R_Hill,4806,M Teixeira,1281,2016-04-21,Mark Teixeira walked.
R_Hill,4806,B Belt,1026,2016-09-30,Brandon Belt walked.
R_Hill,4806,N Aoki,1307,2016-04-09,Nori Aoki singled to shortstop (Grounder).
R_Hill,4806,L Martin,1184,2016-05-23,Leonys Martin singled to right (Grounder).
R_Hill,4806,B Crawford,5343,2016-09-30,Brandon Crawford singled to left (Fliner (Liner)).
R_Hill,4806,N Reimold,3441,2016-05-07,Nolan Reimold reached on error to third (Grounder). Error by Danny Valencia.
R_Hill,4806,J Ellsbury,4727,2016-04-21,Jacoby Ellsbury singled to right (Grounder).
R_Hill,4806,J Altuve,5417,2016-05-01,Jose Altuve walked. Jason Castro advanced to 2B.
R_Hill,4806,A Jackson,9848,2016-04-04,Austin Jackson advanced on error to 3B. Error by Rich Hill.
R_Hill,4806,A Rodriguez,1274,2016-04-21,Alex Rodriguez walked. Mark Teixeira advanced to 2B.
R_Hill,4806,J Rollins,971&,2016-04-04,Jimmy Rollins singled to right (Fliner (Fly)). Adam Eaton scored.
R_Hill,4806,J Mercer,6547,2016-07-02,Jordy Mercer doubled to right (Fly).
R_Hill,4806,G Springer,1285,2016-07-07,George Springer walked.
R_Hill,4806,S Souza Jr.,5667,2016-05-13,Steven Souza Jr. doubled to right (Liner).
R_Hill,4806,B Belt,1026,2016-09-30,Brandon Belt doubled to right (Fliner (Liner)).
R_Hill,4806,J Kang,1718,2016-07-02,Jung Ho Kang was hit by a pitch. Andrew McCutchen advanced to 2B.
R_Hill,4806,K Seager,9785,2016-05-23,Kyle Seager singled to center (Fliner (Fly)). Nelson Cruz advanced to 3B. Dae-Ho Lee advanced to 2B.
R_Hill,4806,K Morales,8610,2016-04-15,Kendrys Morales singled to center (Grounder). Lorenzo Cain scored.
R_Hill,4806,G Springer,1285,2016-07-07,George Springer tripled to center (Fliner (Fly)).
R_Hill,4806,S Marte,9241,2016-07-02,Starling Marte singled to third (Grounder). Andrew McCutchen scored.
R_Hill,4806,S Pearce,9957,2016-05-13,Steve Pearce singled to right (Fliner (Liner)). Desmond Jennings scored. Evan Longoria advanced to 3B.
R_Hill,4806,B Posey,9166,2016-09-30,Buster Posey singled to center (Grounder). Gorkys Hernandez scored. Brandon Belt advanced to 2B.
R_Hill,4806,K Jensen,7706,2016-09-15,Kyle Jensen homered (Fly).
R_Hill,4806,A Eaton,1120,2016-04-04,Adam Eaton tripled to center (Fliner (Fly)). Austin Jackson scored.
R_Hill,4806,A Romine,5491,2016-04-21,Austin Romine singled to pitcher (Grounder). Alex Rodriguez scored. Aaron Hicks advanced to 2B.
R_Hill,4806,M Cabrera,4022,2016-04-04,Melky Cabrera reached on error to shortstop (Grounder). Jimmy Rollins scored on error. Jose Abreu scored on error. Error by Mark Canha.
R_Hill,4806,E Nunez,6848,2016-09-20,Eduardo Nunez homered (Fly).
