playername,playerid,vsname,vsid,date,Play
R_Iglesias,1713,A Frazier,1522,2016-09-09,Adam Frazier flied out to left (Fly).
R_Iglesias,1713,G Garcia,1095,2016-09-28,Greg Garcia flied out to left (Fly).
R_Iglesias,1713,J Rondon,1414,2016-07-30,Jose Rondon struck out swinging.
R_Iglesias,1713,A Diaz,1593,2016-09-28,Aledmys Diaz grounded out to third (Grounder).
R_Iglesias,1713,J Kang,1718,2016-09-09,Jung Ho Kang grounded into a double play to shortstop (Grounder). Gregory Polanco out at second.
R_Iglesias,1713,J Profar,1081,2016-08-23,Jurickson Profar struck out looking.
R_Iglesias,1713,J Segura,5933,2016-08-26,Jean Segura flied out to left (Fly).
R_Iglesias,1713,J Villar,1007,2016-07-15,Jonathan Villar fouled out to third (Fly).
R_Iglesias,1713,M Bourn,6387,2016-08-26,Michael Bourn flied out to center (Fly).
R_Iglesias,1713,E Andrus,8709,2016-08-23,Elvis Andrus reached on fielder's choice to third (Grounder). Mitch Moreland out at third. Nomar Mazara advanced to 2B.
R_Iglesias,1713,J Baez,1297,2016-07-05,Javier Baez flied out to pitcher (Bunt Fly).
R_Iglesias,1713,D Espinosa,9219,2016-07-01,Danny Espinosa struck out swinging.
R_Iglesias,1713,R Zimmerman,4220,2016-07-01,Ryan Zimmerman flied out to center (Fliner (Liner)).
R_Iglesias,1713,K Bryant,1542,2016-07-05,Kris Bryant struck out swinging.
R_Iglesias,1713,J Baez,1297,2016-10-02,Javier Baez struck out swinging.
R_Iglesias,1713,C Owings,1003,2016-08-26,Chris Owings grounded out to pitcher (Grounder).
R_Iglesias,1713,B Zobrist,7435,2016-04-14,Ben Zobrist flied out to right (Fliner (Fly)). Dexter Fowler out at third.
R_Iglesias,1713,G Blanco,3123,2016-07-27,Gregor Blanco grounded out to second (Grounder).
R_Iglesias,1713,J Harrison,8202,2016-08-07,Josh Harrison struck out swinging.
R_Iglesias,1713,M Bourn,6387,2016-08-26,Michael Bourn lined out to first (Liner).
R_Iglesias,1713,S Piscotty,1336,2016-09-02,Stephen Piscotty flied out to left (Fliner (Fly)).
R_Iglesias,1713,S Drew,4251,2016-07-01,Stephen Drew flied out to center (Fly).
R_Iglesias,1713,N Arenado,9777,2016-04-20,Nolan Arenado grounded out to shortstop (Grounder).
R_Iglesias,1713,B Wallace,8434,2016-07-30,Brett Wallace flied out to second (Fly).
R_Iglesias,1713,A Hechavarria,1045,2016-08-18,Adeiny Hechavarria flied out to right (Fly).
R_Iglesias,1713,G Parra,8553,2016-04-20,Gerardo Parra flied out to left (Fly).
R_Iglesias,1713,C Carter,9911,2016-09-25,Chris Carter struck out swinging.
R_Iglesias,1713,J Mercer,6547,2016-08-07,Jordy Mercer reached on fielder's choice to shortstop (Grounder). Matt Joyce scored. Jung Ho Kang out at third. John Jaso advanced to 2B.
R_Iglesias,1713,G Blanco,3123,2016-07-25,Gregor Blanco struck out swinging.
R_Iglesias,1713,Y Molina,7007,2016-09-02,Yadier Molina grounded out to pitcher (Grounder).
R_Iglesias,1713,M Reynolds,7619,2016-04-20,Mark Reynolds struck out swinging.
R_Iglesias,1713,T Jankowski,1376,2016-07-30,Travis Jankowski struck out looking.
R_Iglesias,1713,R Braun,3410,2016-07-15,Ryan Braun grounded out to second (Grounder). Scooter Gennett advanced to 2B.
R_Iglesias,1713,R Howard,2154,2016-04-04,Ryan Howard struck out swinging.
R_Iglesias,1713,B Posey,9166,2016-07-25,Buster Posey flied out to second (Fly).
R_Iglesias,1713,O Herrera,1147,2016-04-04,Odubel Herrera struck out swinging.
R_Iglesias,1713,N Walker,7539,2016-04-25,Neil Walker struck out looking.
R_Iglesias,1713,J Lamb,1332,2016-07-22,Jake Lamb struck out swinging.
R_Iglesias,1713,A McCutchen,9847,2016-04-09,Andrew McCutchen fouled out to third (Fly).
R_Iglesias,1713,D Norris,6867,2016-07-30,Derek Norris grounded out to third (Grounder).
R_Iglesias,1713,T Story,1256,2016-04-20,Trevor Story grounded out to shortstop (Grounder).
R_Iglesias,1713,C Hunter,2833,2016-04-04,Cedric Hunter struck out looking.
R_Iglesias,1713,C Hernandez,1055,2016-04-04,Cesar Hernandez flied out to left (Fliner (Fly)).
R_Iglesias,1713,M Freeman,1124,2016-07-22,Mike Freeman grounded out to pitcher (Grounder).
R_Iglesias,1713,D Freese,9549,2016-04-09,David Freese struck out swinging.
R_Iglesias,1713,D Span,8347,2016-07-25,Denard Span lined out to pitcher (Liner).
R_Iglesias,1713,D Garneau,9433,2016-04-20,Dustin Garneau struck out looking.
R_Iglesias,1713,H Perez,5751,2016-09-25,Hernan Perez struck out swinging.
R_Iglesias,1713,B Paulsen,9741,2016-04-20,Ben Paulsen grounded out to first (Grounder).
R_Iglesias,1713,P Bourjos,2578,2016-04-04,Peter Bourjos struck out looking.
R_Iglesias,1713,O Herrera,1147,2016-04-04,Odubel Herrera reached on fielder's choice to second (Grounder). Jeremy Hellickson out at second.
R_Iglesias,1713,N Syndergaard,1176,2016-04-25,Noah Syndergaard struck out looking.
R_Iglesias,1713,B Crawford,5343,2016-07-25,Brandon Crawford grounded out to second (Grounder).
R_Iglesias,1713,W Castillo,3256,2016-07-22,Welington Castillo flied out to right (Fliner (Fly)).
R_Iglesias,1713,D Freese,9549,2016-04-09,David Freese struck out swinging.
R_Iglesias,1713,A Rosales,9682,2016-07-30,Adam Rosales struck out swinging.
R_Iglesias,1713,M Franco,1217,2016-04-04,Maikel Franco struck out swinging.
R_Iglesias,1713,G Cole,1312,2016-04-09,Gerrit Cole struck out looking.
R_Iglesias,1713,W Myers,1004,2016-07-30,Wil Myers struck out looking.
R_Iglesias,1713,N Arenado,9777,2016-04-20,Nolan Arenado lined out to third (Liner).
R_Iglesias,1713,A Rizzo,3473,2016-04-14,Anthony Rizzo flied out to left (Fly).
R_Iglesias,1713,J Segura,5933,2016-07-22,Jean Segura struck out swinging.
R_Iglesias,1713,C Bettis,1058,2016-04-20,Chad Bettis grounded out to shortstop (Grounder).
R_Iglesias,1713,S Marte,9241,2016-04-09,Starling Marte grounded out to shortstop (Grounder).
R_Iglesias,1713,J Jaso,5887,2016-04-09,John Jaso grounded out to second (Grounder).
R_Iglesias,1713,B Paulsen,9741,2016-04-20,Ben Paulsen flied out to center (Fly).
R_Iglesias,1713,R Rua,1240,2016-06-21,Ryan Rua flied out to center (Fliner (Fly)). Mitch Moreland out at home.
R_Iglesias,1713,A Russell,1410,2016-04-14,Addison Russell grounded out to shortstop (Grounder).
R_Iglesias,1713,J Baez,1297,2016-10-01,Javier Baez flied out to first (Fly).
R_Iglesias,1713,A Ramirez,5133,2016-07-30,Alexei Ramirez struck out looking.
R_Iglesias,1713,C Ruiz,2579,2016-04-04,Carlos Ruiz flied out to left (Fly).
R_Iglesias,1713,C Granderson,4747,2016-09-06,Curtis Granderson flied out to center (Fly).
R_Iglesias,1713,J Heyward,4940,2016-04-14,Jason Heyward grounded out to shortstop (Grounder). Dexter Fowler advanced to 2B.
R_Iglesias,1713,G Parra,8553,2016-04-20,Gerardo Parra flied out to center (Fliner (Fly)).
R_Iglesias,1713,B Zobrist,7435,2016-07-05,Ben Zobrist flied out to center (Fly).
R_Iglesias,1713,M Szczur,1125,2016-06-28,Matt Szczur struck out looking.
R_Iglesias,1713,S Marte,9241,2016-04-09,Starling Marte struck out swinging.
R_Iglesias,1713,D LeMahieu,9874,2016-04-20,DJ LeMahieu struck out looking.
R_Iglesias,1713,D Wright,3787,2016-04-25,David Wright reached on fielder's choice to shortstop (Grounder). Noah Syndergaard out at second.
R_Iglesias,1713,S Choo,3174,2016-06-21,Shin-Soo Choo flied out to center (Fliner (Fly)). Mitch Moreland advanced to 3B.
R_Iglesias,1713,A Rizzo,3473,2016-06-28,Anthony Rizzo flied out to shortstop (Fly).
R_Iglesias,1713,M Ozuna,1032,2016-08-16,Marcell Ozuna flied out to second (Fly).
R_Iglesias,1713,M Bourn,6387,2016-07-22,Michael Bourn flied out to center (Fliner (Liner)).
R_Iglesias,1713,T d'Arnaud,7739,2016-04-25,Travis d'Arnaud grounded out to third (Grounder).
R_Iglesias,1713,M Prado,3312,2016-08-16,Martin Prado grounded out to catcher (Grounder).
R_Iglesias,1713,B Zobrist,7435,2016-06-28,Ben Zobrist struck out swinging.
R_Iglesias,1713,T Jankowski,1376,2016-06-24,Travis Jankowski struck out swinging.
R_Iglesias,1713,A McCutchen,9847,2016-04-09,Andrew McCutchen flied out to right (Fliner (Fly)).
R_Iglesias,1713,D Ross,1551,2016-06-28,David Ross struck out swinging.
R_Iglesias,1713,M Reynolds,7619,2016-04-20,Mark Reynolds struck out looking.
R_Iglesias,1713,T La Stella,1237,2016-10-01,Tommy La Stella flied out to left (Fly).
R_Iglesias,1713,C Gonzalez,7287,2016-04-20,Carlos Gonzalez grounded out to third (Grounder).
R_Iglesias,1713,A Cabrera,4962,2016-04-25,Asdrubal Cabrera struck out swinging.
R_Iglesias,1713,J Heyward,4940,2016-06-28,Jason Heyward flied out to shortstop (Fly).
R_Iglesias,1713,J Peterson,1232,2016-07-18,Jace Peterson grounded out to second (Grounder).
R_Iglesias,1713,W Myers,1004,2016-06-24,Wil Myers struck out looking.
R_Iglesias,1713,J Lester,4930,2016-06-28,Jon Lester struck out swinging.
R_Iglesias,1713,J Francoeur,4792,2016-07-18,Jeff Francoeur grounded out to shortstop (Grounder). Freddie Freeman advanced to 3B. Nick Markakis advanced to 2B.
R_Iglesias,1713,C Carter,9911,2016-09-12,Chris Carter struck out swinging.
R_Iglesias,1713,M Rojas,7802,2016-07-10,Miguel Rojas struck out swinging.
R_Iglesias,1713,K Cowart,1149,2016-08-31,Kaleb Cowart flied out to center (Fly).
R_Iglesias,1713,D Kelly,2216,2016-07-10,Don Kelly grounded out to third (Grounder).
R_Iglesias,1713,A Hechavarria,1045,2016-07-10,Adeiny Hechavarria flied out to second (Fly).
R_Iglesias,1713,S Piscotty,1336,2016-08-09,Stephen Piscotty out on a dropped third strike.
R_Iglesias,1713,M Maldonado,6887,2016-09-12,Martin Maldonado grounded out to pitcher (Grounder).
R_Iglesias,1713,M Joyce,3353,2016-09-09,Matt Joyce was intentionally walked.
R_Iglesias,1713,S Piscotty,1336,2016-08-04,Stephen Piscotty struck out swinging.
R_Iglesias,1713,N Mazara,1455,2016-06-21,Nomar Mazara flied out to left (Fly).
R_Iglesias,1713,K Wong,1253,2016-08-04,Kolten Wong lined out to shortstop (Liner).
R_Iglesias,1713,J Peralta,1738,2016-08-04,Jhonny Peralta reached on fielder's choice to shortstop (Grounder). Brandon Moss out at second.
R_Iglesias,1713,M Holliday,1873,2016-08-04,Matt Holliday grounded out to shortstop (Grounder).
R_Iglesias,1713,G Stanton,4949,2016-07-10,Giancarlo Stanton struck out looking.
R_Iglesias,1713,R Odor,1228,2016-06-21,Rougned Odor flied out to left (Fly).
R_Iglesias,1713,J Profar,1081,2016-06-21,Jurickson Profar grounded out to second (Grounder).
R_Iglesias,1713,B Moss,4467,2016-08-04,Brandon Moss singled to left (Fliner (Liner)).
R_Iglesias,1713,T Pham,2967,2016-08-04,Tommy Pham singled to right (Grounder). Alberto Rosario advanced to 3B.
R_Iglesias,1713,A Simmons,1084,2016-08-31,Andrelton Simmons walked.
R_Iglesias,1713,M Ozuna,1032,2016-07-10,Marcell Ozuna walked.
R_Iglesias,1713,A Cabrera,4962,2016-04-25,Asdrubal Cabrera walked.
R_Iglesias,1713,K Bryant,1542,2016-06-28,Kris Bryant walked.
R_Iglesias,1713,P Florimon,8385,2016-09-18,Pedro Florimon singled to left (Grounder).
R_Iglesias,1713,N Buss,6835,2016-08-31,Nick Buss doubled to right (Liner).
R_Iglesias,1713,B Zobrist,7435,2016-04-14,Ben Zobrist hit a sacrifice fly to center (Fliner (Fly)). Jason Hammel scored. Dexter Fowler advanced to 3B.
R_Iglesias,1713,D Fowler,4062,2016-04-14,Dexter Fowler walked.
R_Iglesias,1713,R Chirinos,3142,2016-06-21,Robinson Chirinos walked. Mitch Moreland advanced to 2B.
R_Iglesias,1713,A Rendon,1286,2016-07-01,Anthony Rendon walked.
R_Iglesias,1713,G Polanco,1290,2016-04-09,Gregory Polanco walked. Francisco Cervelli advanced to 2B.
R_Iglesias,1713,N Walker,7539,2016-04-25,Neil Walker singled to center (Grounder). Lucas Duda advanced to 3B.
R_Iglesias,1713,J Mercer,6547,2016-09-09,Jordy Mercer sacrificed to pitcher (Bunt Grounder). Alen Hanson advanced to 3B. Francisco Cervelli advanced to 2B.
R_Iglesias,1713,J Jaso,5887,2016-09-18,John Jaso doubled to center (Liner). Pedro Florimon scored.
R_Iglesias,1713,B Drury,1161,2016-08-26,Brandon Drury singled to right (Fliner (Fly)).
R_Iglesias,1713,A De Aza,3371,2016-04-25,Alejandro De Aza singled to right (Grounder).
R_Iglesias,1713,D Fowler,4062,2016-04-14,Dexter Fowler singled to pitcher (Bunt Grounder). Jason Hammel advanced to 2B.
R_Iglesias,1713,R Raburn,2218,2016-04-20,Ryan Raburn singled to right (Liner). Dustin Garneau advanced to 3B.
R_Iglesias,1713,A Russell,1410,2016-04-14,Addison Russell singled to center (Liner).
R_Iglesias,1713,J Kang,1718,2016-08-07,Jung Ho Kang walked. Matt Joyce advanced to 2B.
R_Iglesias,1713,C Hernandez,1055,2016-04-04,Cesar Hernandez singled to left (Liner).
R_Iglesias,1713,J Heyward,4940,2016-07-05,Jason Heyward walked. Anthony Rizzo advanced to 2B.
R_Iglesias,1713,D LeMahieu,9874,2016-04-20,DJ LeMahieu singled to center (Grounder).
R_Iglesias,1713,M Conforto,1637,2016-04-25,Michael Conforto hit a ground rule double (Fly).
R_Iglesias,1713,M Conforto,1637,2016-04-25,Michael Conforto singled to left (Fliner (Liner)).
R_Iglesias,1713,J Realmuto,1173,2016-08-16,J.T. Realmuto walked.
R_Iglesias,1713,A Almora Jr.,1410,2016-10-02,Albert Almora walked.
R_Iglesias,1713,G Polanco,1290,2016-04-09,Gregory Polanco singled to left (Fliner (Fly)). Francisco Cervelli advanced to 2B.
R_Iglesias,1713,A Amarista,9063,2016-07-30,Alexi Amarista singled to center (Grounder).
R_Iglesias,1713,A McCutchen,9847,2016-09-16,Andrew McCutchen singled to right (Fliner (Liner)).
R_Iglesias,1713,M Kawasaki,1304,2016-10-02,Munenori Kawasaki singled to center (Fliner (Liner)). Albert Almora advanced to 2B.
R_Iglesias,1713,D Ross,1551,2016-07-05,David Ross singled to third (Bunt Grounder).
R_Iglesias,1713,S Gennett,1033,2016-07-15,Scooter Gennett singled to left (Liner).
R_Iglesias,1713,R Flores,1116,2016-07-15,Ramon Flores walked. Will Middlebrooks advanced to 2B.
R_Iglesias,1713,P Goldschmidt,9218,2016-08-26,Paul Goldschmidt singled to left (Grounder). A.J. Pollock advanced to 2B.
R_Iglesias,1713,D Murphy,4316,2016-07-01,Daniel Murphy doubled to left (Grounder).
R_Iglesias,1713,Y Molina,7007,2016-09-28,Yadier Molina was hit by a pitch. Matt Carpenter advanced to 2B.
R_Iglesias,1713,N Mazara,1455,2016-08-23,Elvis Andrus advanced on a wild pitch to 2B.
R_Iglesias,1713,J Harrison,8202,2016-09-09,Josh Harrison singled to left (Grounder).
R_Iglesias,1713,N Mazara,1455,2016-08-23,Nomar Mazara singled to left (Fliner (Liner)). Mitch Moreland advanced to 2B.
R_Iglesias,1713,G Parra,8553,2016-04-20,Gerardo Parra singled to center (Liner). Carlos Gonzalez scored. Nolan Arenado advanced to 2B.
R_Iglesias,1713,M Conforto,1637,2016-04-25,Michael Conforto homered (Fly).
R_Iglesias,1713,A Rosales,9682,2016-06-24,Adam Rosales homered (Fliner (Fly)).
R_Iglesias,1713,P Gosselin,1095,2016-08-26,Phil Gosselin walked.
R_Iglesias,1713,M Carpenter,8090,2016-09-28,Yadier Molina advanced on a wild pitch to 2B.
R_Iglesias,1713,F Cervelli,5275,2016-09-09,Francisco Cervelli was hit by a pitch. Alen Hanson advanced to 2B.
R_Iglesias,1713,F Galvis,6609,2016-04-04,Freddy Galvis homered (Fly). Carlos Ruiz scored.
R_Iglesias,1713,A Pollock,9256,2016-08-26,A.J. Pollock reached on fielder's choice to second (Grounder). Phil Gosselin scored.
R_Iglesias,1713,K Wong,1253,2016-09-28,Kolten Wong tripled to right (Fliner (Fly)).
