playername,playerid,vsname,vsid,date,Play
T_Cahill,6249,J Locke,2929,2016-08-29,Jeff Locke singled to second (Grounder). Josh Harrison out at second.
T_Cahill,6249,R Zimmerman,4220,2016-06-15,Ryan Zimmerman struck out swinging.
T_Cahill,6249,S Rodriguez,6589,2016-08-29,Sean Rodriguez flied out to center (Fliner (Fly)).
T_Cahill,6249,M Lorenzen,1484,2016-06-27,Michael Lorenzen out on a dropped third strike.
T_Cahill,6249,D Span,8347,2016-09-04,Denard Span grounded out to first (Grounder).
T_Cahill,6249,R Cabrera,1032,2016-06-28,Ramon Cabrera flied out to center (Fly).
T_Cahill,6249,D Santana,1034,2016-09-07,Domingo Santana struck out swinging.
T_Cahill,6249,R Zimmerman,4220,2016-05-08,Ryan Zimmerman grounded out to first (Grounder).
T_Cahill,6249,T Barnhart,1020,2016-06-28,Tucker Barnhart struck out swinging.
T_Cahill,6249,C Utley,1679,2016-08-28,Chase Utley struck out swinging.
T_Cahill,6249,B Hamilton,1019,2016-07-06,Billy Hamilton struck out looking.
T_Cahill,6249,B Hamilton,1019,2016-06-28,Billy Hamilton grounded out to shortstop (Grounder).
T_Cahill,6249,A Rendon,1286,2016-05-08,Anthony Rendon flied out to left (Fly).
T_Cahill,6249,T Joseph,1034,2016-05-27,Tommy Joseph struck out swinging.
T_Cahill,6249,G Stanton,4949,2016-06-24,Giancarlo Stanton flied out to center (Fly).
T_Cahill,6249,R Zimmerman,4220,2016-05-08,Ryan Zimmerman flied out to right (Fliner (Liner)).
T_Cahill,6249,M Pina,2829,2016-08-16,Manny Pina struck out swinging.
T_Cahill,6249,J Lamb,1332,2016-04-08,Jake Lamb grounded out to second (Grounder). Chris Owings advanced to 2B.
T_Cahill,6249,D LeMahieu,9874,2016-08-20,DJ LeMahieu grounded out to shortstop (Grounder). Chris Rusin scored.
T_Cahill,6249,J Villar,1007,2016-08-16,Jonathan Villar struck out swinging.
T_Cahill,6249,J Mercer,6547,2016-09-27,Jordy Mercer flied out to center (Fliner (Liner)).
T_Cahill,6249,M Bourn,6387,2016-06-05,Michael Bourn struck out looking.
T_Cahill,6249,E Nunez,6848,2016-09-03,Eduardo Nunez struck out swinging.
T_Cahill,6249,B Finnegan,1620,2016-04-11,Brandon Finnegan reached on fielder's choice to catcher (Bunt Grounder). Adam Duvall out at third.
T_Cahill,6249,S Drew,4251,2016-05-08,Stephen Drew struck out swinging.
T_Cahill,6249,J Bour,9744,2016-06-24,Justin Bour flied out to right (Fliner (Liner)).
T_Cahill,6249,J Pirela,5485,2016-05-10,Jose Pirela struck out looking.
T_Cahill,6249,B Hamilton,1019,2016-07-06,Billy Hamilton struck out swinging.
T_Cahill,6249,J Lucroy,7870,2016-05-19,Jonathan Lucroy struck out swinging.
T_Cahill,6249,J Votto,4314,2016-09-30,Joey Votto grounded out to first (Grounder).
T_Cahill,6249,J Rogers,1177,2016-05-03,Jason Rogers struck out swinging.
T_Cahill,6249,P Gosselin,1095,2016-06-05,Phil Gosselin struck out swinging.
T_Cahill,6249,T Holt,1139,2016-07-06,Tyler Holt out on a dropped third strike.
T_Cahill,6249,M Reed,1322,2016-09-17,Michael Reed struck out swinging.
T_Cahill,6249,J Pederson,1189,2016-08-27,Joc Pederson lined out to shortstop (Liner).
T_Cahill,6249,H Perez,5751,2016-08-16,Hernan Perez grounded out to shortstop (Grounder).
T_Cahill,6249,D Descalso,8392,2016-08-20,Daniel Descalso grounded out to second (Grounder).
T_Cahill,6249,L Sardinas,1315,2016-08-24,Luis Sardinas grounded out to pitcher (Grounder).
T_Cahill,6249,J Werth,1327,2016-05-08,Jayson Werth struck out swinging.
T_Cahill,6249,T Story,1256,2016-04-15,Trevor Story grounded out to third (Grounder).
T_Cahill,6249,P Bourjos,2578,2016-06-07,Peter Bourjos grounded out to third (Grounder).
T_Cahill,6249,W Myers,1004,2016-08-24,Wil Myers struck out looking.
T_Cahill,6249,R Cabrera,1032,2016-09-20,Ramon Cabrera grounded into a double play to shortstop (Grounder). Tyler Holt out at second.
T_Cahill,6249,D Span,8347,2016-09-03,Denard Span grounded out to second (Grounder).
T_Cahill,6249,F Cervelli,5275,2016-05-13,Francisco Cervelli flied out to right (Fly).
T_Cahill,6249,Y Tomas,1717,2016-06-05,Yasmany Tomas grounded out to catcher (Grounder).
T_Cahill,6249,A Cabrera,4962,2016-06-30,Asdrubal Cabrera flied out to center (Fliner (Fly)).
T_Cahill,6249,C Carter,9911,2016-04-28,Chris Carter grounded into a double play to second (Grounder). Jonathan Lucroy out at second.
T_Cahill,6249,B Hamilton,1019,2016-04-11,Billy Hamilton struck out swinging.
T_Cahill,6249,B Posey,9166,2016-05-21,Buster Posey struck out swinging.
T_Cahill,6249,G Springer,1285,2016-09-11,George Springer grounded into a double play to shortstop (Grounder). Jake Marisnick out at second.
T_Cahill,6249,A Rendon,1286,2016-05-08,Anthony Rendon grounded out to third (Grounder). Ben Revere advanced to 2B.
T_Cahill,6249,K Nieuwenhuis,6400,2016-05-19,Kirk Nieuwenhuis flied out to left (Fliner (Fly)). Scooter Gennett advanced to 2B.
T_Cahill,6249,D LeMahieu,9874,2016-04-15,DJ LeMahieu struck out swinging.
T_Cahill,6249,G Parra,8553,2016-08-20,Gerardo Parra flied out to left (Fliner (Fly)).
T_Cahill,6249,F Cervelli,5275,2016-09-27,Francisco Cervelli struck out swinging.
T_Cahill,6249,C Culberson,3298,2016-08-27,Charlie Culberson struck out looking.
T_Cahill,6249,M Reed,1322,2016-09-18,Michael Reed reached on fielder's choice to third (Grounder). Martin Maldonado out at second.
T_Cahill,6249,D Dahl,1374,2016-08-20,David Dahl flied out to center (Fliner (Liner)).
T_Cahill,6249,D Santana,1034,2016-09-18,Domingo Santana struck out swinging.
T_Cahill,6249,J Jaso,5887,2016-05-03,John Jaso grounded out to catcher (Grounder). Sean Rodriguez scored. Chris Stewart advanced to 2B.
T_Cahill,6249,C Perez,1064,2016-04-05,Carlos Perez struck out swinging.
T_Cahill,6249,N Hundley,3376,2016-08-20,Nick Hundley grounded out to second (Grounder).
T_Cahill,6249,J Villar,1007,2016-04-28,Jonathan Villar struck out swinging.
T_Cahill,6249,J Harrison,8202,2016-05-13,Josh Harrison grounded out to third (Grounder).
T_Cahill,6249,M Gonzalez,5497,2016-09-11,Marwin Gonzalez grounded out to pitcher (Bunt Grounder).
T_Cahill,6249,M Holliday,1873,2016-04-20,Matt Holliday reached on fielder's choice to shortstop (Grounder). Stephen Piscotty out at second.
T_Cahill,6249,C Adames,6013,2016-08-20,Cristhian Adames grounded out to first (Grounder).
T_Cahill,6249,J Mercer,6547,2016-06-17,Jordy Mercer grounded out to shortstop (Grounder).
T_Cahill,6249,M Smith,1360,2016-06-11,Mallex Smith grounded out to first (Grounder). Jace Peterson advanced to 3B. Daniel Castro advanced to 2B.
T_Cahill,6249,M Duffy,1383,2016-05-21,Matt Duffy flied out to second (Fly).
T_Cahill,6249,E Fryer,8145,2016-07-08,Eric Fryer lined out to third (Liner).
T_Cahill,6249,J Panik,1193,2016-05-21,Joe Panik grounded out to first (Grounder). Denard Span advanced to 2B.
T_Cahill,6249,M Carpenter,8090,2016-04-20,Matt Carpenter flied out to center (Fliner (Fly)).
T_Cahill,6249,S Rodriguez,6589,2016-06-17,Sean Rodriguez grounded out to shortstop (Grounder).
T_Cahill,6249,S Marte,9241,2016-07-08,Starling Marte reached on fielder's choice to third (Grounder). David Freese out at second.
T_Cahill,6249,A Hill,6104,2016-05-17,Aaron Hill flied out to right (Fly).
T_Cahill,6249,A Frazier,1522,2016-07-08,Adam Frazier grounded out to second (Grounder).
T_Cahill,6249,B Crawford,5343,2016-05-21,Brandon Crawford flied out to center (Fliner (Liner)).
T_Cahill,6249,A Pierzynski,746&,2016-06-11,A.J. Pierzynski flied out to left (Fly).
T_Cahill,6249,S Marte,9241,2016-05-03,Starling Marte grounded out to pitcher (Grounder). Matt Joyce advanced to 2B.
T_Cahill,6249,B Hamilton,1019,2016-04-13,Billy Hamilton lined out to first (Liner).
T_Cahill,6249,D Freese,9549,2016-05-03,David Freese grounded out to third (Grounder).
T_Cahill,6249,M Adams,9393,2016-04-18,Matt Adams flied out to center (Fliner (Fly)).
T_Cahill,6249,N Hundley,3376,2016-08-20,Nick Hundley struck out swinging.
T_Cahill,6249,E Inciarte,4922,2016-06-11,Ender Inciarte grounded out to first (Grounder).
T_Cahill,6249,R Braun,3410,2016-05-17,Ryan Braun struck out swinging.
T_Cahill,6249,A Reed,1624,2016-09-11,A.J. Reed grounded out to third (Grounder).
T_Cahill,6249,J Jaso,5887,2016-05-13,John Jaso grounded out to third (Grounder).
T_Cahill,6249,A Gonzalez,1908,2016-05-31,Adrian Gonzalez grounded out to pitcher (Grounder).
T_Cahill,6249,G Parra,8553,2016-08-20,Gerardo Parra struck out swinging.
T_Cahill,6249,S Marte,9241,2016-05-13,Starling Marte advanced on a stolen base to 2B.
T_Cahill,6249,N Walker,7539,2016-07-01,Neil Walker struck out swinging.
T_Cahill,6249,E Fryer,8145,2016-05-24,Eric Fryer struck out looking.
T_Cahill,6249,A Cabrera,4962,2016-07-01,Asdrubal Cabrera struck out swinging.
T_Cahill,6249,Y Cespedes,1311,2016-07-01,Yoenis Cespedes grounded out to catcher (Grounder). Brandon Nimmo advanced to 2B.
T_Cahill,6249,Y Cespedes,1311,2016-07-01,Yoenis Cespedes singled to center (Grounder). Neil Walker advanced to 2B.
T_Cahill,6249,S Rodriguez,6589,2016-05-13,Sean Rodriguez advanced on defensive indifference to 2B.
T_Cahill,6249,A De Aza,3371,2016-07-01,Alejandro De Aza walked.
T_Cahill,6249,B Nimmo,1292,2016-07-01,Brandon Nimmo singled to center (Liner).
T_Cahill,6249,D Freese,9549,2016-07-08,David Freese walked.
T_Cahill,6249,G Polanco,1290,2016-05-13,Gregory Polanco walked.
T_Cahill,6249,R Raburn,2218,2016-08-20,Ryan Raburn walked.
T_Cahill,6249,K Nieuwenhuis,6400,2016-04-28,Kirk Nieuwenhuis reached on error to pitcher (Grounder). Error by Trevor Cahill.
T_Cahill,6249,M Joyce,3353,2016-05-03,Matt Joyce walked.
T_Cahill,6249,J Peterson,1232,2016-06-11,Jace Peterson singled to right (Liner).
T_Cahill,6249,C Gonzalez,7287,2016-04-15,Carlos Gonzalez was intentionally walked.
T_Cahill,6249,K Hernandez,1047,2016-05-31,Kiké Hernandez advanced on defensive indifference to 2B.
T_Cahill,6249,A McCutchen,9847,2016-07-08,Andrew McCutchen was hit by a pitch. Matt Joyce advanced to 3B. Jordy Mercer advanced to 2B.
T_Cahill,6249,C Walsh,1096,2016-04-28,Colin Walsh walked. Kirk Nieuwenhuis advanced to 2B.
T_Cahill,6249,S Piscotty,1336,2016-04-20,Stephen Piscotty singled to right (Grounder).
T_Cahill,6249,J Jaso,5887,2016-06-17,John Jaso was hit by a pitch.
T_Cahill,6249,H Perez,5751,2016-05-19,Hernan Perez advanced on a stolen base to 2B.
T_Cahill,6249,H Perez,5751,2016-05-19,Ramon Flores advanced on double steal to 2B.
T_Cahill,6249,G Parra,8553,2016-08-20,Gerardo Parra singled to center (Liner).
T_Cahill,6249,A Dickerson,1264,2016-08-24,Alex Dickerson walked.
T_Cahill,6249,D Span,8347,2016-05-21,Denard Span singled to center (Fliner (Liner)).
T_Cahill,6249,S Rodriguez,6589,2016-05-03,Sean Rodriguez singled to left (Liner).
T_Cahill,6249,T Holt,1139,2016-09-20,Tyler Holt walked.
T_Cahill,6249,B Barnes,629&,2016-04-15,Brandon Barnes advanced on a passed ball to 3B. Passed ball by Miguel Montero.
T_Cahill,6249,B Drury,1161,2016-06-05,Brandon Drury walked.
T_Cahill,6249,E Gattis,1100,2016-09-11,Evan Gattis homered (Fly).
T_Cahill,6249,B Harper,1157,2016-05-08,Bryce Harper was hit by a pitch.
T_Cahill,6249,A Diaz,1593,2016-09-24,Aledmys Diaz walked.
T_Cahill,6249,M Joyce,3353,2016-07-08,Andrew McCutchen advanced on a wild pitch to 2B. Matt Joyce scored. Jordy Mercer advanced to 3B.
T_Cahill,6249,K Nieuwenhuis,6400,2016-08-16,Kirk Nieuwenhuis singled to right (Liner).
T_Cahill,6249,Z Cozart,2616,2016-07-06,Zack Cozart singled to center (Grounder).
T_Cahill,6249,M Garza,3340,2016-08-16,Matt Garza walked.
T_Cahill,6249,S Marte,9241,2016-05-13,Starling Marte singled to second (Grounder). Gregory Polanco advanced to 3B.
T_Cahill,6249,J Votto,4314,2016-07-06,Joey Votto walked.
T_Cahill,6249,C Rusin,9895,2016-08-20,Chris Rusin singled to center (Liner).
T_Cahill,6249,C Stewart,3878,2016-05-03,Chris Stewart reached on fielder's choice and error to shortstop (Grounder). Sean Rodriguez advanced to 3B on error. Error by Addison Russell.
T_Cahill,6249,C Hernandez,1055,2016-05-27,Cesar Hernandez singled to center (Fliner (Liner)).
T_Cahill,6249,B Harper,1157,2016-05-08,Bryce Harper walked.
T_Cahill,6249,A Rosales,9682,2016-05-10,Adam Rosales walked.
T_Cahill,6249,B Hamilton,1019,2016-06-27,Billy Hamilton singled to second (Grounder). Tucker Barnhart advanced to 3B.
T_Cahill,6249,J Peraza,1359,2016-09-30,Jose Peraza advanced on a wild pitch to 3B.
T_Cahill,6249,J Villar,1007,2016-08-16,Jonathan Villar singled to center (Grounder).
T_Cahill,6249,J Peraza,1359,2016-07-06,Jose Peraza advanced on a stolen base to 2B.
T_Cahill,6249,D Dahl,1374,2016-08-20,David Dahl singled to right (Grounder). Chris Rusin advanced to 3B.
T_Cahill,6249,J Peraza,1359,2016-06-27,Jose Peraza walked.
T_Cahill,6249,O Arcia,1318,2016-09-07,Orlando Arcia walked. Chris Carter advanced to 2B.
T_Cahill,6249,J Harrison,8202,2016-08-31,Josh Harrison singled to left (Grounder). Jordy Mercer advanced to 3B. Matt Joyce advanced to 2B.
T_Cahill,6249,C Carter,9911,2016-09-07,Chris Carter walked.
T_Cahill,6249,J Peraza,1359,2016-09-30,Jose Peraza doubled to left (Fliner (Liner)).
T_Cahill,6249,D Espinosa,9219,2016-06-15,Danny Espinosa advanced on a stolen base to 2B.
T_Cahill,6249,Z Cozart,2616,2016-06-28,Zack Cozart singled to left (Fliner (Liner)). Ivan De Jesus advanced to 2B.
T_Cahill,6249,A Hechavarria,1045,2016-06-24,Adeiny Hechavarria singled to second (Liner).
T_Cahill,6249,D Espinosa,9219,2016-06-15,Danny Espinosa was hit by a pitch.
T_Cahill,6249,A Duvall,1095,2016-04-23,Adam Duvall homered (Fliner (Fly)). Jay Bruce scored. Devin Mesoraco scored.
T_Cahill,6249,M Taylor,1148,2016-06-15,Michael Taylor singled to center (Liner). Danny Espinosa scored.
T_Cahill,6249,Y Tomas,1717,2016-04-08,Yasmany Tomas singled to left (Fliner (Liner)). Chris Owings scored.
