playername,playerid,vsname,vsid,date,Play
T_Chatwood,4338,K Maeda,1849,2016-08-04,Kenta Maeda grounded into a double play to shortstop (Grounder). Joc Pederson out at second.
T_Chatwood,4338,Y Tomas,1717,2016-04-29,Yasmany Tomas grounded into a double play to second (Grounder). Paul Goldschmidt advanced to 3B. David Peralta out at second.
T_Chatwood,4338,B Posey,9166,2016-09-28,Buster Posey grounded into a double play to third (Grounder). Brandon Belt out at second.
T_Chatwood,4338,M Duffy,1383,2016-05-27,Matt Duffy grounded into a double play to pitcher (Grounder). Joe Panik out at second.
T_Chatwood,4338,M Joyce,3353,2016-05-21,Matt Joyce reached on fielder's choice to second (Grounder). Jung Ho Kang out at home.
T_Chatwood,4338,A Ramirez,5133,2016-05-04,Alexei Ramirez grounded out to shortstop (Grounder).
T_Chatwood,4338,N Walker,7539,2016-07-29,Neil Walker grounded into a double play to second (Grounder). James Loney out at second.
T_Chatwood,4338,J deGrom,1095,2016-05-15,Jacob deGrom grounded into a double play to first (Grounder). Eric Campbell out at second.
T_Chatwood,4338,C Bethancourt,1002,2016-05-04,Christian Bethancourt grounded into a double play to third (Grounder). Alexei Ramirez out at second.
T_Chatwood,4338,D Fowler,4062,2016-04-17,Dexter Fowler flied out to left (Fly).
T_Chatwood,4338,C Owings,1003,2016-05-09,Chris Owings grounded out to shortstop (Grounder).
T_Chatwood,4338,J Reddick,3892,2016-09-22,Josh Reddick flied out to center (Fliner (Fly)).
T_Chatwood,4338,O Herrera,1147,2016-08-14,Odubel Herrera struck out looking.
T_Chatwood,4338,T Jankowski,1376,2016-09-09,Travis Jankowski struck out looking.
T_Chatwood,4338,F Galvis,6609,2016-08-14,Freddy Galvis flied out to left (Fly).
T_Chatwood,4338,Y Grandal,1136,2016-08-04,Yasmani Grandal struck out swinging.
T_Chatwood,4338,K Maeda,1849,2016-08-04,Kenta Maeda flied out to right (Fliner (Fly)).
T_Chatwood,4338,J Heyward,4940,2016-04-17,Jason Heyward struck out swinging.
T_Chatwood,4338,C Bethancourt,1002,2016-05-04,Christian Bethancourt fouled out to third.
T_Chatwood,4338,B Zobrist,7435,2016-04-17,Ben Zobrist flied out to center (Fly).
T_Chatwood,4338,A Amarista,9063,2016-06-11,Alexi Amarista grounded into a double play to second (Grounder). Derek Norris out at second.
T_Chatwood,4338,W Myers,1004,2016-09-16,Wil Myers struck out swinging.
T_Chatwood,4338,T Thompson,9952,2016-06-06,Trayce Thompson grounded into a double play to third (Grounder). Corey Seager out at second.
T_Chatwood,4338,A Duvall,1095,2016-06-01,Adam Duvall grounded into a double play to shortstop (Grounder). Joey Votto out at second.
T_Chatwood,4338,T Goeddel,1318,2016-07-10,Tyler Goeddel grounded out to first (Grounder).
T_Chatwood,4338,C Gillaspie,9009,2016-07-05,Conor Gillaspie grounded out to second (Grounder).
T_Chatwood,4338,B Belt,1026,2016-07-05,Brandon Belt struck out swinging.
T_Chatwood,4338,J Pederson,1189,2016-04-23,Joc Pederson lined out to second (Liner).
T_Chatwood,4338,C Dickerson,1076,2016-07-19,Corey Dickerson grounded into a double play to first (Grounder). Evan Longoria out at second.
T_Chatwood,4338,C Seager,1362,2016-09-22,Corey Seager grounded into a double play to shortstop (Grounder). Chase Utley out at second.
T_Chatwood,4338,W Myers,1004,2016-05-04,Wil Myers flied out to left (Fly).
T_Chatwood,4338,A Amarista,9063,2016-06-11,Alexi Amarista reached on fielder's choice to shortstop (Grounder). Derek Norris out at second.
T_Chatwood,4338,C Granderson,4747,2016-07-29,Curtis Granderson flied out to center (Fliner (Liner)).
T_Chatwood,4338,A Ramirez,5133,2016-06-11,Alexei Ramirez grounded out to pitcher (Grounder).
T_Chatwood,4338,A Suarez,6175,2016-05-27,Albert Suarez grounded out to third (Grounder).
T_Chatwood,4338,R Chirinos,3142,2016-08-09,Robinson Chirinos flied out to right (Fliner (Liner)).
T_Chatwood,4338,S Marte,9241,2016-05-21,Starling Marte struck out swinging.
T_Chatwood,4338,C Owings,1003,2016-04-06,Chris Owings flied out to center (Fly).
T_Chatwood,4338,J Weeks,2498,2016-05-04,Jemile Weeks struck out looking.
T_Chatwood,4338,J Francoeur,4792,2016-07-24,Jeff Francoeur grounded out to third (Grounder).
T_Chatwood,4338,T Goeddel,1318,2016-07-10,Tyler Goeddel grounded out to shortstop (Grounder).
T_Chatwood,4338,D Peralta,2136,2016-04-06,David Peralta grounded out to shortstop (Grounder).
T_Chatwood,4338,D Span,8347,2016-05-27,Denard Span grounded out to third (Grounder).
T_Chatwood,4338,M Upton Jr.,5015,2016-06-11,Melvin Upton Jr. grounded out to shortstop (Grounder).
T_Chatwood,4338,J Panik,1193,2016-04-12,Joe Panik flied out to left (Fliner (Fly)).
T_Chatwood,4338,J Jay,5227,2016-09-16,Jon Jay reached on fielder's choice to pitcher (Grounder). Travis Jankowski out at third. Jon Jay advanced to 2B.
T_Chatwood,4338,Y Cespedes,1311,2016-07-29,Yoenis Cespedes grounded out to third (Grounder).
T_Chatwood,4338,C Gillaspie,9009,2016-09-28,Conor Gillaspie struck out swinging.
T_Chatwood,4338,P Gosselin,1095,2016-04-29,Phil Gosselin lined out to shortstop (Liner). Chris Owings out at third.
T_Chatwood,4338,A Griffin,1113,2016-08-09,A.J. Griffin struck out looking.
T_Chatwood,4338,C Seager,1362,2016-08-04,Corey Seager flied out to left (Fliner (Fly)).
T_Chatwood,4338,A Pagan,2918,2016-04-12,Angel Pagan reached on fielder's choice to shortstop (Grounder). Brandon Crawford out at second.
T_Chatwood,4338,H Kendrick,4229,2016-08-04,Howie Kendrick grounded out to second (Grounder).
T_Chatwood,4338,B Crawford,5343,2016-07-05,Brandon Crawford struck out swinging.
T_Chatwood,4338,D Norris,6867,2016-06-11,Derek Norris reached on fielder's choice to pitcher (Grounder). Alexei Ramirez out at second.
T_Chatwood,4338,P Goldschmidt,9218,2016-04-06,Paul Goldschmidt lined out to shortstop (Liner).
T_Chatwood,4338,C Gillaspie,9009,2016-07-05,Conor Gillaspie grounded out to second (Grounder).
T_Chatwood,4338,N Ahmed,1214,2016-04-06,Nick Ahmed flied out to right (Fly).
T_Chatwood,4338,K Bryant,1542,2016-04-17,Kris Bryant grounded out to third (Grounder).
T_Chatwood,4338,I Desmond,6885,2016-08-09,Ian Desmond grounded out to shortstop (Grounder).
T_Chatwood,4338,W Castillo,3256,2016-04-29,Welington Castillo flied out to right (Fly).
T_Chatwood,4338,H Kendrick,4229,2016-04-23,Howie Kendrick grounded out to shortstop (Grounder).
T_Chatwood,4338,A Rizzo,3473,2016-04-17,Anthony Rizzo flied out to right (Fliner (Fly)).
T_Chatwood,4338,C Herrmann,9284,2016-05-09,Chris Herrmann grounded out to first (Grounder). Paul Goldschmidt advanced to 3B. Jake Lamb advanced to 2B.
T_Chatwood,4338,B Snell,1354,2016-07-19,Blake Snell struck out swinging.
T_Chatwood,4338,M Kemp,5631,2016-05-04,Matt Kemp grounded out to shortstop (Grounder).
T_Chatwood,4338,J Kang,1718,2016-05-21,Jung Ho Kang flied out to center (Fly).
T_Chatwood,4338,J Samardzija,3254,2016-04-12,Jeff Samardzija flied out to center (Fly).
T_Chatwood,4338,A Toles,1341,2016-09-22,Andrew Toles struck out swinging.
T_Chatwood,4338,F Cervelli,5275,2016-05-21,Francisco Cervelli grounded out to third (Grounder).
T_Chatwood,4338,J Segura,5933,2016-04-29,Jean Segura flied out to center (Fly).
T_Chatwood,4338,Y Cespedes,1311,2016-05-15,Yoenis Cespedes flied out to center (Fliner (Fly)). Asdrubal Cabrera advanced to 3B.
T_Chatwood,4338,C Owings,1003,2016-05-09,Chris Owings flied out to right (Fliner (Fly)).
T_Chatwood,4338,Y Tomas,1717,2016-09-03,Yasmany Tomas struck out swinging.
T_Chatwood,4338,B Posey,9166,2016-05-27,Buster Posey grounded out to shortstop (Grounder).
T_Chatwood,4338,B Drury,1161,2016-04-06,Brandon Drury grounded out to third (Grounder).
T_Chatwood,4338,J Kang,1718,2016-05-21,Jung Ho Kang flied out to center (Fly).
T_Chatwood,4338,M Duffy,1383,2016-04-12,Matt Duffy lined out to second (Liner).
T_Chatwood,4338,D Fowler,4062,2016-04-17,Dexter Fowler struck out looking.
T_Chatwood,4338,B Drury,1161,2016-04-29,Brandon Drury flied out to second (Fly).
T_Chatwood,4338,W Myers,1004,2016-09-09,Wil Myers grounded out to shortstop (Grounder).
T_Chatwood,4338,J Lamb,1332,2016-04-06,Jake Lamb grounded out to third (Grounder).
T_Chatwood,4338,J Reddick,3892,2016-09-22,Josh Reddick grounded out to shortstop (Grounder). Adrian Gonzalez scored. Yasmani Grandal advanced to 3B.
T_Chatwood,4338,J Jaso,5887,2016-05-21,John Jaso grounded out to shortstop (Grounder).
T_Chatwood,4338,A Pierzynski,746&,2016-07-24,A.J. Pierzynski lined out to shortstop (Fliner (Liner)).
T_Chatwood,4338,G Blanco,3123,2016-05-27,Gregor Blanco flied out to left (Fliner (Fly)).
T_Chatwood,4338,A Pagan,2918,2016-09-28,Angel Pagan reached on fielder's choice to second (Grounder). Hunter Pence out at second.
T_Chatwood,4338,E Johnson,1252,2016-06-11,Erik Johnson grounded out to second (Grounder).
T_Chatwood,4338,K Hernandez,1047,2016-06-06,Kiké Hernandez reached on fielder's choice to shortstop (Grounder). Adrian Gonzalez scored. Howie Kendrick out at second.
T_Chatwood,4338,A Dickerson,1264,2016-09-16,Alex Dickerson struck out swinging.
T_Chatwood,4338,N Ahmed,1214,2016-05-09,Nick Ahmed grounded out to shortstop (Grounder).
T_Chatwood,4338,J Blash,1124,2016-05-04,Jabari Blash struck out swinging.
T_Chatwood,4338,B Posey,9166,2016-09-28,Buster Posey flied out to center (Fly).
T_Chatwood,4338,L Perdomo,1468,2016-09-09,Luis Perdomo out on a dropped third strike.
T_Chatwood,4338,J Lamb,1332,2016-04-29,Jake Lamb struck out swinging.
T_Chatwood,4338,I De Jesus,9886,2016-06-01,Ivan De Jesus struck out looking.
T_Chatwood,4338,A Gonzalez,1908,2016-06-06,Adrian Gonzalez struck out swinging.
T_Chatwood,4338,B Belt,1026,2016-04-12,Brandon Belt grounded out to second (Grounder).
T_Chatwood,4338,T Joseph,1034,2016-07-10,Tommy Joseph grounded out to second (Grounder).
T_Chatwood,4338,W Castillo,3256,2016-09-03,Welington Castillo grounded out to third (Grounder).
T_Chatwood,4338,A Beltre,639&,2016-08-09,Adrian Beltre flied out to first (Fly).
T_Chatwood,4338,J Lamb,1332,2016-04-06,Jake Lamb grounded out to third (Grounder).
T_Chatwood,4338,B Shipley,1515,2016-09-03,Braden Shipley grounded out to third (Grounder).
T_Chatwood,4338,J Baez,1297,2016-04-17,Javier Baez struck out swinging.
T_Chatwood,4338,C Hernandez,1055,2016-08-14,Cesar Hernandez grounded out to second (Grounder).
T_Chatwood,4338,C Hernandez,1055,2016-07-10,Cesar Hernandez reached on fielder's choice to first (Grounder). Tommy Joseph advanced to 3B. Cameron Rupp out at second.
T_Chatwood,4338,Y Tomas,1717,2016-04-29,Yasmany Tomas was caught stealing.
T_Chatwood,4338,D Span,8347,2016-04-12,Denard Span grounded out to first (Grounder).
T_Chatwood,4338,C Utley,1679,2016-04-23,Chase Utley grounded out to first (Grounder).
T_Chatwood,4338,D Span,8347,2016-05-27,Denard Span grounded out to first (Grounder).
T_Chatwood,4338,O Herrera,1147,2016-07-10,Odubel Herrera grounded out to pitcher (Grounder).
T_Chatwood,4338,P Gosselin,1095,2016-09-03,Phil Gosselin grounded out to second (Grounder).
T_Chatwood,4338,T d'Arnaud,7739,2016-07-29,Travis d'Arnaud struck out looking.
T_Chatwood,4338,C Seager,1362,2016-08-04,Corey Seager flied out to center (Fly).
T_Chatwood,4338,J Reddick,3892,2016-08-04,Josh Reddick grounded out to second (Grounder).
T_Chatwood,4338,B Crawford,5343,2016-07-05,Brandon Crawford grounded out to first (Grounder). Brandon Belt advanced to 3B. Buster Posey advanced to 2B.
T_Chatwood,4338,K Bryant,1542,2016-04-17,Kris Bryant struck out swinging.
T_Chatwood,4338,K Hernandez,1047,2016-04-23,Kiké Hernandez grounded out to shortstop (Grounder).
T_Chatwood,4338,S Pearce,9957,2016-07-19,Steve Pearce grounded out to second (Grounder).
T_Chatwood,4338,J Segura,5933,2016-04-06,Jean Segura struck out swinging.
T_Chatwood,4338,R Segedin,1144,2016-09-22,Rob Segedin struck out swinging.
T_Chatwood,4338,M Joyce,3353,2016-05-21,Matt Joyce flied out to left (Fly).
T_Chatwood,4338,H Kendrick,4229,2016-09-22,Howie Kendrick grounded out to shortstop (Grounder).
T_Chatwood,4338,A Rizzo,3473,2016-04-17,Anthony Rizzo flied out to center (Fly).
T_Chatwood,4338,R Howard,2154,2016-08-14,Ryan Howard grounded out to shortstop (Grounder).
T_Chatwood,4338,J Lamb,1332,2016-04-29,Jake Lamb flied out to center (Fly).
T_Chatwood,4338,N Ahmed,1214,2016-05-09,Nick Ahmed struck out swinging.
T_Chatwood,4338,J Pederson,1189,2016-08-04,Joc Pederson struck out swinging.
T_Chatwood,4338,M Conforto,1637,2016-07-29,Michael Conforto flied out to left (Fly).
T_Chatwood,4338,Y Solarte,5352,2016-09-09,Yangervis Solarte struck out looking.
T_Chatwood,4338,N Walker,7539,2016-05-15,Neil Walker grounded out to shortstop (Grounder).
T_Chatwood,4338,I Desmond,6885,2016-08-09,Ian Desmond struck out swinging.
T_Chatwood,4338,D Fowler,4062,2016-04-17,Dexter Fowler grounded out to third (Grounder).
T_Chatwood,4338,A Gonzalez,1908,2016-04-23,Adrian Gonzalez struck out swinging.
T_Chatwood,4338,A Toles,1341,2016-09-22,Andrew Toles grounded out to first (Grounder). Chase Utley advanced to 2B.
T_Chatwood,4338,E Inciarte,4922,2016-07-24,Ender Inciarte grounded out to second (Grounder).
T_Chatwood,4338,D Dietrich,1054,2016-06-18,Derek Dietrich singled to right (Grounder). Derek Dietrich out.
T_Chatwood,4338,D Span,8347,2016-09-28,Denard Span was caught stealing.
T_Chatwood,4338,T Jankowski,1376,2016-09-09,Travis Jankowski struck out looking.
T_Chatwood,4338,C d'Arnaud,6652,2016-07-24,Chase d'Arnaud grounded out to shortstop (Grounder).
T_Chatwood,4338,J Heyward,4940,2016-04-17,Jason Heyward grounded out to pitcher (Grounder).
T_Chatwood,4338,O Herrera,1147,2016-07-10,Odubel Herrera flied out to center (Fliner (Fly)).
T_Chatwood,4338,A Gonzalez,1908,2016-09-22,Adrian Gonzalez flied out to right (Fly).
T_Chatwood,4338,S Marte,9241,2016-05-21,Starling Marte grounded out to third (Grounder).
T_Chatwood,4338,L Sardinas,1315,2016-09-16,Luis Sardinas flied out to left (Fly).
T_Chatwood,4338,C Owings,1003,2016-04-06,Chris Owings reached on fielder's choice to shortstop (Grounder). Patrick Corbin scored. Nick Ahmed advanced to 3B. Jean Segura out at second.
T_Chatwood,4338,C Friedrich,7942,2016-09-16,Christian Friedrich struck out swinging.
T_Chatwood,4338,R Pena,8841,2016-07-05,Ramiro Pena flied out to right (Fliner (Fly)).
T_Chatwood,4338,T Jenkins,1137,2016-07-24,Tyrell Jenkins grounded out to third (Grounder).
T_Chatwood,4338,A Bradley,1291,2016-05-09,Archie Bradley struck out looking.
T_Chatwood,4338,A Pagan,2918,2016-07-05,Angel Pagan struck out swinging.
T_Chatwood,4338,M Duffy,1383,2016-04-12,Matt Duffy flied out to right (Fliner (Liner)).
T_Chatwood,4338,C Seager,1362,2016-04-23,Corey Seager flied out to center (Fly).
T_Chatwood,4338,J Niese,4424,2016-05-21,Jon Niese grounded out to shortstop (Grounder).
T_Chatwood,4338,S Matz,1336,2016-07-29,Steven Matz sacrificed to first (Bunt Grounder). Michael Conforto advanced to 2B.
T_Chatwood,4338,R Cabrera,1032,2016-06-01,Ramon Cabrera flied out to center (Fliner (Fly)).
T_Chatwood,4338,W Flores,5827,2016-07-29,Wilmer Flores struck out swinging.
T_Chatwood,4338,F Cervelli,5275,2016-05-21,Francisco Cervelli grounded out to second (Grounder). Jung Ho Kang advanced to 3B.
T_Chatwood,4338,B Miller,1277,2016-07-19,Brad Miller grounded out to shortstop (Grounder). Logan Forsythe advanced to 3B.
T_Chatwood,4338,A Cabrera,4962,2016-05-15,Asdrubal Cabrera grounded out to third (Grounder).
T_Chatwood,4338,F Galvis,6609,2016-07-10,Freddy Galvis out on a dropped third strike.
T_Chatwood,4338,A Pollock,9256,2016-09-03,A.J. Pollock grounded out to third (Grounder).
T_Chatwood,4338,K Kiermaier,1103,2016-07-19,Kevin Kiermaier grounded out to second (Grounder).
T_Chatwood,4338,B Drury,1161,2016-04-06,Brandon Drury lined out to second (Liner).
T_Chatwood,4338,L Duda,2502,2016-05-15,Lucas Duda grounded out to second (Grounder).
T_Chatwood,4338,J Lamb,8493,2016-06-01,John Lamb grounded out to shortstop (Grounder).
T_Chatwood,4338,D Ross,1551,2016-04-17,David Ross struck out looking.
T_Chatwood,4338,A Cabrera,4962,2016-05-15,Asdrubal Cabrera struck out swinging.
T_Chatwood,4338,B Posey,9166,2016-07-05,Buster Posey grounded out to second (Grounder). Jarrett Parker advanced to 3B.
T_Chatwood,4338,Y Cespedes,1311,2016-07-29,Yoenis Cespedes flied out to right (Fliner (Fly)).
T_Chatwood,4338,J Harrison,8202,2016-05-21,Josh Harrison grounded out to second (Grounder).
T_Chatwood,4338,B Posey,9166,2016-05-27,Buster Posey lined out to second (Liner).
T_Chatwood,4338,J Lamb,1332,2016-04-29,Jake Lamb flied out to center (Fliner (Fly)).
T_Chatwood,4338,A Ramirez,5133,2016-05-04,Alexei Ramirez grounded out to shortstop (Grounder).
T_Chatwood,4338,H Sanchez,1028,2016-09-09,Hector Sanchez flied out to left (Fly).
T_Chatwood,4338,J Panik,1193,2016-09-28,Joe Panik grounded out to first (Grounder).
T_Chatwood,4338,J Heyward,4940,2016-04-17,Jason Heyward struck out swinging.
T_Chatwood,4338,A Altherr,1127,2016-08-14,Aaron Altherr struck out swinging.
T_Chatwood,4338,A Pierzynski,746&,2016-07-24,A.J. Pierzynski struck out looking.
T_Chatwood,4338,F Freeman,5361,2016-07-24,Freddie Freeman struck out swinging.
T_Chatwood,4338,W Myers,1004,2016-05-04,Wil Myers struck out swinging.
T_Chatwood,4338,P Corbin,9323,2016-04-06,Patrick Corbin grounded out to third (Grounder).
T_Chatwood,4338,J Panik,1193,2016-09-28,Joe Panik lined out to shortstop (Liner).
T_Chatwood,4338,B Zobrist,7435,2016-04-17,Ben Zobrist flied out to left (Fly).
T_Chatwood,4338,W Myers,1004,2016-06-11,Wil Myers grounded out to first (Grounder).
T_Chatwood,4338,A Dickerson,1264,2016-09-09,Alex Dickerson grounded out to second (Grounder).
T_Chatwood,4338,Z Cozart,2616,2016-06-01,Zack Cozart flied out to right (Fly).
T_Chatwood,4338,H Pence,8252,2016-09-28,Hunter Pence struck out swinging.
T_Chatwood,4338,R Schimpf,9953,2016-09-09,Ryan Schimpf flied out to right (Fliner (Liner)).
T_Chatwood,4338,G Blanco,3123,2016-05-27,Gregor Blanco flied out to left (Fliner (Fly)).
T_Chatwood,4338,A Cabrera,4962,2016-07-29,Asdrubal Cabrera flied out to second (Fly).
T_Chatwood,4338,J Segura,5933,2016-05-09,Jean Segura flied out to center (Fliner (Liner)).
T_Chatwood,4338,Y Tomas,1717,2016-04-29,Yasmany Tomas grounded out to pitcher (Grounder).
T_Chatwood,4338,B Belt,1026,2016-04-12,Brandon Belt grounded out to pitcher (Grounder).
T_Chatwood,4338,K Plawecki,1380,2016-05-15,Kevin Plawecki grounded out to pitcher (Grounder).
T_Chatwood,4338,H Pence,8252,2016-04-12,Hunter Pence grounded out to shortstop (Grounder).
T_Chatwood,4338,M Duffy,1383,2016-05-27,Matt Duffy flied out to left (Fly).
T_Chatwood,4338,C Beltran,589&,2016-08-09,Carlos Beltran grounded out to third (Grounder).
T_Chatwood,4338,P Goldschmidt,9218,2016-09-03,Paul Goldschmidt flied out to center (Fliner (Liner)).
T_Chatwood,4338,A Griffin,1113,2016-08-09,A.J. Griffin struck out looking.
T_Chatwood,4338,D Peralta,2136,2016-04-29,David Peralta grounded out to first (Grounder).
T_Chatwood,4338,J Loney,4556,2016-07-29,James Loney grounded out to second (Grounder).
T_Chatwood,4338,D Span,8347,2016-09-28,Denard Span out on a dropped third strike.
T_Chatwood,4338,J Harrison,8202,2016-05-21,Josh Harrison grounded out to pitcher (Grounder).
T_Chatwood,4338,C Friedrich,7942,2016-09-16,Christian Friedrich struck out looking.
T_Chatwood,4338,J Turner,5235,2016-06-06,Justin Turner flied out to right (Fly).
T_Chatwood,4338,M Franco,1217,2016-08-14,Maikel Franco grounded out to pitcher (Grounder).
T_Chatwood,4338,W Myers,1004,2016-09-09,Wil Myers grounded out to third (Grounder).
T_Chatwood,4338,F Freeman,5361,2016-07-24,Freddie Freeman struck out swinging.
T_Chatwood,4338,M Bumgarner,5524,2016-07-05,Madison Bumgarner struck out swinging.
T_Chatwood,4338,J Bruce,9892,2016-06-01,Jay Bruce flied out to center (Fly).
T_Chatwood,4338,A Toles,1341,2016-09-22,Andrew Toles flied out to shortstop (Fly).
T_Chatwood,4338,S Pearce,9957,2016-07-19,Steve Pearce grounded out to third (Grounder). Corey Dickerson advanced to 2B.
T_Chatwood,4338,C Beltran,589&,2016-08-09,Carlos Beltran grounded out to second (Grounder).
T_Chatwood,4338,A Gonzalez,1908,2016-04-23,Adrian Gonzalez grounded out to shortstop (Grounder). Corey Seager scored. Yasiel Puig advanced to 3B.
T_Chatwood,4338,P Gosselin,1095,2016-09-03,Phil Gosselin flied out to center (Fly).
T_Chatwood,4338,S Van Slyke,4365,2016-06-06,Scott Van Slyke fouled out to third (Fly).
T_Chatwood,4338,Y Tomas,1717,2016-09-03,Yasmany Tomas struck out swinging.
T_Chatwood,4338,R Chirinos,3142,2016-08-09,Robinson Chirinos hit a sacrifice fly to center (Fly). Elvis Andrus scored.
T_Chatwood,4338,J Votto,4314,2016-06-01,Joey Votto grounded out to first (Grounder). Zack Cozart scored. Billy Hamilton advanced to 3B.
T_Chatwood,4338,J Turner,5235,2016-06-06,Justin Turner flied out to right (Fliner (Fly)).
T_Chatwood,4338,K Hernandez,1047,2016-06-06,Kiké Hernandez flied out to center (Fliner (Liner)).
T_Chatwood,4338,L Sardinas,1315,2016-09-16,Luis Sardinas reached on fielder's choice to shortstop (Grounder). Ryan Schimpf scored. Alex Dickerson out at second.
T_Chatwood,4338,C Owings,1003,2016-09-03,Chris Owings singled to left (Grounder).
T_Chatwood,4338,N Markakis,5930,2016-07-24,Nick Markakis walked. Jace Peterson advanced to 2B.
T_Chatwood,4338,A Ellis,5677,2016-06-06,A.J. Ellis walked.
T_Chatwood,4338,M Franco,1217,2016-08-14,Maikel Franco walked.
T_Chatwood,4338,O Arcia,1030,2016-07-19,Oswaldo Arcia singled to right (Grounder).
T_Chatwood,4338,E Inciarte,4922,2016-07-24,Ender Inciarte advanced on a stolen base to 2B.
T_Chatwood,4338,C Utley,1679,2016-04-23,Chase Utley singled to right (Liner).
T_Chatwood,4338,A Ellis,5677,2016-06-06,A.J. Ellis was intentionally walked.
T_Chatwood,4338,R Howard,2154,2016-08-14,Ryan Howard was intentionally walked.
T_Chatwood,4338,E Aybar,4082,2016-07-24,Erick Aybar walked.
T_Chatwood,4338,M Bumgarner,5524,2016-07-05,Madison Bumgarner walked.
T_Chatwood,4338,A Pagan,2918,2016-09-28,Angel Pagan advanced on a wild pitch to 2B.
T_Chatwood,4338,B Snell,1354,2016-07-19,Blake Snell walked. Oswaldo Arcia advanced to 2B.
T_Chatwood,4338,P Goldschmidt,9218,2016-04-29,Paul Goldschmidt walked.
T_Chatwood,4338,E Andrus,8709,2016-08-09,Elvis Andrus advanced on a wild pitch to 3B.
T_Chatwood,4338,J Pederson,1189,2016-09-22,Joc Pederson walked.
T_Chatwood,4338,W Castillo,3256,2016-04-29,Welington Castillo singled to right (Fliner (Liner)).
T_Chatwood,4338,F Galvis,6609,2016-07-10,Freddy Galvis singled to right (Fliner (Liner)).
T_Chatwood,4338,J Jaso,5887,2016-05-21,John Jaso singled to right (Liner).
T_Chatwood,4338,J Samardzija,3254,2016-04-12,Jeff Samardzija doubled to right (Fliner (Liner)).
T_Chatwood,4338,B Drury,1161,2016-05-09,Brandon Drury walked.
T_Chatwood,4338,C Hernandez,1055,2016-08-14,Cesar Hernandez advanced on a stolen base to 2B.
T_Chatwood,4338,M Upton Jr.,5015,2016-05-04,Melvin Upton Jr. walked.
T_Chatwood,4338,K Hernandez,1047,2016-04-23,Kiké Hernandez walked. Corey Seager advanced to 3B. Howie Kendrick advanced to 2B.
T_Chatwood,4338,A Pagan,2918,2016-04-12,Angel Pagan singled to left (Grounder). Brandon Crawford advanced to 2B.
T_Chatwood,4338,R Schimpf,9953,2016-09-16,Ryan Schimpf was hit by a pitch.
T_Chatwood,4338,F Galvis,6609,2016-08-14,Freddy Galvis walked. Cameron Rupp advanced to 2B.
T_Chatwood,4338,D Norris,6867,2016-09-16,Derek Norris singled to center (Fliner (Liner)).
T_Chatwood,4338,M Conforto,1637,2016-07-29,Michael Conforto walked. Neil Walker advanced to 2B.
T_Chatwood,4338,M Franco,1217,2016-07-10,Maikel Franco singled to right (Grounder). Freddy Galvis advanced to 2B.
T_Chatwood,4338,K Plawecki,1380,2016-05-15,Kevin Plawecki singled to center (Grounder).
T_Chatwood,4338,J Votto,4314,2016-06-01,Joey Votto singled to left (Fliner (Liner)).
T_Chatwood,4338,A Gonzalez,1908,2016-08-04,Adrian Gonzalez singled to shortstop (Grounder). Justin Turner advanced to 3B.
T_Chatwood,4338,G Stanton,4949,2016-06-18,Giancarlo Stanton singled to right (Grounder). Christian Yelich advanced to 3B.
T_Chatwood,4338,C Hernandez,1055,2016-08-14,Cesar Hernandez walked.
T_Chatwood,4338,C Seager,1362,2016-04-23,Corey Seager walked.
T_Chatwood,4338,C Owings,1003,2016-04-29,Chris Owings doubled to center (Fliner (Fly)).
T_Chatwood,4338,T Jankowski,1376,2016-09-16,Travis Jankowski doubled to center (Grounder).
T_Chatwood,4338,C Seager,1362,2016-04-23,Corey Seager singled to left (Liner).
T_Chatwood,4338,C d'Arnaud,6652,2016-07-24,Chase d'Arnaud walked.
T_Chatwood,4338,S Marte,9241,2016-05-21,Starling Marte singled to right (Grounder). John Jaso advanced to 2B.
T_Chatwood,4338,P Gosselin,1095,2016-09-03,Phil Gosselin singled to center (Grounder).
T_Chatwood,4338,W Castillo,3256,2016-05-09,Welington Castillo doubled to center (Fliner (Fly)).
T_Chatwood,4338,Y Grandal,1136,2016-08-04,Yasmani Grandal singled to center (Fliner (Liner)).
T_Chatwood,4338,C Rupp,1114,2016-08-14,Cameron Rupp reached on error to third (Grounder). Error by Nolan Arenado.
T_Chatwood,4338,J Panik,1193,2016-05-27,Joe Panik singled to center (Grounder). Denard Span advanced to 3B.
T_Chatwood,4338,J Harrison,8202,2016-05-21,Josh Harrison walked. Matt Joyce advanced to 2B.
T_Chatwood,4338,E Campbell,6938,2016-05-15,Eric Campbell walked. Kevin Plawecki advanced to 2B.
T_Chatwood,4338,E Inciarte,4922,2016-07-24,Ender Inciarte walked.
T_Chatwood,4338,B Crawford,5343,2016-04-12,Brandon Crawford singled to left (Liner).
T_Chatwood,4338,W Myers,1004,2016-09-16,Wil Myers singled to left (Grounder).
T_Chatwood,4338,J Baez,1297,2016-04-17,Javier Baez singled to left (Liner). Jorge Soler advanced to 2B.
T_Chatwood,4338,J deGrom,1095,2016-05-15,Jacob deGrom walked.
T_Chatwood,4338,J Realmuto,1173,2016-06-18,J.T. Realmuto reached on dropped third strike (wp).
T_Chatwood,4338,B Posey,9166,2016-07-05,Buster Posey walked. Brandon Belt advanced to 2B.
T_Chatwood,4338,Z Cozart,2616,2016-06-01,Zack Cozart singled to left (Grounder).
T_Chatwood,4338,C Utley,1679,2016-08-04,Chase Utley singled to center (Fliner (Liner)).
T_Chatwood,4338,A Pollock,9256,2016-09-03,A.J. Pollock singled to left (Grounder). Phil Gosselin advanced to 2B.
