playername,playerid,vsname,vsid,date,Play
T_Watson,3132,B Posey,9166,2016-08-17,Buster Posey grounded into a double play to shortstop (Grounder). Eduardo Nunez scored. Angel Pagan advanced to 3B. Brandon Belt out at second.
T_Watson,3132,D Span,8347,2016-08-16,Denard Span grounded out to second (Grounder).
T_Watson,3132,B Crawford,5343,2016-08-17,Brandon Crawford flied out to center (Fliner (Fly)).
T_Watson,3132,R Grichuk,1024,2016-05-06,Randal Grichuk grounded out to shortstop (Grounder).
T_Watson,3132,B Moss,4467,2016-05-06,Brandon Moss struck out swinging.
T_Watson,3132,F Galvis,6609,2016-07-24,Freddy Galvis fouled out to first (Fly).
T_Watson,3132,T Turner,1625,2016-09-23,Trea Turner struck out swinging.
T_Watson,3132,M Maldonado,6887,2016-08-25,Martin Maldonado grounded out to first (Grounder).
T_Watson,3132,S Vogt,5000,2016-07-02,Stephen Vogt grounded out to shortstop (Grounder).
T_Watson,3132,M Trout,1015,2016-06-05,Mike Trout flied out to shortstop (Fliner (Fly)).
T_Watson,3132,C Bethancourt,1002,2016-08-09,Christian Bethancourt grounded into a double play to third (Grounder). Alexei Ramirez out at second.
T_Watson,3132,J Francoeur,4792,2016-08-02,Jeff Francoeur reached on fielder's choice to third (Grounder). Gordon Beckham out at second.
T_Watson,3132,N Hundley,3376,2016-04-27,Nick Hundley struck out swinging.
T_Watson,3132,M Holliday,1873,2016-04-05,Matt Holliday struck out swinging.
T_Watson,3132,B Barnes,629&,2016-04-27,Brandon Barnes flied out to center (Fly).
T_Watson,3132,T Pham,2967,2016-09-07,Tommy Pham fouled out to second (Fly).
T_Watson,3132,C Gonzalez,7287,2016-05-20,Carlos Gonzalez reached on fielder's choice to pitcher (Grounder). Nolan Arenado out at second.
T_Watson,3132,C Robinson,6908,2016-07-17,Clint Robinson struck out looking.
T_Watson,3132,F Freeman,5361,2016-08-02,Freddie Freeman flied out to right (Fly).
T_Watson,3132,N Arenado,9777,2016-04-27,Nolan Arenado struck out swinging.
T_Watson,3132,K Plawecki,1380,2016-06-08,Kevin Plawecki struck out swinging.
T_Watson,3132,M Reynolds,7619,2016-05-20,Mark Reynolds grounded out to third (Grounder).
T_Watson,3132,N Ahmed,1214,2016-04-22,Nick Ahmed grounded out to pitcher (Grounder).
T_Watson,3132,T Story,1256,2016-05-20,Trevor Story struck out looking.
T_Watson,3132,Y Molina,7007,2016-05-06,Yadier Molina grounded out to third (Grounder). Stephen Piscotty advanced to 3B. Kolten Wong advanced to 2B.
T_Watson,3132,B Moss,4467,2016-09-06,Brandon Moss lined out to first (Liner).
T_Watson,3132,J Villar,1007,2016-08-26,Jonathan Villar struck out swinging.
T_Watson,3132,S Gennett,1033,2016-08-25,Scooter Gennett struck out looking.
T_Watson,3132,T Barnhart,1020,2016-08-05,Tucker Barnhart sacrificed to pitcher (Bunt Fly). Eugenio Suarez advanced to 2B.
T_Watson,3132,J Votto,4314,2016-09-16,Joey Votto struck out swinging.
T_Watson,3132,Z Cozart,2616,2016-05-11,Zack Cozart grounded out to second (Grounder).
T_Watson,3132,S Drew,4251,2016-07-17,Stephen Drew grounded out to second (Grounder).
T_Watson,3132,C Adames,6013,2016-05-21,Cristhian Adames flied out to second (Fly).
T_Watson,3132,G Stanton,4949,2016-06-01,Giancarlo Stanton grounded out to second (Grounder).
T_Watson,3132,M Kemp,5631,2016-08-02,Matt Kemp struck out swinging.
T_Watson,3132,J Heyward,4940,2016-08-29,Jason Heyward flied out to second (Fly).
T_Watson,3132,N Ahmed,1214,2016-04-24,Nick Ahmed fouled out to first (Fly).
T_Watson,3132,R Grichuk,1024,2016-07-06,Randal Grichuk flied out to right (Fliner (Fly)).
T_Watson,3132,D Espinosa,9219,2016-09-23,Danny Espinosa flied out to left (Fly).
T_Watson,3132,B Posey,9166,2016-06-22,Buster Posey reached on fielder's choice to third (Grounder). Denard Span out at third. Brandon Belt advanced to 2B.
T_Watson,3132,T Goeddel,1318,2016-07-23,Tyler Goeddel flied out to right (Fly).
T_Watson,3132,M Trout,1015,2016-06-04,Mike Trout flied out to shortstop (Fly).
T_Watson,3132,J Votto,4314,2016-08-06,Joey Votto grounded out to first (Grounder).
T_Watson,3132,B Hamilton,1019,2016-05-11,Billy Hamilton grounded out to shortstop (Grounder).
T_Watson,3132,W Contreras,1160,2016-08-29,Willson Contreras grounded out to second (Grounder).
T_Watson,3132,Y Puig,1422,2016-06-24,Yasiel Puig flied out to center (Fly).
T_Watson,3132,C Johnson,1191,2016-06-01,Chris Johnson struck out swinging.
T_Watson,3132,N Walker,7539,2016-06-07,Neil Walker flied out to center (Fly).
T_Watson,3132,S Gennett,1033,2016-08-26,Scooter Gennett lined out to first (Liner).
T_Watson,3132,M Pina,2829,2016-09-21,Manny Pina flied out to center (Fly).
T_Watson,3132,B Hamilton,1019,2016-08-05,Billy Hamilton struck out swinging.
T_Watson,3132,B Drury,1161,2016-04-22,Brandon Drury grounded out to shortstop (Grounder).
T_Watson,3132,J Gyorko,1081,2016-07-06,Jedd Gyorko flied out to left (Fliner (Fly)).
T_Watson,3132,B Phillips,791&,2016-05-11,Brandon Phillips grounded out to second (Grounder).
T_Watson,3132,A Diaz,1593,2016-05-08,Aledmys Diaz struck out swinging.
T_Watson,3132,M Carpenter,8090,2016-04-06,Matt Carpenter grounded out to second (Grounder).
T_Watson,3132,M Reed,1322,2016-09-20,Michael Reed struck out swinging.
T_Watson,3132,J Panik,1193,2016-06-20,Joe Panik struck out swinging.
T_Watson,3132,K Davis,9112,2016-07-03,Khris Davis struck out swinging.
T_Watson,3132,M Carpenter,8090,2016-04-05,Matt Carpenter sacrificed to third (Bunt Grounder). Kolten Wong advanced to 2B.
T_Watson,3132,K Hernandez,1047,2016-06-25,Kiké Hernandez struck out swinging.
T_Watson,3132,J Turner,5235,2016-06-25,Justin Turner struck out swinging.
T_Watson,3132,J Hazelbaker,9399,2016-04-03,Jeremy Hazelbaker struck out looking.
T_Watson,3132,R Cabrera,1032,2016-09-09,Ramon Cabrera sacrificed to third (Bunt Grounder). Eugenio Suarez advanced to 2B.
T_Watson,3132,C Gillaspie,9009,2016-06-22,Conor Gillaspie grounded out to second (Grounder).
T_Watson,3132,J Heyward,4940,2016-07-08,Jason Heyward flied out to first (Fly).
T_Watson,3132,A Cabrera,4962,2016-06-14,Asdrubal Cabrera grounded out to third (Grounder).
T_Watson,3132,B Belt,1026,2016-08-15,Brandon Belt struck out swinging.
T_Watson,3132,Z Cozart,2616,2016-04-29,Zack Cozart flied out to right (Fly).
T_Watson,3132,G Garcia,1095,2016-07-06,Greg Garcia grounded out to shortstop (Grounder).
T_Watson,3132,M Adams,9393,2016-07-05,Matt Adams flied out to center (Fly).
T_Watson,3132,J Giavotella,6740,2016-06-05,Johnny Giavotella struck out swinging.
T_Watson,3132,P Bourjos,2578,2016-09-13,Peter Bourjos struck out looking.
T_Watson,3132,M Carpenter,8090,2016-04-03,Matt Carpenter flied out to left (Fly).
T_Watson,3132,M Conforto,1637,2016-06-07,Michael Conforto grounded out to second (Grounder).
T_Watson,3132,C Utley,1679,2016-06-24,Chase Utley grounded out to first (Grounder).
T_Watson,3132,C Seager,1362,2016-08-12,Corey Seager flied out to left (Fly).
T_Watson,3132,R Cabrera,1032,2016-09-17,Ramon Cabrera grounded out to first (Grounder).
T_Watson,3132,Y Tomas,1717,2016-04-22,Yasmany Tomas struck out swinging.
T_Watson,3132,J Marisnick,1133,2016-08-24,Jake Marisnick flied out to center (Fliner (Liner)).
T_Watson,3132,B Crawford,5343,2016-08-15,Brandon Crawford grounded out to first (Grounder). Angel Pagan advanced to 2B.
T_Watson,3132,B Phillips,791&,2016-08-06,Brandon Phillips struck out swinging.
T_Watson,3132,E Suarez,1255,2016-04-29,Eugenio Suarez flied out to right (Fly).
T_Watson,3132,G Springer,1285,2016-08-24,George Springer flied out to second (Fly).
T_Watson,3132,J Gyorko,1081,2016-05-08,Jedd Gyorko grounded out to shortstop (Grounder).
T_Watson,3132,M Adams,9393,2016-04-03,Matt Adams struck out swinging.
T_Watson,3132,J Elmore,7290,2016-07-30,Jake Elmore grounded out to pitcher (Grounder).
T_Watson,3132,S Selsky,1295,2016-09-17,Steve Selsky struck out swinging.
T_Watson,3132,Y Cespedes,1311,2016-06-14,Yoenis Cespedes grounded out to second (Grounder).
T_Watson,3132,M Szczur,1125,2016-09-28,Matt Szczur grounded out to first (Grounder).
T_Watson,3132,T Story,1256,2016-05-23,Trevor Story struck out swinging.
T_Watson,3132,T Collins,1272,2016-04-14,Tyler Collins grounded out to first (Grounder).
T_Watson,3132,M Moreland,3086,2016-05-28,Mitch Moreland flied out to second (Fly).
T_Watson,3132,R Cano,3269,2016-06-29,Robinson Cano flied out to center (Fliner (Liner)).
T_Watson,3132,G Garcia,1095,2016-09-05,Greg Garcia grounded into a double play to second (Grounder). Jedd Gyorko out at second.
T_Watson,3132,K Seager,9785,2016-06-29,Kyle Seager grounded out to second (Grounder).
T_Watson,3132,A Pagan,2918,2016-08-15,Angel Pagan advanced on a passed ball to 3B. Passed ball by Francisco Cervelli.
T_Watson,3132,K Broxton,9253,2016-07-30,Keon Broxton singled to right (Grounder). Ramon Flores advanced to 2B.
T_Watson,3132,H Pence,8252,2016-08-15,Hunter Pence walked.
T_Watson,3132,W Contreras,1160,2016-09-28,Willson Contreras doubled to center (Fliner (Fly)).
T_Watson,3132,S Robinson,4249,2016-06-04,Shane Robinson walked.
T_Watson,3132,M Cabrera,1744,2016-04-11,Miguel Cabrera walked.
T_Watson,3132,B Belt,1026,2016-06-22,Brandon Belt singled to left (Liner). Denard Span advanced to 2B.
T_Watson,3132,C Walsh,1096,2016-04-16,Colin Walsh walked.
T_Watson,3132,D Span,8347,2016-06-22,Denard Span singled to center (Fliner (Liner)).
T_Watson,3132,D Dietrich,1054,2016-06-01,Derek Dietrich was hit by a pitch.
T_Watson,3132,J Baez,1297,2016-07-08,Javier Baez walked.
T_Watson,3132,C Gonzalez,7287,2016-04-27,Carlos Gonzalez singled to center (Grounder).
T_Watson,3132,H Perez,5751,2016-09-21,Hernan Perez singled to second (Grounder).
T_Watson,3132,I Kinsler,6195,2016-04-14,Ian Kinsler advanced on a stolen base to 2B.
T_Watson,3132,C Carter,9911,2016-08-28,Chris Carter singled to left (Grounder).
T_Watson,3132,Y Escobar,4191,2016-06-04,Yunel Escobar doubled to center (Fliner (Fly)). Shane Robinson scored.
T_Watson,3132,J Martinez,6184,2016-04-14,J.D. Martinez hit a sacrifice fly to right (Fly). Ian Kinsler scored.
T_Watson,3132,K Davis,9112,2016-07-02,Khris Davis singled to left (Grounder). Josh Reddick advanced to 2B.
T_Watson,3132,J Votto,4314,2016-04-30,Joey Votto walked.
T_Watson,3132,T Joseph,1034,2016-07-23,Tommy Joseph singled to second (Grounder). Odubel Herrera advanced to 2B.
T_Watson,3132,J Reddick,3892,2016-07-02,Josh Reddick walked.
T_Watson,3132,C Carter,9911,2016-08-26,Chris Carter walked. Ryan Braun advanced to 2B.
T_Watson,3132,C Blackmon,7859,2016-05-21,Charlie Blackmon walked.
T_Watson,3132,R Braun,3410,2016-08-26,Chris Carter advanced on double steal to 2B.
T_Watson,3132,A Pujols,1177,2016-06-04,Albert Pujols singled to center (Fliner (Liner)). Kole Calhoun advanced to 3B on error. Albert Pujols Error by Andrew McCutchen.
T_Watson,3132,N Arenado,9777,2016-05-20,Nolan Arenado walked.
T_Watson,3132,M Maldonado,6887,2016-07-21,Martin Maldonado singled to right (Fliner (Liner)).
T_Watson,3132,Y Molina,7007,2016-09-06,Yadier Molina doubled to left (Fliner (Liner)).
T_Watson,3132,R Weeks Jr.,1849,2016-04-22,Rickie Weeks Jr. reached on error to shortstop (Grounder). David Peralta scored on error. Rickie Weeks Jr. advanced to 2B. Error by Jordy Mercer.
T_Watson,3132,S Piscotty,1336,2016-05-06,Stephen Piscotty was hit by a pitch.
T_Watson,3132,R Cabrera,1032,2016-08-05,Ramon Cabrera hit a sacrifice fly to left (Fliner (Liner)). Eugenio Suarez scored.
T_Watson,3132,E Nunez,6848,2016-08-17,Eduardo Nunez walked.
T_Watson,3132,J Elmore,7290,2016-07-19,Jake Elmore walked.
T_Watson,3132,M Szczur,1125,2016-07-10,Matt Szczur doubled to center (Fliner (Fly)).
T_Watson,3132,T Brown,1389,2016-08-16,Trevor Brown reached on error to shortstop (Grounder). Error by Jordy Mercer.
T_Watson,3132,N Castellanos,1173,2016-04-14,Nick Castellanos homered (Fliner (Fly)). Miguel Cabrera scored.
T_Watson,3132,E Suarez,1255,2016-08-05,Eugenio Suarez walked.
T_Watson,3132,T Holt,1139,2016-09-09,Tyler Holt singled to right (Grounder). Eugenio Suarez advanced to 3B.
T_Watson,3132,J Peraza,1359,2016-09-09,Jose Peraza hit a sacrifice fly to center (Fliner (Liner)). Eugenio Suarez scored. Tyler Holt advanced to 2B.
T_Watson,3132,K Bryant,1542,2016-07-10,Kris Bryant singled to left (Liner). Matt Szczur scored. Kris Bryant advanced to 2B.
T_Watson,3132,A Hechavarria,1045,2016-06-01,Adeiny Hechavarria doubled to center (Fliner (Fly)). Miguel Rojas scored.
T_Watson,3132,M Carpenter,8090,2016-09-06,Matt Carpenter homered (Fly).
T_Watson,3132,J Soler,1422,2016-08-29,Jorge Soler homered (Fly).
